Reference	ID	Tags	SupportReference	Quote	Occurrence	Note
4:39	idm21354					 The Lord is unique, **and there is no other** besides him. This instruction reaffirms the first two commandments (*5:6-8*; *Exod 20:2-4*) and foreshadows the *Shema* (*Deut 6:4-5*). God’s uniqueness had to be underscored because Israel’s neighbors worshiped many gods.\n\n
4:40	idm21365					 More than a promise of individual longevity, **long life** described Israel’s tenure in the land of promise.\n\n
4:41	idm21372					 Moses was ready to set forth the covenant in all its magisterial authority. This section bridges the review of the past (*1:6–4:40*) and the presentation of the covenant text proper (*5:1–26:19*).\n\n
4:41	idm21380					 When Israel settled in Canaan and adopted an urban lifestyle, crimes such as homicide would inevitably need judicial resolution. In order to protect alleged perpetrators from premature vengeance and to guarantee them a fair trial, they needed safe haven in accessible **cities of refuge**. These towns were first assigned east of the Jordan and later in Canaan (see *Num 35:9-28*). The laws governing these matters occur again in *Deut 19:1-13*, but they appear here because of the just-mentioned promise of a long and safe life in the land (*4:40*). Establishing places of refuge to protect the innocent from false accusations would help secure that promise.\n\n
4:43	idm21390					 **Bezer** (probably modern Umm al-‘Amad) lay some six miles east of Heshbon. • **Ramoth in Gilead** was thirty-five miles east-southeast of the Sea of Galilee. • The town of **Golan** was about forty miles north of *Ramoth in Gilead*.\n\n
4:44	idm21400					 **body of instruction** (Hebrew *torah*): The Hebrew noun is derived from the verb *yarah**,* “to teach”; its basic meaning is **instruction**. The Greek Old Testament understands the term to mean “law.” In this context, the term introduces the *body of instruction* in the remainder of Deuteronomy (see *study note on 5:1–26:19*).\n\n
4:48	idm21413					 **Mount Sirion:** The Sidonians used the name *Sirion* for Mount Hermon.\n\n
4:49	idm21421					 **conquered the eastern bank of the Jordan River as far south as the Dead Sea** (Hebrew *took the Arabah on the east side of the Jordan as far as the sea of the Arabah*): The Arabah (“wilderness” or “wasteland”) usually refers to the Great Rift Valley south of the Dead Sea; in Deuteronomy, it also pertains to the lower Jordan Valley (see *1:1*; *3:17*).\n\n
5:1	idm21431					 This section contains the heart of the covenant document, the stipulations. The first subdivision (*5:1–11:32*) sets forth the major stipulations relating especially to the first two commandments (*5:7-10*). The more specific minor stipulations make up the rest of the section.\n\n
5:1	idm21439					 The rest of the covenant laws expand and comment upon the Ten Commandments (*5:6-21*), on which they are based. Moses had first given the Ten Commandments to the people of Israel nearly forty years earlier (*Exod 20:2-17*).\n\n
5:1	idm21447					 **decrees and regulations:** These technical terms describe the stipulations that Israel must obey as the junior partner in the covenant.\n\n
5:9	idm21454					 The children of sinful **parents** are not punished for the wrongdoings of their mothers and fathers, but the sins of any generation have consequences that last for generations (see *2 Sam 12:10*). • The term **reject** (literally *hate*) does not relate to having bitter and hostile feelings but to forsaking a relationship.\n\n
5:10	idm21464					 **who love me:** Those who choose to accept the Lord do not hate or reject him.\n\n
5:11	idm21471					 **misuse the name** (literally *take up the name in vain*): Someone who “takes the name of the Lord in vain” uses it manipulatively to achieve a desired end, uses it thoughtlessly, or takes an oath by God’s name that a falsehood is true.\n\n
5:12	idm21479					 **keeping it holy:** Certain holy days were set apart from others and were given extraordinary significance. On the **Sabbath day***,* the community stopped working and worshiped the Lord (cp. *1 Cor 16:2*; *Heb 10:25*).\n\n
5:15	idm21490					 **That is why:** God commanded Israel to observe a day of rest to remember that God ceased his work of creation on the seventh day (*Exod 20:11*). In Deuteronomy, the Sabbath also celebrated Israel’s release from Egyptian bondage. In the Christian tradition, the first day rather than the seventh is generally set apart to observe the most significant event in Christian history, the resurrection of Jesus Christ (see *study note on Rev 1:10*).\n\n
5:16	idm21499					 Jesus quoted these five commands in response to the question, “What must I do to inherit eternal life?” (*Matt 19:17-19*; *Mark 10:19*; *Luke 18:20*).\n\n
5:16	idm21508					 **Honor:** Since parents are representatives of divine authority, children are to recognize them as worthy of obedience and great respect (cp. *Eph 6:1-3*).\n\n
5:17	idm21516					 **murder:** The Hebrew word can mean either “kill” or “murder.” Killing was permitted in war and as punishment in capital cases, so here it must refer to premeditated homicide. See Jesus’ comments in *Matt 5:21-22*.\n\n
5:18	idm21524					 **adultery:** See Jesus’ comments about adultery in *Matt 5:27-28*.\n\n
5:21	idm21532					 **covet:** This commandment differs from the others because it pertains to a desire rather than to an act. An evil desire is no less offensive to God than an evil deed (see *Matt 5:27-28*).\n\n
5:33	idm21540					 **Stay on the path:** This figure of speech compares the course of life to making a journey. Israel was called to live in such a way that the nation would not be sidetracked from the purposes for which it had been chosen and equipped.\n\n
6:1	idm21547					 Moses here explains how the stipulations in the following sections should be applied and handed on to future generations.\n\n
6:1	idm21553					 Moses added **commands** to **decrees and regulations***,* the usual formula for covenant stipulations (see *4:1*; *5:1*); *commands* is a general term for the whole body of instruction.\n\n
6:2	idm21565					 God’s awesome power and glory (see *4:10*) require that God’s people **fear** him, treating him with respect and reverence (see study notes on *7:21*; *10:12-13*).\n\n
6:3	idm21575					 The **milk and honey** abundant in Canaan represented both agriculture and forage. Compared to the desert fare, Canaan’s food was sumptuous indeed (see *Exod 3:8*, *17*).\n\n
6:4	idm21584					 **Listen** (Hebrew *shema‘*): The *Shema* is the fundamental statement of Israel’s faith. Jesus described these verses as the greatest of the commandments (*Matt 22:34-39*; *Mark 12:28-31*; *Luke 10:25-28*), a sentiment shared by ancient and modern Judaism. The rabbi Hillel (first century BC) spoke of the *Shema* as the central theological idea of the Hebrew Bible (the Old Testament), calling the rest mere commentary.\n\n
6:4	idm21598					 **The** Lord** is our God, the** Lord** alone:** Only God is worthy of worship (*5:7*).\n\n
6:5	idm21610					 **love the** Lord**:** See *study note on Josh 23:11*. • The words **heart, . . . soul, and . . . strength** represent the intellect, the will, the emotions, the spirituality, and the physical being—all that a person is and can do for God. This commandment is the core of God’s covenant with Israel (see Jesus’ comments in *Matt 22:37*; *Mark 12:30*; *Luke 10:27*).\n\n
6:7	idm21624					 **Repeat them:** The Hebrew verb (*shanan*) might suggest “engraving” a text into a medium that cannot be obliterated, or it might simply mean “repeat.” Either way, the teaching of the *Shema* was to be indelibly imparted to children by constant repetition so that it would never be forgotten.\n\n
6:8	idm21633					 **Tie them:** The Lord’s commandments (*6:6*) were to be as interwoven into the hearts and minds of children as though they were tied to them. Eventually, this figurative phrase in Judaism was practiced literally by wrapping the forearm with cords representing the Torah (see *study note on 4:44*). • **wear them:** This figure of speech was represented literally in later Judaism by a small box containing a few brief Torah texts. The box and its contents (Hebrew *tefillin;* Greek *phylactery*) were reminders of the need to teach and obey the covenant (cp. *11:18*; *Matt 23:5*).\n\n
6:9	idm21647					 **Write them on the doorposts:** In later Judaism, people placed portions of Deuteronomy in a small metal case (a *mezuzah*) attached to the doorframes of houses or other buildings. It was customary to touch the *mezuzah* when passing through the doorway to show respect for and dependence upon the Scripture.\n\n
6:13	idm21656					 Jesus quoted this verse when tempted by Satan (*Matt 4:10*; *Luke 4:8*).\n\n
6:16	idm21664					 When Israel journeyed through the Sinai desert after the Exodus, they came to Rephidim, where they found no water (*Exod 17:1-7*). Moses saw the people’s demand for water as testing the Lord; hence the name **Massah** (“testing”) for this place. Jesus quoted this verse to rebut Satan (*Matt 4:7*; *Luke 4:12*).\n\n
6:21	idm21674					 The phrase **his strong hand** is an anthropomorphism (see *study note on 8:2*).\n\n
6:22	idm21682					 The **signs and wonders** were the ten plagues God sent to impress Israel and Egypt with his power when he brought about the Exodus (*Exod 7–12*; see also *Exod 3:20*; *4:5*; *Josh 4:23-24*).\n\n
6:25	idm21693					 **righteous when we obey:** Obedience shows that one is already in a state of righteousness, a standing before God obtained by faith (see *24:13*; *Hab 2:4*; *Rom 1:17*; *4:1-5*; *Gal 3:6-7*; see also *Gen 15:6*; *Eph 2:8-9*). When other nations observed Israel’s commitment to the covenant, they could rightly conclude that Israel was righteous.\n\n
7:1	idm21707					 Before Israel could occupy the land of promise (cp. *Gen 13:14-17*; *15:18-21*), the nations already living there had to be removed. The land was the Lord’s, and only he could determine who the inhabitants should be.\n\n
7:1	idm21715					 The **Hittites** were native to Anatolia (now north-central Turkey). They established colonies in far-flung areas such as Syria and were also linked to Canaan in the list of ancient nations (see *Gen 10:15*; *23:3-20*). The Hittite empire came to a sudden end around 1200 BC, but people known as Hittites continued to live in Israel (e.g., Uriah the Hittite, *2 Sam 11:3*; *23:39*). It is impossible to prove that the Hittites of Anatolia were the same as those mentioned in the OT, but some commonality is probable. • **Girgashites** were an otherwise unknown Canaanite people (*Gen 10:16-17*). • **Amorites:** See *study note on Deut 1:4*. • The **Canaanites** were the native people of Canaan; their habitation there can be traced back to 3000 BC. They descended from Noah’s son Ham (see *Gen 9:18-27*). • The **Perizzites** are not listed in the Table of Nations (*Gen 10:16-17*), so they might not have been related to the Canaanites. • Many scholars identify the **Hivites** as the Horites (or Hurrians; see *study note on Deut 2:1*), a non-Semitic people found throughout the ancient Near East. • The **Jebusites** were associated with Jerusalem (*Judg 1:21*; *2 Sam 5:6-8*). David bought a piece of land from Araunah the Jebusite to build an altar (*2 Sam 24:15-25*); this property later became the site of the Temple (*2 Chr 3:1*).\n\n
7:5	idm21743					 Engraved stone pillars called *stelae* usually represented pagan male deities. These **sacred pillars** were commonly found at shrines dedicated to Baal. • **Asherah poles***,* usually made of wood, represented Canaanite fertility goddesses, particularly Asherah, the mother of the gods. These shrines might have developed as stylized sacred trees associated with fertility (see *study note on 12:2*).\n\n
7:6	idm21754					 Of all peoples on earth, God chose Israel as his **special treasure**. Israel had not done anything commendable; rather, God acted out of grace that was undeserved and freely given.\n\n
7:9	idm21761					 A **faithful God** is absolutely dependable and can be leaned upon. Abraham was commended as being righteous because he believed God; he was wholly dependent upon God’s faithfulness (*Gen 15:6*). • Contrasted with human agents, who often break their pledges, the Lord faithfully **keeps his covenant**.\n\n
7:12	idm21770					 **promised with an oath** (literally *swore*): In a covenant or treaty, the parties to the covenant had to swear to keep its terms in order for it to be valid. God’s promises are always guaranteed by his character (*7:9*; *32:4*; *Heb 6:18*; *Jas 1:17*). He fulfilled the requirements of the covenant with Israel by swearing to keep its terms (see *Gen 22:16*).\n\n
7:15	idm21783					 The **terrible diseases . . . in Egypt** were perhaps illnesses related to the plagues (e.g., *Exod 9:9*) or other serious diseases that regularly afflicted the Egyptians.\n\n
7:19	idm21791					 The familiar word pair **signs and wonders** signifies the miraculous deeds God performed to induce fear in his enemies and to inspire awe and praise in his people (see *6:22*). • **strong hand and powerful arm:** See *study notes on 4:34* and *8:2*.\n\n
7:20	idm21802					 **terror:** Often rendered *the hornet.* Whether God sent stinging insects or some other source of terror, he would expel surviving Canaanites from the land (*Exod 23:28*; *Josh 24:12*).\n\n
7:21	idm21812					 **awesome** (literally *one to be feared*): This fear is not the terror induced by a bully who strikes without reason or plan, but the reverential fear of a loving God whose nature is so majestic that it inspires a kind of dread.\n\n
7:24	idm21820					 **erase their names:** An individual’s name represented that person’s existence as it would be carried into the future through generations of descendants. By destroying an entire nation, God cut off its line of descent and thus also its future. The Canaanites who suffered God’s war against them lost all their descendants and thus their existence and identity.\n\n
7:25	idm21827					 Worship of false gods is **detestable to the** Lord*:* It denies that God is unique and rejects his demand for exclusive worship (*5:7-9*). The horrific and disgusting rituals typically associated with pagan worship were antithetical to God’s holy nature, but Israel was in danger of being led into similar beliefs and practices (*12:31*; *13:12-17*). An Israelite who acknowledged false gods committed an act of treason. The only remedy was complete and total destruction of these **detestable objects.**\n\n
7:26	idm21840					 **set apart for destruction** (Hebrew *kherem*): See *study note on 2:34*.\n\n
8:1	idm21849					 Once Israel inhabited the land, they might have the human tendency to take credit for the blessings that followed. Moses warned the people to guard against a self-congratulatory attitude. God alone is the source of all prosperity and achievement.\n\n
8:2	idm21855					 **to prove your character** (literally *to know what is in your heart*): God already knew the Israelites’ innermost thoughts (*Pss 51:6*; *139:1*, *4*, *23*); he wanted their character to come out in their actions. • **to find out whether:** The Old Testament often describes God in human terms, even in ways that appear to limit God. *Anthropomorphism* (assigning human characteristics to God) and *anthropopathism* (assigning human feelings or emotions to God) are ways of representing God on a human level so the human mind can better grasp his ways, but God is not limited in his knowledge, power, or transcendence. Here, God is figuratively described as having only a human knowledge of the future, but other passages make it clear that God knows everything—past, present, and future (*Ps 139:1-18*; *Heb 4:13*).\n\n
8:3	idm21872					 The word **manna** is derived from the Hebrew words *man hu* (meaning “what is it?”). God miraculously provided this food to teach his people total dependence on him (*Exod 16:1-30*; *Num 11:4-9*). Manna represented the word of God, which is even more essential to life and well-being than food is. • **people do not live by bread alone:** Jesus quoted this phrase to rebut Satan (*Matt 4:4*; *Luke 4:4*).\n\n
8:9	idm21885					 **Iron** was not widely used in this period of the Bronze Age because the process of smelting and working it was known to only a few cultures (see *1 Sam 13:19-21*). The time would come when Israel would exploit this vastly superior metal (see *Josh 17:16-18*; *1 Kgs 6:7*; *2 Kgs 6:5*; *1 Chr 22:3*).\n\n
8:15	idm21897					 **water from the rock!** See *Exod 17:6*; *Num 20:2-13*; see also *Deut 1:37*.\n\n
8:18	idm21907					 This was not **the covenant** that God made with the previous generation of Israelites at Sinai but the one he first made with Abraham (*Gen 15:1-21*; *17:1-21*), then Isaac (*Gen 26:1-5*) and Jacob (*Gen 28:1-4*, *13-15*; *46:1-4*). • In order to be legal and proper, a covenant had to be sworn to with **an oath** that all parties to the agreement uttered. Although by his very nature God could never rescind a promise, he honored the protocol (see *Deut 7:12*).\n\n
9:1	idm21922					 **walls that reach to the sky:** This figurative language emphasizes the impossibility of breaching these walls by human effort alone (*Num 13:28*). If Israel were to enjoy success, God must lead the way and fight the battle (*Deut 9:5*).\n\n
9:3	idm21931					 The graphic metaphor **like a devouring fire** depicts God’s war against his enemies (see *1:30*). God will not just use fire but will himself be a raging inferno, consuming everything in his path. In the end, Israel would simply have to step in and occupy the subdued land.\n\n
9:5	idm21939					 **to fulfill the oath:** In the covenant promises made to the patriarchs, God swore that their descendants would inherit the land of Canaan (*Gen 13:14-17*; *15:18-21*; see *Deut 1:8*; *8:18*).\n\n
9:6	idm21950					 **Stubborn** (literally *stiff-necked*) describes a draft animal that is unwilling to bend its neck to the yoke (*Exod 32:9*; *33:3*, *5*; *Isa 48:4*). Sadly, Israel was not just occasionally stubborn; stubbornness was the nation’s characteristic behavior and attitude.\n\n
9:9	idm21962					 **Covenant** here refers to the promises God made with Israel nearly forty years earlier at Sinai (see *4:13*). • The common biblical expression **forty days and forty nights** represents trial or testing (*Exod 34:28*). Moses’ fast was like Jesus’ fast (*Matt 4:2*). It is physically possible to go without food for forty days, but a person cannot ordinarily survive without water for more than a few days. Moses was directly sustained by God (cp. *Matt 4:11*).\n\n
9:10	idm21974					 Speaking of God’s **own finger** (see *study notes on 4:34* and *8:2*) emphasizes God’s personal interest and involvement in communicating the text of the covenant (*Exod 31:18*; *32:15-16*; *34:1*, *28*).\n\n
9:12	idm21987					 The type of **idol** (from a Hebrew word meaning *cast* or *pour*) mentioned here was formed by pouring liquid metal into a mold (*Exod 32:1-4*). Other idols were made of carved wood, stone, clay, or precious metals hammered in thin sheets over wooden cores.\n\n
9:14	idm21997					 **erase their name:** The Lord threatened to destroy Israel’s identity and existence (see *study note on 7:24*).\n\n
9:16	idm22005					 The gold **calf idol** Israel made at Sinai (*Exod 32*) was probably modeled after bovine deities of Egypt, such as the bull god Apis and the cow goddess Hathor, both associated with fertility. When the Israelites entered Canaan, they would be confronted with the fertility gods of the Canaanite cults. They would be tempted to rely upon these false gods, rather than the one true God, as the source of their blessings (cp. *Deut 8:18-20*).\n\n
9:22	idm22014					 Shortly after Israel left Sinai, the people began to murmur against the Lord so incessantly and bitterly that he sent a fiery judgment to slay some of them at **Taberah** (Taberah means “place of burning”). • Even earlier, the people came to **Massah***,* a place where they tested the Lord to see whether he could supply their need for water (*Massah* means “place of testing”). • At **Kibroth-hattaavah***,* the Israelites demanded food other than manna. The Lord miraculously provided quail, with which they gorged themselves. Many of them paid for this sin of gluttony with their lives. *Kibroth-hattaavah* means “graves of gluttony.”\n\n
9:23	idm22027					 Israel made **Kadesh-barnea** its major headquarters for the thirty-eight years of wandering in the wilderness (see also *study note on 1:19*).\n\n
9:26	idm22035					 The Lord **redeemed** Israel from their bondage in Egypt by his own gracious efforts on their behalf.\n\n
9:27	idm22042					 In Hebrew, the term translated **remember** does not always mean to recall something that has been forgotten, especially when God is the subject (see *study notes on 8:2* and *32:36*). Here the meaning is that God would honor the promises he made to the patriarchs by doing what he said he would do. Appealing to God to remember goes beyond urging him to be aware of a need; it is a petition for him to act in the face of that need (cp. *Luke 23:42-43*).\n\n
10:1	idm22052					 The **Ark** was a gold-plated wooden chest that contained the stone tablets; it was kept in the Most Holy Place in the Tabernacle or Temple (*Exod 25:10*). Later, a pot of manna and Aaron’s flowering rod were also placed in the Ark (*Heb 9:4*). The Ark was the throne upon which the invisible Lord sat on earth among his people (see *study notes on Exod 25:22* and *Lev 16:2*).\n\n
10:3	idm22063					 **acacia wood:** This durable desert tree is probably the species *Acacia raddiana;* it is the only variety that grows large enough in the Negev to produce timber for building.\n\n
10:5	idm22071					 **still there:** Occasionally, phrases such as this one appear in Deuteronomy, indicating that the book received final touches sometime after Moses originally composed it. At the time the book was finally edited, the stone tablets were **still** in the Ark.\n\n
10:12	idm22079					 **fear the** Lord **your God:** The fear of God is not terror from dread of his wrath. Rather, God wanted his people to recognize their finiteness and unworthiness in his divine presence (see *study notes on 7:21* and *Prov 1:7*).\n\n
10:16	idm22090					 **change your hearts** (literally *circumcise the foreskin of your hearts*): This figure of speech encompasses both inward and outward conformity to the covenant (*Gen 17:9-14*; *Rom 2:28-29*).\n\n
10:17	idm22100					 The phrase **God of gods** does not affirm the existence of other gods; rather, it affirms God’s absolute sovereignty over all powers in heaven and earth. The Hebrew *’elohim**,* translated **gods***,* can also refer to angels or other powerful beings (see *Ps 82:1*). • **shows no partiality:** God is not impressed with people who hold power and influence, and therefore he offers them no privileged consideration (see *Deut 1:17*).\n\n
10:18	idm22114					 **foreigners** (literally *sojourners*): “A rabble of non-Israelites” (*Exod 12:38*) came out of Egypt with the Israelites, and others later took up residence in Israel for various reasons. Some of these non-Israelites had no intention of becoming part of the covenant nation, but other foreigners, while not citizens of Israel, were God-fearers or potential proselytes. They lacked full equality with the Israelites and thus were often victims of neglect and discrimination.\n\n
11:4	idm22123					 The common translation **Red Sea** (literally *sea of reeds*) comes from the Greek Old Testament. It was called the “Sea of Reeds” because of the marshy plants that grew along its shores.\n\n
11:6	idm22131					 **Dathan and Abiram:** See *Num 16:1-40*. In the Lord’s administration of his kingdom, he established levels of authority and command that were not to be transgressed. Because the Lord had appointed Moses and Aaron as leaders, the rebellion of Dathan and Abiram against Moses was the same as rebellion against God’s sovereign rule.\n\n
11:8	idm22139					 Moses here appends to the covenant stipulations (chs *5–11*) a list of curses and blessings similar to those that follow the whole covenant text in chs *27–28*.\n\n
11:12	idm22147					 **a land . . . your God cares for:** God’s care included blessing the land with all the resources his people would need to survive and prosper there.\n\n
11:24	idm22154					 **you set foot** (literally *you tread the sole of your foot*): This idea suggests claiming a territory by placing a foot on it or walking through it (see *Gen 13:17*; *Josh 1:3*; *14:9*).\n\n
11:26	idm22165					 In covenant contexts, **a blessing** is the outcome of obedience, while **a curse** is the result of disobedience (see chs *27–28*).\n\n
11:29	idm22174					 **Mount Gerizim** is a prominent hill lying just west of Shechem. In later times, the Samaritans built a temple there (cp. *John 4:20*). • **Mount Ebal** is across the valley from Mount Gerizim, to the east of Shechem.\n\n
11:30	idm22183					 **Gilgal** was the site of the first camp the Israelites would make in Canaan after crossing the Jordan (*Josh 4:19*). It was about two miles northeast of Jericho, although its exact location is no longer certain. A line from Jericho to Shechem would pass near Gilgal. • The **oaks of Moreh** were near Shechem; they were where Abram had set up his first camp in Canaan (*Gen 12:6*) and where Jacob had later buried Laban’s idols (*Gen 35:4*).\n\n
