Reference	ID	Tags	SupportReference	Quote	Occurrence	Note
29:7	idm24061					 **King Sihon of Heshbon***,* ruler of the Amorites, had controlled an area from the Arnon River to the Ammonite border. See *Num 21:31-35*. • **Heshbon:** See *Deut 1:4*; *2:24*. • **King Og of Bashan** had ruled an Amorite kingdom east of the Sea of Galilee (see *3:1*).\n\n
29:8	idm24075					 **Reuben and Gad and . . . the half-tribe of Manasseh** were granted their request to settle in the area east of the Jordan (see *3:12-13*).\n\n
29:11	idm24083					 **foreigners** (literally *sojourners*): See *study note on 10:18*. • The saying **chop your wood and carry your water** was a cliché for any servile work (see *Josh 9:22-27*).\n\n
29:12	idm24094					 The technical phrase **to enter into the covenant** meant subscribing to the terms of the agreement.\n\n
29:15	idm24101					 **future generations:** The covenant made with Moses’ generation was also for generations yet to be born. Abraham’s descendants of the future would have the privileges of the covenant, but they would also need to obey it personally to enjoy its blessings (see *4:9*).\n\n
29:17	idm24109					 The **detestable practices** were abominable manifestations of paganism, especially regarding worship (see *7:25-26*; *12:31*; *13:14*). • **idols:** The Hebrew term, meaning *round things,* probably alludes to dung. These objects were so reprehensible that they were compared to excrement.\n\n
29:18	idm24121					 This metaphor describes idolatry (the **root**), which, if cultivated, would result in idol worship (the **fruit**).\n\n
29:19	idm24129					 An attitude of nonchalance or smugness regarding God’s judgment would **lead to utter ruin**.\n\n
29:20	idm24136					 **erase their names:** To forget the name of a people resulted in eventually forgetting their very existence. The most unspeakable tragedy would be for God to treat the people of Israel as though they had never existed (see *7:24*; *Exod 32:32-33*; *2 Kgs 14:27*).\n\n
29:21	idm24146					 **Book of Instruction** (literally *book of the torah*): Here, this phrase refers to all of Deuteronomy, of which the list of curses (ch *28*) is a part (see *27:3*).\n\n
29:23	idm24156					 **like . . . Sodom and Gomorrah, Admah and Zeboiim:** In the days of Abraham and Lot, these cities were destroyed because of their gross immorality; their destruction was associated with **sulfur and salt** (*Gen 19:23-28*).\n\n
29:25	idm24165					 This explanation anticipates a future when people would look back at Israel’s history of rebellion and easily understand why they were in exile.\n\n
29:27	idm24171					 The phrase **this book** refers at least to Deuteronomy and perhaps to the first five books of the Old Testament (the Pentateuch).\n\n
29:29	idm24178					 **secrets known to no one:** There is an apparent contradiction between God’s covenant promises to Israel on the one hand and Israel’s being sent into exile on the other. What purpose could there be in such a mysterious turn of events? Only God knows. • **the terms of these instructions** (literally *the words of this torah*): See *4:44*; *27:3*.\n\n
30:1	idm24189					 Repentance was the only solution to the threat of judgment. The possibility of blessing and the prevention of judgment both depended on a proper relationship with the Lord.\n\n
30:1	idm24195					 **These blessings and curses:** See *27:1–28:68*.\n\n
30:2	idm24203					 **with all your heart and all your soul:** The expectation of these verses was clearly articulated in the *Shema,* Israel’s great statement of covenant faith and commitment (cp. *6:4*). Obedience to the covenant was a prerequisite necessary for Israel to receive God’s forgiveness and return to its land.\n\n
30:6	idm24212					 **change your heart:** This work of God, initiated by his grace, would result in Israel’s regeneration and identify the nation as the Lord’s true people (see *10:16*; *Jer 4:4*; *Rom 4:1-12*).\n\n
30:11	idm24222					 Adherence to the covenant terms that Moses had outlined would give life; disobedience would surely bring death. Life and death refer to physical, mortal life in the land—of individuals and of the community of Israel.\n\n
30:11	idm24228					 **This command** refers to the whole covenant text, all of Deuteronomy (see *4:2*; *5:29*; *7:9*).\n\n
30:12	idm24238					 **not kept in heaven:** The revelation of God is not known only to him but is accessible to human beings (see *Rom 10:6-8*).\n\n
30:13	idm24246					 **not kept beyond the sea:** God’s purposes are not in the custody of faraway nations but are available to his people (see *Rom 10:6-8*).\n\n
30:14	idm24254					 The message of salvation is objectively close (**on your lips**) and subjectively near (**in your heart**). It is capable of being taught and learned (see *6:6-7*).\n\n
30:16	idm24263					 **love the** Lord** your God:** This paraphrases the *Shema,* Israel’s central covenant affirmation (see *6:5*). To love God means to obey him in every respect, which results in divine blessing.\n\n
30:19	idm24274					 **life and death . . . blessings and curses:** This grammatical structure suggests an equivalence between *life* and *blessing* and between *death* and *curses.* The essence of a blessing is life, and the essence of a curse is death.\n\n
30:20	idm24285					 **the key to your life:** In its most meaningful sense, life consists of absolute commitment to the Lord.\n\n
31:1	idm24292					 For covenant documents to have abiding authority and relevance, they must be kept perpetually in a place where both parties could have easy access to them. The book of Deuteronomy had to be preserved for future reference so that Israel would always be reminded to submit to the Lord’s sovereignty.\n\n
31:1	idm24298					 Moses’ impending death meant that his role as covenant administrator would soon be over. Joshua had to be properly and publicly introduced as his successor with the same authority.\n\n
31:1	idm24304					 Based on the context, **these instructions** refers to all of Deuteronomy (see *1:1*).\n\n
31:3	idm24312					 **The** Lord** . . . will cross over ahead of you:** The conquest would be God’s war. The conflict would be commanded, initiated, and led by the Divine Warrior, the Lord God of Israel (see *1:30*). • From the earliest days of the Sinai wandering (*Exod 17:8*) to the present, **Joshua** had served as Moses’ attendant; now he was divinely appointed as Moses’ successor (see *Deut 1:38*; *3:23-29*; *Num 27:15-23*).\n\n
31:4	idm24327					 **Sihon and Og:** See *study note on 2:24*; *Num 21:21-35*.\n\n
31:6	idm24336					 **He will neither fail you nor abandon you:** This encouragement for Israel on the verge of taking possession of the Promised Land also states a general principle of God’s care for his people (see also *Heb 13:5*).\n\n
31:9	idm24344					 So that future generations in Israel could be reminded of their covenant obligations, the covenant text was to be read publicly. Doing so was a practical necessity in an era when personal copies of documents were not generally available.\n\n
31:9	idm24350					 **Ark of the** Lord**’s Covenant:** This gold-plated wooden chest contained the two stone tablets bearing the text of the Ten Commandments. It was also the Lord’s throne, as he sat there invisibly among his people (see *study note on 10:1*).\n\n
31:10	idm24360					 The **Year of Release** was the **seventh year** of the calendar, not the seventh year of a given transaction between individuals. All debts were to be cancelled and Hebrew bond servants released from obligation to their creditors (see *15:1-3*). • **Festival of Shelters** (also known as the Feast of Tabernacles): The people observed this celebration in the seventh month (*Tishri,* September/October) of every year to commemorate God’s miraculous preservation of Israel in the wilderness. It also celebrated the fall harvest (see *16:13-15*).\n\n
31:12	idm24372					 Even **foreigners** living among the Israelites were to submit to the requirements of the covenant law. Despite their disadvantaged status, the Lord would provide for them (see *10:18*).\n\n
31:14	idm24380					 **Tabernacle** (literally *Tent of Meeting*): At first, the Tent of Meeting was a provisional place of encounter between God and his people (especially Moses). Later, the term became synonymous with the Tabernacle (see *Exod 28:43*; *33:7-11*; *40:2*; *Num 11:16*, *24*, *26*; *12:4*). See *study note on Lev 1:1*.\n\n
31:15	idm24396					 Since God is spirit, he cannot be seen unless he chooses to manifest his glory physically. The **pillar of cloud** was such a manifestation, sometimes called a *theophany* (see *study note on 1:33*). When the pillar appeared, those who saw it recognized in it the presence of God (see *Exod 33:9*; *Num 12:5*).\n\n
31:18	idm24407					 **I will hide my face:** The invisible God used this figure of speech (see *study note on 8:2*) to communicate the breaking of fellowship between himself and his people. He turned away to indicate his rejection and repudiation.\n\n
31:19	idm24415					 When sung by the collective community in days to come, **this song** (*32:1-43*) would remind the people of God’s faithfulness in the past and of their too-frequent disloyalty. The major blessings for obedience and curses for disobedience were implicit in the song. The people of Israel would sing it as a sign that they had placed themselves under these promises and threats. Through music, they would be reminded of God’s blessings for obedience and would invoke God’s judgment should they prove unfaithful.\n\n
31:20	idm24423					 **land flowing with milk and honey:** See *study note on 6:3*. • **become fat:** Fatness did not imply obesity or self-indulgence but blessing and prosperity. • **despise me:** Israel would disregard the Lord and treat him lightly by falsely assuming that their prosperity had come through their own efforts or through the false gods of the land.\n\n
31:22	idm24433					 **Moses wrote down the words:** This statement is good evidence for the traditional view that Moses wrote Deuteronomy (see *Deuteronomy Book Introduction*, “Authorship”).\n\n
31:23	idm24441					 **I will be with you:** These words given to Joshua were the same words God spoke to Moses at the burning bush, when he called him to lead Israel out of Egypt (*Exod 3:12*). The same God, with the same assurance, was able to guarantee the same results.\n\n
31:26	idm24449					 **beside the Ark:** Unlike the stone tablets, the scroll of Deuteronomy was not to be placed in the Ark but near it, in the inner sanctuary of the Tabernacle and, later, of the Temple (see *31:9*; *Exod 25:16*; *26:33*). • **a witness:** Like the song that the Israelites were to sing (see *Deut 31:19*), the presence of the scroll of Deuteronomy would be a perpetual reminder of Israel’s covenant obligations and privileges (see *31:10*, *19*).\n\n
31:30	idm24463					 In ancient times, the validity of a treaty arrangement between individuals or nations was secured by both parties’ vows. Israel’s promise was in the song of witness that Moses composed under divine inspiration (*31:19-22*). When Israel sang the song (presumably as part of a regular covenant-renewal ceremony; *31:21*), they invoked upon themselves the covenant’s judgments and reminded themselves of its promises.\n\n
32:1	idm24471					 **Listen, O heavens. . . . Hear, O earth:** Moses appealed to the witnesses of the covenant to note Israel’s confession and commitment as well as its anticipated disobedience and disloyalty (see *30:19*).\n\n
32:2	idm24479					 **like rain . . . like dew:** This simile shows the refreshing gentleness of Moses’ teaching. It should produce the fruit of obedience in the hearts of God’s people.\n\n
32:4	idm24486					 **the Rock:** This metaphor represents the Lord as strong, stable, and reliable; he is more than capable of providing righteousness and justice (see *32:15*, *18*, *30*; *Hab 1:12*).\n\n
32:7	idm24497					 **Ask your father:** History instructs those who are willing to learn from it. In the wisdom tradition of the Old Testament, the father was given the task of teaching his children the lessons that had previously been transmitted to him (see, e.g., *Prov 1:8*; *2:1*; *3:1*).\n\n
32:8	idm24507					 God is sovereign over and concerned with all nations and has allotted their land in accord with his own purposes (see *Ps 74:17*; *Acts 17:26*). • **the Most High** (Hebrew ‘*Elyon*): Abraham learned this name for God when he encountered Melchizedek (*Gen 14:19*). This ancient name describes God’s universal sovereignty. • **assigned lands:** One evidence of God’s sovereignty was his distribution of lands to the nations (see *Gen 10*).\n\n
32:9	idm24520					 **his special possession** (literally *his inheritance*): God declared Israel to be his son, whom he redeemed from bondage in Egypt (see *Exod 4:22-23*; *13:15*; *Deut 7:6*).\n\n
32:14	idm24531					 **rams from Bashan, and goats:** This high plateau east of the Sea of Galilee was famous for such livestock (see *study note on 1:4*; see also *Ps 22:12*; *Ezek 39:18*; *Amos 4:1*).\n\n
32:15	idm24542					 **Israel:** Hebrew *Jeshurun.* This name, which appears to be derived from a verb meaning “to be upright,” demonstrates the Lord’s strong affection for his people (see *33:5*, *26*; *Isa 44:2*). • **the Rock:** This metaphor describes God’s strength and reliability, especially regarding salvation (see *Deut 32:4*).\n\n
32:16	idm24555					 **his jealousy:** See *study note on 4:24*. Just as a husband is properly jealous when another man tries to draw his wife away (*Prov 6:34*), God was jealous when Israel worshiped other gods.\n\n
32:17	idm24564					 **demons:** In the ancient Near East, the gods were thought to protect individuals and places from harm, but worshiping these pagan deities actually amounted to worshiping evil spirits (cp. *1 Cor 10:20-21*; *Rev 9:20*). • **New gods** were false deities that Israel had never before encountered.\n\n
32:18	idm24574					 **the Rock:** This expression draws attention to God’s reliability as Father (see *32:4*, *9*).\n\n
32:20	idm24583					 The phrase **without integrity** indicates disloyalty to the covenant. Israel had promised to be true to the Lord but had consistently been unfaithful (see *Exod 19:8*).\n\n
32:21	idm24591					 **roused my jealousy:** The Lord was not petulant because of attention paid to false gods. Rather, Israel had broken their covenant with him by worshiping other gods, demonstrating their disdain for him and his sovereignty (see *32:16*). • **people who are not even a people:** God’s purpose for Israel was not just to redeem them, but through them to redeem all nations of the earth. In Israel’s eyes, other peoples were worthless, but through God’s attention to other nations, Israel would be drawn back to obedience (see *Hos 1:9*; *2:23*; *Rom 9:25*; *10:19*).\n\n
32:22	idm24604					 The realm of the dead was thought to be in **the depths** beneath the earth, and the entrance to that world was **the grave.** God is omnipresent, and his judgment reaches the most inaccessible places (see *Ps 139:7-12*).\n\n
32:27	idm24613					 **I feared:** God is never terrified or intimidated. This fear is concern that Israel’s enemies would attribute their success to their own efforts rather than to God’s sovereign judgment of his people (see *Exod 32:11-14*).\n\n
32:29	idm24621					 **their fate** (literally *their latter end*): Israel’s future had not been predetermined; this statement expresses how things would turn out if Israel continued on its rebellious course.\n\n
32:30	idm24629					 **How could one person chase a thousand:** When God gives his people over to destruction, they are vulnerable against all odds. • **their Rock:** Here the metaphor is used ironically. The very one upon whom Israel should stand as the source of their strength will desert them because of their own wickedness and unfaithfulness (see *32:4*).\n\n
32:31	idm24638					 **the rock of our enemies:** In this sarcastic comparison between the pagan gods and the Lord God of Israel, the false deities come up woefully short.\n\n
32:32	idm24645					 **Sodom . . . Gomorrah:** These cities were the epitome of evil (see *Gen 18:16–19:38*). Pagan perversity and godlessness found their inspiration and source in these cities, and because they were unrepentant, they were utterly destroyed (see *Deut 29:23*).\n\n
32:34	idm24654					 Metaphorically, **my treasury** is the place where God, as Divine Warrior, lays up his implements of war and judgment until the time comes for them to be put to use (see *1:30*).\n\n
32:36	idm24662					 **will change his mind about:** When speaking of God, the Old Testament frequently uses figurative language (see *study note on 8:2*). Human beings cannot understand God’s mind (*Isa 55:8*), so God uses human language and gives himself human physical characteristics and feelings. Although the Bible frequently speaks of God’s eyes, arms, hands, and feet, he is invisible and has no body; these metaphors describe his activity. Similarly, when the Bible says that God fears (*Deut 32:27*) or changes his mind, it expresses how God’s actions appear to humans.\n\n
32:37	idm24672					 **the rocks:** This sarcastic metaphor concerns the impotence of pagan gods (see *32:31*).\n\n
32:38	idm24680					 **ate the fat . . . drank the wine:** Most polytheistic religious systems that practice sacrifice include the notion that the gods find nourishment in the sacrifices made to them. Israel fell victim to this superstitious belief for a time before the Lord graciously taught them otherwise and restored them to himself (*32:36*).\n\n
32:40	idm24688					 **I raise my hand to heaven:** This anthropomorphism (see *study notes on 4:34* and *8:2*) asserts God’s solemn intention to keep his covenant promises to deliver his people from their enemies. When God makes an oath, he is not bound to some course of action in the event that he proves undependable. Rather, the statement emphasizes the reliability of God’s promises above and beyond his character alone (see *Num 14:21*, *28*; *Isa 49:18*; *Ezek 20:5-6*).\n\n
32:42	idm24701					 The phrase **arrows drunk with blood** combines personification and hyperbole to show the extent of the carnage that will result from God’s judgment of the nations.\n\n
32:47	idm24708					 **they are your life:** Obeying the Lord’s words brings life (see *8:3*; *30:20*). • **long life:** This promise does not guarantee individual longevity and certainly not immortality; it is about Israel’s long tenure in the Land of Promise.\n\n
32:49	idm24718					 The **mountains east of the river** are a range of mountains overlooking the Jordan Valley. **Mount Nebo,** a prominent peak in this range, was the point from which Moses could view Canaan to the west and was also where he died (*32:50*; see *3:17*).\n\n
32:50	idm24728					 The location of **Mount Hor** is uncertain, but the traditional location (Jebel Haroun) is within sight of the Nabatean city of Petra (see *Num 20:22-29*). • The phrase **joined his ancestors** is a euphemism for burial.\n\n
32:51	idm24737					 **you betrayed me:** During the wilderness sojourn, Moses dishonored the Lord by striking a water-producing rock. This fit of impatient anger disqualified Moses from entering the Promised Land (*Num 20:1-13*; see *Deut 1:37*; *3:26-27*).\n\n
33:1	idm24747					 On the eve of his death, Jacob blessed his twelve sons (*Gen 49:1-28*). As the founding father of his nation, Moses blessed these same sons, now grown into mighty tribes.\n\n
33:2	idm24754					 This poetic account does not establish an itinerary that God followed. Instead, it portrays God in his splendor as he came at certain times and places to lead his people against their foes in God’s war. • **Mount Paran** is the highlands of Paran in the northeast region of the Sinai Peninsula (see *1:1*).\n\n
33:3	idm24762					 In covenant contexts, *to love* is frequently synonymous with *to choose.* The Lord does **love** his people, but here it means that he chooses them as his special possession (*4:20*). • **his hands:** This phrase figuratively conveys the security that Israel (**his holy ones**) had in the Lord. • **his steps:** Following the Lord requires adopting his lifestyle and going where he goes. • **His teaching** refers particularly and pertinently to the Torah in all its fullness.\n\n
33:4	idm24776					 **of Israel:** Literally *of Jacob.* The Hebrew probably uses *Jacob* because the tribes descended from Jacob’s twelve sons are here listed by name as recipients of God’s blessing (*33:6-25*; cp. *Gen 49:1-28*).\n\n
33:6	idm24787					 **Moses said this about the tribe of Reuben:** The NLT adds this line for clarity (cp. *33:7*, *8*, *12*, etc.). • **Reuben** was Jacob’s eldest son by Leah (see *Gen 29:32*). His sin against his father (*Gen 35:22*) might explain his tribe’s lack of prominence (*Gen 49:3-4*).\n\n
33:7	idm24801					 **Judah** was Jacob’s fourth son by Leah (*Gen 29:35*). The anticipated messianic ruler would come through this tribe. This promise was fulfilled first in David (*Ruth 4:18-22*; *1 Chr 2:3-15*) and then in Jesus Christ (*Matt 1:1-6a*; see *Gen 49:10*).\n\n
33:8	idm24813					 **Levi** was Jacob’s third son by Leah (*Gen 29:34*). The Levites, particularly those descended from Aaron, were entrusted with the priesthood (see *Exod 28:1*; *32:29*; *Num 3:9*). • **Thummim and Urim** were precious stones embedded in or suspended from the breastpiece of the ephod, a garment worn by the chief priest. These stones could be consulted to determine God’s will. Their names may be translated “perfections” and “lights,” respectively (see *study note on Exod 28:30*). • **Massah** means “[place of] testing,” referring to an incident when the people ran out of water and tested the Lord (see *study note on Deut 6:16*; *Exod 17:1-7*). • **Meribah** means “[place of] contention,” referring to another occasion when the people of Israel fought with the Lord until he brought them water from a rock (*Num 20:13*, *24*).\n\n
33:9	idm24832					 **guarded your covenant:** The verse alludes to the incident of the gold calf at Mount Sinai (*Exod 32:25-29*) and to the affair at Baal-peor (*Num 25:6-9*). The Levites’ love for the Lord and loyalty to his covenant eclipsed their devotion to their own families, averted God’s judgment, and brought them the honor expressed here.\n\n
33:10	idm24841					 **They teach your regulations . . . instructions:** In addition to carrying out priestly duties such as sacrifices and otherwise assisting at the Tabernacle and the Temple, the Levites had the task of teaching the Torah (*31:9-13*). • **present incense:** This ministry was limited to Levitical priests (*Num 16:39-40*). Later, when King Uzziah entered the Temple to offer **incense***,* he was roundly condemned for his arrogant breach of the priests’ privilege and was afflicted by a skin disease for the rest of his life (*2 Chr 26:16-21*).\n\n
33:12	idm24854					 **Benjamin** was Jacob’s youngest son (*Gen 35:18*; *49:27*). Because Rachel was Jacob’s favorite wife, Benjamin was also favored. His tribe was blessed by the Lord’s special protection.\n\n
33:13	idm24863					 **Joseph** was Jacob’s eleventh son (*Gen 30:23-24*) and his favorite child (*Gen 37:3*). Joseph and his two sons, Ephraim and Manasseh, received Jacob’s special blessing (*Gen 48*; *49:22-26*). As a result, **the tribes of Joseph** prospered and multiplied, becoming two separate tribes.\n\n
33:16	idm24875					 **the one who appeared in the burning bush:** See *Exod 3:2-4*. The same Lord who favored Israel by rescuing them from bondage blessed the tribes of Joseph. • **the prince among his brothers:** Joseph’s dream that he would rule over his siblings was fulfilled when they submitted to him in Egypt (*Gen 37:5-11*; *42:6*).\n\n
33:17	idm24886					 **Ephraim** is listed first because he received the blessing of the firstborn over **Manasseh** (*Gen 48:8-22*). Manasseh, the firstborn, would normally have received the double portion belonging to the firstborn (cp. *Deut 21:17*), but Jacob gave it to Ephraim, Joseph’s younger son. Moses’ blessing reflects Jacob’s blessing by listing the tribe of Ephraim as numbering in **multitudes** (literally *tens of thousands*) and Manasseh in **thousands.** After the conquest and establishment of the nation, Ephraim became the dominant tribe of the north; later, after the kingdom was divided following Solomon’s death (*1 Kgs 12*), the name Ephraim was used interchangeably with Israel in speaking of the northern kingdom.\n\n
33:18	idm24900					 **Zebulun and Issachar** (NLT adds *and Issachar* for clarity) were the sixth and fifth sons of Jacob by Leah (*Gen 30:18*, *20*). • **in their travels . . . in their tents:** This figure of speech (a *merism*) encompasses life in all its fullness for both tribes, from activity (**travels**) to inactivity (**tents**).\n\n
33:19	idm24914					 **to the mountain:** Issachar was allotted much of the plains of Jezreel or Esdraelon. Mount Tabor, a prominent landmark of this region, was probably the mountain in view because later tradition knows this as a place of worship (*Hos 5:1*). The nature of that worship is unclear, but it was probably proper even though it was not carried out at the Temple (see *1 Kgs 18:30*, *32*). • The phrase **riches of the sea** might refer to the maritime industry of the people of Zebulun when their western border extended to the Mediterranean Sea (see *Gen 49:13*).\n\n
