Reference	ID	Tags	SupportReference	Quote	Occurrence	Note
1:1	idm20560					 Ancient Near Eastern treaty texts usually began with a brief section introducing the partners in the covenant, their relationship to each other, and their immediate ancestry. This introduction provides information primarily about the social and geographic setting.\n\n
1:1	idm20566					 **These are the words that Moses spoke:** Although Deuteronomy is modeled after a covenant or treaty document, it is essentially a series of addresses delivered by Moses to the assembly of Israel. • **the Jordan Valley:** Hebrew *the Arabah*, a common word usually translated “wilderness” or “desert.” It generally refers to the Great Rift Valley that extends from the Sea of Galilee southward to the Red Sea (the Gulf of Aqaba). In this context, the Arabah is the wasteland of the lower Jordan River, just north of the Dead Sea.\n\n
1:2	idm20575					 The distance from **Mount Sinai** in the southern part of the Sinai Peninsula to **Kadesh-barnea** (see *study note on 1:19*) in the north is only 150 miles. Even the massive Hebrew population could easily have covered this distance in **eleven days** had they proceeded without detour or interruption. Their rebellion against the Lord resulted in a 38-year delay and a circuitous route (*2:14*; *Num 14:34*). • **Mount Sinai:** Hebrew *Horeb,* the name consistently used in Deuteronomy for the sacred mountain where the covenant was given. Its likely connection to a word meaning “drought” or “devastation” suggests the conditions the people of Israel had to face. • The **way of Mount Seir** was the route from Mount Sinai to Mount Seir. **Seir***,* another name for Edom, was located east-southeast of the Dead Sea. The ordinary route took travelers through the Arabah north from the Gulf of Aqaba and then west to Kadesh-barnea, sixty miles southwest of the Dead Sea.\n\n
1:4	idm20592					 The **Amorites** were a Semitic people, linguistically related to the Canaanites. They originally lived in what is now north-central Syria, but they had migrated into Canaan to settle on both sides of the Jordan River, primarily in the hill country. At the time of Israel’s conquest, many Amorites lived in Transjordan (east of the Jordan), north of the Arnon River, with their capital at Heshbon (see also *study note on Num 21:13*). The Israelites had already displaced many of them before this time (*Num 22:21-35*). • **Bashan** was also an Amorite area, located north of the Yarmuk River and east of the Sea of Galilee. It was known for its prized livestock (cp. *Ps 22:12*; *Ezek 39:18*; *Amos 4:1* and *study note*). Its capital was Ashtaroth. • The kings **Sihon** and **Og** are not known outside the Bible (see *Num 21:21-35*).\n\n
1:6	idm20609					 Secular treaties typically included a section detailing the past relations between the treaty partners. The purpose here was to point out Israel’s successes and failures since the Exodus and to remind the people that God had been true to his word regardless of how they had acted toward him. In order to prepare the Israelites for life in Canaan, Moses reminded them of life in Egypt, of the forty years of wandering in the wilderness, and of their past blunders. He warned them to obey God’s covenant and assured them that God’s grace would follow them as they learned to trust and obey the Lord.\n\n
1:7	idm20615					 The **hill country** consisted of interior areas of Canaan that were also inhabited by the Amorites (see *1:4*; *Num 13:29*; *Josh 10:6*). The Canaanites apparently once lived throughout Palestine, but with the incursion of the Amorites they were restricted to the valleys and lowlands. • **the western foothills:** Hebrew *the Shephelah,* the term still used in modern Israel for the region between the hills of Judah and the coastal plain, an area that specializes in orchards and vineyards. • **the Negev:** This great desert area lies to the south of Canaan. The Hebrew word could also designate “the south.”\n\n
1:8	idm20628					 **occupy it** (literally *acquire it as an inheritance*): The land was already Israel’s because God had promised it to the nation’s ancestors centuries earlier (*Gen 15:18-21*; *26:3*; *Exod 23:31*). Israel was not seizing new territory from its rightful owners but was taking possession of land occupied by squatters.\n\n
1:9	idm20639					 See *Exod 18:13-27*.\n\n
1:10	idm20646					 **as numerous as the stars:** This figure of speech deliberately exaggerates for effect. Abraham’s descendants had not approached the actual number of stars in the universe, though they exceeded the number of stars visible to the naked eye. Moses meant that God had begun fulfilling his promises to Abraham (see *Gen 15:5*; *22:17*) by making Israel numerous, bringing them to the Promised Land, and preparing them to conquer it.\n\n
1:13	idm20655					 Those who were **well-respected** had lives and reputations that were above reproach, even on close scrutiny.\n\n
1:15	idm20662					 **thousand . . . hundred . . . fifty . . . ten:** This was standard military organization, so some of these officials were probably military officers (see *1 Sam 8:12*; *22:7*; *2 Sam 18:1*).\n\n
1:16	idm20672					 **Be . . . impartial** (literally *Do not notice faces*): People appearing before the court should be treated as though they were wearing a mask to conceal their identity. Judges were not to be influenced by rich and powerful persons in the community but were to judge on the basis of God’s own impartiality (*10:17*) and treat all persons equally under the law.\n\n
1:19	idm20681					 See *Num 13*.\n\n
1:19	idm20688					 **Kadesh-barnea***,* a great oasis with abundant wells and springs, was about fifty miles south of Beersheba, the traditional southern point of Israel (see *2 Sam 3:10*; *1 Chr 21:2*).\n\n
1:24	idm20698					 **Eshcol** means “cluster”; the **fruit** grown there was grapes (see *Num 13:23-27*).\n\n
1:26	idm20707					 See *Num 14*.\n\n
1:28	idm20714					 **Anak** was a well-known man of gigantic physical stature (*2:10*, *21*; *9:2*; *Num 13:33*). Goliath (*1 Sam 17:4*) might have been one of the **descendants of Anak** who migrated to the Philistine coastal plain (*Deut 2:23*; *Josh 11:21-23*; *15:14*; *1 Chr 20:4-8*).\n\n
1:30	idm20731					 **He will fight for you:** This phrase refers to the defeat of the Canaanite nations. The Lord would initiate the battle, lead it, fight it, and bring it to a successful conclusion. The only other use of this phrase refers to God’s activity in the Exodus (*Exod 14:14*).\n\n
1:31	idm20739					 God’s tender care **as a father** reflected his covenant relationship with Israel (*Exod 4:22*; *Hos 11:1-4*; cp. *Matt 6:26-33*; *John 14:21*; *Acts 13:18*; *Rom 8:15-17*; *1 Pet 1:2-3*; *1 Jn 3:1*). Israel was God’s **child** by descent from Abraham and because God had chosen and adopted Israel from among all the nations (*Deut 14:2*; *Exod 19:4-6*). The imagery is similar to that found in secular covenant texts in which a great king regarded a vassal with whom he had made a treaty as his son.\n\n
1:33	idm20757					 Physical manifestations of God (called *theophanies*), such as the **pillar of fire** and the **pillar of cloud**, assured God’s people of his presence and power. As he moved forward by these visible displays, they could also move, knowing that he would faithfully lead them to their final destination (*Exod 13:21-22*; *14:24*; *Ps 18:9-10*).\n\n
1:36	idm20769					 **Caleb** was one of the twelve spies whom Moses sent to discern the political and military situation in Canaan. Caleb and Joshua alone brought back the report that God would give Israel success in conquering Canaan (*Num 13:6*, *8*, *16*, *30*). Caleb later became the father-in-law of Othniel, Israel’s first judge (*Judg 1:13*). For his faithfulness, Caleb was given the vicinity of Hebron as his inheritance, and he expelled the Anakites (see *Josh 14:12-15*; *Judg 1:20*).\n\n
1:37	idm20783					 God was **angry with me because of you:** In his frustration against rebellious Israel, Moses had disobeyed God by striking the rock rather than merely speaking to it (*Num 20:10-13*).\n\n
1:44	idm20791					 **Hormah** is perhaps modern Khirbet el-Meshash, a site seven miles southeast of Beersheba. The ancient name is derived from the verb *kharam**,* which means to “devastate” or “annihilate.” The Israelites indeed devastated Hormah (*Num 14:45*; *21:3*).\n\n
2:1	idm20802					 **Mount Seir** was a mountainous territory north of the Gulf of Aqaba, east of the Arabah (see *study note on 1:1*) and the Dead Sea. It was originally settled by the Horites (*Gen 14:6*), now identified by many scholars as the Hurrians. The Hurrians are described in many ancient texts as wandering tradesmen and adventurers who found a home in many parts of the ancient Near East. In time, the Horites of Mount Seir were supplanted by the descendants of Esau (*Deut 2:22*), and the region was called Edom (“red”), perhaps because of the rose-red stone typical of the area.\n\n
2:2	idm20812					 *Num 21:10-20* covers the same time period.\n\n
2:5	idm20819					 **I have given them:** God’s gift of a promised land was not limited to Israel. He also distributed lands to Edom, Moab (*2:9*), Ammon (*2:19*), and the Caphtorites (*2:22-23*). Although God had chosen Israel as a special nation (*1:31*; see also *7:6*; *14:2*; *Exod 19:5*), he is also the God of all nations and has a place and purpose for each (*Deut 32:8*; *Acts 17:26*)—even for those that do not recognize his sovereignty (*Rom 1:16-23*).\n\n
2:8	idm20836					 **our relatives:** Isaac had two sons, **Esau,** the firstborn, and Jacob, who obtained Esau’s birthright and blessing as the firstborn (*Gen 25:27-34*; *27:1-36*). The result was intense hostility between Esau and Jacob and between their descendants. Israel still recognized and honored the kinship, however; out of fraternal good faith, if not affection, Israel bypassed Edom and did not engage the Edomites in battle (see *Num 20:14-21*). • **Arabah Valley:** See *study note on Deut 1:1*. • **Elath and Ezion-geber** were twin port cities on the Red Sea. They later harbored the merchant ships of Solomon (*1 Kgs 9:26*), Jehoshaphat (*1 Kgs 22:48*), and Uzziah (*2 Kgs 14:22*).\n\n
2:9	idm20853					 Following the destruction of Sodom, Gomorrah, and the other cities of the plain, **Lot** (Abraham’s nephew and Isaac’s cousin) and his two unmarried daughters sheltered in a cave east of the Dead Sea (see *Gen 19:30-38*), where Lot’s daughters plied their father with drink until he had sexual relations with them. Their descendants became the nations of Moab and Ammon. Because of their kinship with Israel, **the Moabites** were to be left undisturbed. David’s great-grandmother Ruth descended from Moab (*Ruth 1:4*), and David sent his own family to the land of Moab for protection when he was pursued by Saul (*1 Sam 22:3-5*). • **Ar** was probably the capital of Moab.\n\n
2:10	idm20865					 The **Emites** were also located at Shaveh-kiriathaim (*Gen 14:5*), perhaps ten miles east of the Dead Sea’s north end.\n\n
2:11	idm20873					 The **Rephaites** lived near Ashteroth-karnaim (*Gen 14:5*; perhaps modern Tell Ashtarah), due east of the Sea of Galilee (see *Deut 1:4*).\n\n
2:12	idm20882					 **just as Israel drove out:** The Hebrew does not include the phrase **the people of Canaan**. This passage is often cited as a later addition to Deuteronomy because it seems to presuppose the conquest under Joshua. However, it refers in part to the defeat of peoples east of the Jordan, such as the Amorites under King Sihon and King Og (*3:12-17*).\n\n
2:13	idm20891					 The ravine of **Zered Brook** marked the boundary between Moab and Edom. Rising in the highlands of Mount Seir, this waterway empties into the southeast bend of the Dead Sea.\n\n
2:19	idm20898					 Like the Moabites, the **Ammonites** were descendants of the incestuous relationship between Lot and his daughters (see *study note on 2:9*). Throughout most of their history, the Ammonites lived south and east of the Jabbok River. The nation’s capital was Rabbath Ammon (modern Amman, Jordan). David arranged for Uriah, Bathsheba’s husband, to be slain in the siege of this city (*2 Sam 11:1*, *14-21*).\n\n
2:20	idm20908					 The **Zamzummites** are probably the same as the Zuzites (*Gen 14:5*). The Lord had removed them from the land in the past so that the Ammonites could occupy their lands. The God of Israel is also the God of all the earth; he is mindful of all nations and has a place and purpose for each.\n\n
2:23	idm20916					 The **Caphtorites** were descendants of Ham and were originally **from Crete**, a large island south of the Greek peninsula. The Caphtorites are usually identified with the Philistines (see *Gen 10:6-14*; *1 Chr 1:8-12*). The Philistine presence in Canaan resulted from two separate movements, one in the time of the Hebrew patriarchs (see *study note on Gen 21:32*) and another that began about 1200 BC (see study notes on *Josh 13:2*; *Judg 3:3*). This passage apparently refers to the earlier settlement. • The **Avvites** were indigenous inhabitants of the lower Mediterranean coastal plain; they were supplanted in Gaza by the early wave of Philistines (cp. *Josh 13:2-4*).\n\n
2:24	idm20932					 The **Arnon Gorge** is the deep canyon formed by the Arnon River; it sometimes marked the border between Moab and Edom (see *Num 21:13*). It rises deep in the Arabian Desert and empties into the Dead Sea midway along its eastern shore. • **Sihon the Amorite** controlled the area east of the Jordan, north of the Arnon, and south of the Ammonite territories (see *Num 21:21-35*). He is not known outside of the Bible. His capital, **Heshbon***,* was probably about fifteen miles southwest of Rabbath Ammon and is usually identified with the impressive ruins at Tell Hesban.\n\n
2:26	idm20944					 See *Num 21:21-32*.\n\n
2:26	idm20951					 The **wilderness of Kedemoth** might refer to the area north of the Arnon Gorge between Dibon and Mattanah (*Josh 13:18*; *21:37*).\n\n
2:30	idm20960					 **made Sihon stubborn and defiant** (literally *had hardened his spirit and strengthened his heart*): Like Pharaoh (see *Exod 7:13*), Sihon was incorrigibly unrepentant and thus experienced God’s wrath. God knew that any further extension of grace to these rulers would be useless. Mystery surrounds the relationship between statements that people harden their own hearts (e.g., *Exod 7:13*, *22*; *8:15*) and statements that God hardens people’s hearts (e.g., *Exod 4:21*; *7:3*; *9:12*). What is clear is that God appeals for repentance and is ready to forgive, but when people continually ignore or reject his appeals, they can become incapable of hearing and obeying God (see “*Hardened Hearts*” Theme Note; *Rom 1:21-28*; *9:17-24*).\n\n
2:34	idm20978					 **completely destroyed** (Hebrew *kharam*): The Hebrew term refers to the complete consecration of things or people to the Lord, either by destroying them or by giving them as an offering. The underlying rationale was to maintain the Lord’s holiness in the face of pagan idolatry and moral corruption (see also *Lev 27:28-29*).\n\n
2:36	idm20987					 **Aroer***,* on the north rim of the Arnon Gorge three miles from Dibon, marked the southernmost extent of the Amorite kingdom (*3:12*; *4:48*; *Josh 12:2*; *13:9*, *16*, *25*). • The identity of **the town in the gorge** is uncertain. • **Gilead,** famous for its balm and other aromatic spices (*Jer 8:22*; *46:11*), lay north of the Jabbok River, the northernmost border of the Amorites under Sihon.\n\n
2:37	idm21005					 Like the Moabites, **the Ammonites** were related to Israel and were thus to be left undisturbed (cp. *2:9*). • The **Jabbok River***,* a great tributary of the Jordan River, marked the border between Gilead to the north and the Amorite kingdom of Sihon to the south. The Ammonites lived east and south of the Jabbok (*2:19*). It was somewhere at the Jabbok that Jacob wrestled with the stranger at night (*Gen 32:22-32*).\n\n
3:1	idm21017					 See *Num 21:33-35*.\n\n
3:4	idm21024					 **Argob** might be synonymous with Bashan or might refer to a heavily populated part of Bashan.\n\n
3:8	idm21031					 **Mount Hermon** is the southernmost peak in the Anti-Lebanon Mountains northeast of the Sea of Galilee; at 9,300 feet above sea level, it is also the highest. On a clear day, this impressive landmark is visible from many miles away.\n\n
3:9	idm21038					 The alternative names **Sirion** and **Senir** suggest that Hermon was perhaps a later name given by the Israelites. Hermon is apparently related to the verb *kharam**,* which means “to destroy” (see *study note on 2:34*), and perhaps describes the destruction summarized in *3:3-7*.\n\n
3:11	idm21050					 **His bed** was probably wooden, inlaid with iron. Alternatively, the Hebrew word might suggest a sarcophagus or coffin. • **Rabbah** is the same city as Rabbath Ammon (see *study note on Deut 2:19*). Apparently there was some kind of museum at Rabbah when Deuteronomy was written, and this artifact could be seen there.\n\n
3:12	idm21059					 See *Num 32*.\n\n
3:12	idm21066					 The tribes of **Reuben and Gad** had asked Moses to let them settle east of the Jordan rather than in Canaan, and he allowed them to do so (*Num 32:1-5*). • **Aroer:** See *study note on Deut 2:36*.\n\n
3:13	idm21076					 **The half-tribe of Manasseh** made the same request as Reuben and Gad (*3:12*), and Moses accepted their request. Gad and Reuben settled between the Arnon (see *2:24*) and the middle of **Gilead** (see *2:36*), and Manasseh took everything north of that, including **Bashan** (see *3:1*). • The **Rephaites***,* a giant people related to the Anakites (see *2:11*), are noted here as being indigenous to Bashan.\n\n
3:14	idm21092					 **Jair** was a descendant of Manasseh from Makir and Gilead (*1 Chr 2:22*). • **Geshurites and Maacathites***,* kingdoms of Bashan, lay along the west side of the Golan Heights, east of the Sea of Galilee. • **The Towns of Jair** was the name given Argob (see *Deut 3:4*) after Jair brought it under Israelite control.\n\n
3:15	idm21104					 **Makir** was a clan in the tribe of Manasseh (*Num 26:29*) to which Jair was related (*1 Chr 2:21-23*). The clan of Makir settled south of Bashan in the northern part of Gilead (see *Deut 3:13*).\n\n
3:17	idm21114					 **from the Sea of Galilee down to the Dead Sea:** The Hebrew name for the beautiful **Sea of Galilee** is *kinnereth**,* which might come from *kinnor* (“harp”) because of its shape. • The **Dead Sea** (Hebrew *yam hammelakh**,* “Salt Sea”), here also called the Sea of the Arabah (see *study note on 1:1*), has a very high mineral content (about 30 percent). • **Pisgah** is a section of the Abarim mountain range; its most prominent peak is Mount Nebo, where Moses died (see *34:1*).\n\n
3:21	idm21131					 See *Num 20:2-13*; *Ps 106:32-33*.\n\n
3:21	idm21139					 **He will do the same:** Israel’s military success under Moses’ leadership could be expected to continue under Joshua because the Lord promised to remain with them.\n\n
3:24	idm21146					 **Is there any god?** Moses did not believe that other gods existed; he was simply affirming that only the Lord is God. Nothing and no one else, real or imaginary, can rival the one true God.\n\n
3:29	idm21153					 **Beth-peor,** otherwise known as Baal-peor (see *4:3*) or simply Peor (*Num 23:28*; *Josh 22:17*), became Moses’ burial place (*Deut 34:6*). At that place the false prophet Balaam had earlier attempted to curse Israel on behalf of Balak, king of Moab (*Num 23:27–24:25*).\n\n
4:1	idm21165					 Moses’ lengthy exhortation to the Israelite community was based on the people’s recent failures and his anticipation of what lay ahead in Canaan.\n\n
4:1	idm21171					 The pairing of the terms **decrees and regulations** in Deuteronomy (e.g., *4:5*, *8*, *14*, *45*; *5:1*, *31*) is a way of referring to the covenant stipulations and the detailed application of the great principles of the Law (see *study note on 4:44*).\n\n
4:3	idm21185					 **Baal** was the Canaanite god associated with the fertility of the soil and of human and animal life. Local pagan worship centers linked Baal with their own shrines and cultic rituals, as with **the god of Peor** (see *3:29*).\n\n
4:6	idm21194					 **Obey . . . wisdom and intelligence:** Wisdom is linked to obedience—obeying the Lord is the essence of wisdom (see *10:12-13*; *Prov 1:7*; *9:10*; *15:33*). If God’s people were **wise and** **prudent** enough to keep the Lord’s perfect covenant, all the world would marvel.\n\n
4:8	idm21207					 Israel’s laws were **righteous and fair** because they originated with God.\n\n
4:11	idm21214					 **flames . . . clouds:** In these contrasting displays of God’s presence (*theophanies;* see *study note on 1:33*), he revealed himself while also remaining hidden (see *Exod 19:16-19*).\n\n
4:13	idm21224					 The **covenant** is the key theological idea of Deuteronomy and perhaps of the entire Old Testament. A covenant was a legal arrangement involving two or more parties who entered into agreements with mutually binding obligations. The covenant at Sinai (*Exod 20–23*) codified this relationship between the Lord and Israel; in Deuteronomy, Moses interpreted and expanded the covenant for the new generation that was about to conquer and occupy the Promised Land. • The **Ten Commandments** (literally *the ten words*, “decalogue”) are so much at the heart of the covenant text and its requirements as to be equated with the covenant. The first four *words* regulate relationship with God, while the last six regulate human relationships. • **two stone tablets:** All legal documents, including covenant texts, were copied for the benefit of all involved parties. God had his copy (the stone tablets) laid inside the Ark of the Covenant in the sanctuary (see *Exod 25:16*, *21*; *31:18*; *40:20*; cp. *Deut 31:26*); Israel’s copy was written in the books of Exodus (*Exod 20:1-17*) and Deuteronomy (*Deut 5:6-21*).\n\n
4:15	idm21243					 **form:** No image could capture the transcendent glory and power of the invisible God (*Neh 9:20*; *Isa 63:10-14*; *Zech 4:6*; *John 4:24*). Any *form* of the Lord could become an object of worship in lieu of worshiping God himself.\n\n
4:16	idm21255					 **idol:** Idolatry inherently confined the Lord to the artist’s imagination. Israel was not to make idols in the form of any of his creatures (*4:17-18*). Idols and images could lead to worship of the creature rather than the Creator (*5:8-9*; *Rom 1:23-25*).\n\n
4:19	idm21265					 **forces of heaven:** This phrase refers to the stars and other heavenly bodies, which, like earthly creations, were thought to embody or represent deities. Instead, they are servants of God, named by him to carry out their duties of marking the times and seasons (*Gen 1:14-19*; *Isa 40:26*). • **The** Lord** your God gave them:** Rather than worshiping these heavenly bodies, the people of Israel were to recognize that God’s creation was made, among other reasons, to serve humankind (*Gen 1:28*).\n\n
4:20	idm21278					 An **iron-smelting furnace** was used to refine metal ores and separate the pure metal from the dross. Israel’s trials in Egypt made the Israelites more spiritually and morally pure. • **special possession** (literally *people of inheritance*): Israel itself was God’s inheritance. This concept is confirmed by the parallel phrase describing Israel as **his very own people**. As such, the Israelites were now fit to enter, conquer, and occupy the land (cp. *1 Pet 2:9-12*).\n\n
4:24	idm21289					 God does not have the petty human emotion of jealousy. Rather, the phrase **jealous God** shows that God was asserting his uniqueness and claiming exclusive worship (*6:15*; *Lev 10:2*; *Num 16:35*). The Hebrew word can be rendered as “jealous” or “zealous.” God zealously protects his own reputation as the universal sovereign.\n\n
4:26	idm21299					 **Heaven and earth** would be **witnesses** against Israel if the people were disloyal to the Lord. In a covenant partnership, the parties to the agreement were held accountable to the oaths of loyalty and commitment they made to each other in the presence of witnesses (*Isa 1:2-7*; *Mic 6:1-8*). In Deuteronomy, the natural creation plays that role of witness (see Deut also *30:19*).\n\n
4:27	idm21310					 **scatter you:** One of the curses directed against Israel if it violated the terms of the covenant was the dispersion of the people to the ends of the earth (*28:64*). This judgment later came to pass repeatedly, especially when the Assyrians occupied the northern kingdom in 722 BC, when the Babylonians conquered Judah in 605–586 BC, and when Jerusalem was destroyed in AD 70.\n\n
4:30	idm21321					 **distant future** (literally *last* [or *latter*]* days*): Israel would eventually return from the Exile and worldwide dispersion (see *30:1-10*; *Lev 26:40-45*; *Jer 31:27-34*; *Ezek 36:22-31*).\n\n
4:34	idm21335					 **strong hand, a powerful arm:** Describing divine qualities in human terms is called *anthropomorphism* (see *study note on 8:2*). Here it represents God’s sovereign power in delivering Israel from bondage in Egypt.\n\n
4:36	idm21344					 **great fire:** God revealed the covenant law at Mount Sinai with a magnificent and terrifying display of power and glory comparable to the eruption of a great volcano (see *study note on 1:33*; see *Exod 3:1-4*; *24:16-18*).\n\n
