Reference	ID	Tags	SupportReference	Quote	Occurrence	Note
12:1	idm22194					 After Moses laid out the principles of the covenant (*5:1–11:32*), he moved to the application of these principles in everyday life. Passages in this section expand on the Ten Commandments and cover some of the contingencies that inevitably arise in the complexity of human relationships.\n\n
12:2	idm22201					 **green tree:** The Canaanites selected groves of trees for worship sites because their lush foliage demonstrated fertility. Sometimes trees were stylized in the form of wooden poles driven into the ground and dedicated to the worship of the mother goddess, Asherah (see *7:5*).\n\n
12:3	idm22209					 **sacred pillars:** See *study note on 7:5*. • **Asherah poles:** The feminine counterpart to the sacred pillar was a wooden pole dedicated to the mother goddess, Asherah. • **erase the names:** With the destruction of all idols and every vestige of pagan worship, the names of these deities would be forgotten. Future generations would know nothing of them (see also *study note on 7:24*).\n\n
12:5	idm22220					 **his name will be honored:** The name of the Lord represents the Lord himself. God lived among his people in a designated location by placing **his name** there (see *Exod 3:13-14*).\n\n
12:6	idm22229					 All of the **offerings** listed here are expressions of thanksgiving, fellowship, and loyalty to the Lord. In covenant relationships, the vassal offered tribute to the great king as a sign of submission and a promise of dependability (see *study note on 1:31*).\n\n
12:8	idm22237					 **doing as you please:** Until the Exodus, the Israelites probably worshiped at multiple shrines in Egypt. With the construction of the Tabernacle, worship was centralized and remained so with the later building of the Temple. In the future, the community would be required to assemble on stated occasions to worship the Lord collectively at the central sanctuary, although local worship by individuals, families, and even villages would continue (see *Exod 20:24-26*; *1 Sam 9:11-14*).\n\n
12:12	idm22246					 **The Levites,** descendants of Jacob’s son Levi, were set apart to serve the Lord full time in Israel’s religious life (*Num 18:1-7*). The primary task of the Levites was to assist the priests in their various responsibilities. Because the priests and the Levites could not engage in secular pursuits, they depended on the generosity of Israel’s other tribes for their livelihood (*Num 18:21-24*).\n\n
12:15	idm22255					 **butcher your animals . . . whenever you want:** This instruction refers to animals for eating, not for a ritual sacrifice. • **ceremonially clean or unclean:** The slaughter of animals for food could take place without the slayer undergoing the purification rituals necessary when sacrificial animals were slain.\n\n
12:16	idm22263					 The prohibition against consuming **blood** pertained both to sacrificial animals and to those slain for meat. Because it represented life, blood was sacred and was to be rendered only to God. This principle is inherent in creation and preceded the law (*Gen 4:10-11*; *9:4-6*; *Lev 17:11*). See also *study note on Lev 7:26-27*.\n\n
12:18	idm22274					 The **place he will choose** was the central sanctuary—first the Tabernacle and then the Temple.\n\n
12:21	idm22281					 **you may butcher:** Because an animal’s blood was considered sacred (see *Gen 9:4-6*), even meat intended for human consumption was to be slaughtered at the central **designated place of worship** if that was at all practical (cp. *Lev 17:8-9*); if not, the animal could be sacrificed locally, but the blood still had to be disposed of in a ritually appropriate manner (*Deut 12:23-25*; cp. *Lev 17:10-12*).\n\n
12:23	idm22293					 **the blood is the life:** In this figure of speech, the means (**blood**) is equated with the effect (**life**). Since **life** is sacred, its vehicle, **the blood***,* is also sacred (see also *Lev 17:11*).\n\n
12:27	idm22306					 **you may eat the meat:** The exception was meat sacrificed in burnt offerings, which was to be given to the Lord and wholly consumed in the fire (see *Lev 1:3-17* and *study note*).\n\n
12:31	idm22315					 **burn their sons and daughters:** Human sacrifice was one of the most abhorrent practices of ancient pagan religions. The Ammonites believed that their god Molech required such sacrifice from his worshipers (*Lev 18:21*; *20:2*; *2 Kgs 23:10*; *Jer 32:35*).\n\n
13:1	idm22326					 Prophets who tried to lead Israel away from the one true God were guilty of treason, which carried the death penalty. No other religion insisted on exclusive worship of their national gods; consequently, such harsh penalties for the worship of competing deities were unknown elsewhere in the ancient Near East.\n\n
13:1	idm22332					 God performed **signs** and **miracles** to induce amazement and faith in those who witnessed them (see *6:22*). False prophets and magicians were able to replicate these feats to a degree and thus sometimes led God’s people astray (see *Exod 7:11*, *22*; *8:7*).\n\n
13:5	idm22344					 **visionaries:** Literally *dreamer of dreams.* • **purge** (literally *burn*): God wanted false prophets to be completely eliminated, leaving no residue of their evil ways. See also *17:12*; *19:13*.\n\n
13:6	idm22356					** neither you nor your ancestors have known:** The Israelites had heard of these false gods before, but they had never worshiped them. Doing so would violate the first two commandments, the essence of the covenant.\n\n
13:9	idm22363					 **Strike the first blow yourself:** Because the guilty parties would be members of one’s own family (*13:6*), this difficult demand would test the depth of a person’s commitment to worship the Lord exclusively. Love for God must take priority over love for family members and friends (*Matt 10:34-39*).\n\n
13:13	idm22372					 **scoundrels** (literally *sons of Belial*): In Hebrew, “son(s) of” often expresses group affiliation or shared characteristics. *Scoundrels* typically deceived others and led them astray (*Prov 6:12*; *16:27*; *19:28*; *Nah 1:11*).\n\n
13:14	idm22385					 A **detestable act** is any deed or even thought that is offensive to God (see study notes on *7:25-26*; *12:31*).\n\n
13:16	idm22394					 The spoils of war, or **plunder***,* were not to be kept. God had designated them for complete destruction (see *2:34*; *Lev 27:28-29*).\n\n
14:1	idm22404					 See “*Clean, Unclean, and Holy*” Theme Note.\n\n
14:1	idm22411					 **cut yourselves:** This pagan custom was usually associated with mourning rites, perhaps to induce the dead to come back to life (see *1 Kgs 18:28*; *Zech 13:4-6*). • **shave the hair:** This practice also pertained to lament for the dead (see *Lev 19:27-28*; *21:5-6*), but the exact meaning of this rite is unknown.\n\n
14:2	idm22423					 The fundamental Hebrew meaning of **holy** focuses on separation of a person or thing for a particular function or use. A derivative meaning is “pure” or “morally and spiritually upright.”\n\n
14:6	idm22430					 **split hooves and chews the cud:** These criteria distinguished edible animals listed in *14:4-5* from those listed in *14:7-8*. Although the people experienced health benefits from observing these restrictions, a thing was actually clean or unclean only because God declared it to be such.\n\n
14:7	idm22439					 The **hyrax** is a rabbit-sized, hoofed mammal.\n\n
14:8	idm22446					 The instruction not to **touch their carcasses** was primarily to maintain ritual purity.\n\n
14:11	idm22453					 These animals are grouped as flying animals that eat rotting flesh.\n\n
14:19	idm22459					 **winged insects:** Cp. *Lev 11:20-23*.\n\n
14:21	idm22467					 Animals that had **died a natural death** were considered unclean (even if considered clean while living) because they had not been slaughtered according to ritual protocol and their blood had not been properly drained and disposed of (see *12:23-25*). • **You must not cook a young goat in its mother’s milk:** A common explanation for why this pagan practice was improper is that it displayed insensitivity to the natural feelings of affection and trust between mothers and their offspring (see *28:56-57*).\n\n
14:22	idm22477					 **set aside a tithe:** The ancient practice of giving a tenth preceded the law of Moses (*Gen 14:20*; *28:22*) and existed in other ancient cultures. Here it is viewed as a tax or tribute collected by the sovereign Lord from his vassals (see *study notes on Deut 1:31* and *12:6*).\n\n
14:23	idm22488					 **The place the** Lord** your God chooses for his name to be honored** (literally *the place he will cause his name to dwell*) was the central sanctuary, the Lord’s dwelling on the earth among his people (see *12:5*, *18*).\n\n
14:26	idm22500					 Both **wine** and **other alcoholic drink** were used in worship ceremonies (*Gen 14:18*; *35:14*; *Exod 29:40-41*; *Matt 26:27*) and in celebrations; they signified God’s blessing (*Gen 27:25*, *28*; *49:11*; *1 Chr 12:40*; *Ps 104:15*; *Song 4:10*; *5:1*; *Isa 25:6*; *Matt 26:29*).\n\n
14:27	idm22521					 Because **the Levites** had no geographic inheritance of their own and were forbidden to engage in secular work, they depended on the support of other tribes (see *12:12*).\n\n
14:28	idm22529					 An annual **tithe** was required of all adult Israelite males as part of their festival observances (*15:20*; *16:16-17*). The tithe **every third year** met the needs of the Levites and other dependent classes in Israelite society (*14:29*). See *study note on Lev 27:30*.\n\n
15:1	idm22541					 The Law included the regulation of borrowing and lending so that the poor could survive deprivation. It provided restrictions to allow the rich to minister to the needs of the poor without exploiting them.\n\n
15:1	idm22547					 **cancel the debts:** This technical term refers to releasing people in financial bondage from their creditors and from any penalty for their default.\n\n
15:2	idm22554					 The **time of release** was to occur every seventh year across the nation (the Sabbath year, *Lev 25:1-7*). The time frame followed the calendar rather than the length of the loan arrangement. This meant that the year of release could fall as soon as a year after a loan was made.\n\n
15:4	idm22562					 If Israel lived in perfect obedience to the covenant, there would **be no poor** in the nation. However, this ideal was never realized in ancient Israel, and poverty was very much an issue.\n\n
15:6	idm22569					 **You will lend money to many nations:** An obedient Israel would become an affluent nation able to provide international aid. This bounty would bear testimony to God’s promise to Abraham that his seed would be a blessing to all nations (*Gen 12:2-3*; *17:4-6*; *26:3-4*).\n\n
15:11	idm22579					 The reality that there **will always be some . . . who are poor** in a fallen world is no excuse for indifference to their plight. Instead, it should emphasize the need for the rich to contribute to the well-being of the poor (*Matt 26:6-13*).\n\n
15:12	idm22587					 **If a fellow Hebrew sells himself or herself to be your servant:** This arrangement allowed a debtor to work off financial obligations to a creditor. The limit of this arrangement was seven years (but see *15:16-17*).\n\n
15:16	idm22595					 **he loves you:** In the context of a covenant, this phrase speaks of a binding relationship with both legal and emotional overtones.\n\n
15:17	idm22602					 **push it through his earlobe:** This disfigurement publicly indicated that a bondservant had voluntarily indentured himself to his master for life. This might be what Paul meant when he said “I bear on my body the scars that show I belong to Jesus” (*Gal 6:17*).\n\n
15:18	idm22610					 **worth double the wages:** Because a bondservant worked all day, every day, his output was more than that of a day laborer, who merely put in his shift.\n\n
15:19	idm22617					 The **firstborn males** of livestock represented the firstborn sons of Israel who had been spared from death in the tenth plague (*Exod 12:12*, *29*; *13:2*, *12*; *22:29*).\n\n
15:21	idm22629					 A **defect** was any imperfection that devalued an animal; it was no sacrifice to give up something that was of little or no worth to begin with (*2 Sam 24:24*).\n\n
15:23	idm22637					 The **blood** of an animal was seen as synonymous with its life, the most sacred of God’s creations, so it was sacrilegious to **consume** it (see *12:16*).\n\n
16:1	idm22646					 The **Passover** (Hebrew *pesakh*) was the festival marking Israel’s deliverance from the tenth plague and from bondage in Egypt (see *Exod 11–12*; *Lev 23:5-8*). • The Exodus was such a significant event in Israel’s history that **the month of Abib***,* when the Exodus took place, became the beginning of Israel’s annual calendar (see *Exod 12:2*).\n\n
16:2	idm22659					 **the place . . . for his name to be honored:** The Lord’s name represented the Lord himself. When he placed **his name** in the Tabernacle or Temple, he was effectively taking up residence there (see *12:5*, *18*).\n\n
16:3	idm22669					 Although **yeast** frequently symbolizes corruption (*Lev 6:14-17*; *Matt 16:11-12*), it was avoided at the original Passover because the Israelites had no time to wait for yeast bread to rise (see *Exod 12:10-14*). The elements of the yearly Passover celebration reminded the Israelites of what God had done for them.\n\n
16:10	idm22679					 The **Festival of Harvest** took place seven weeks after Passover to celebrate the wheat harvest (*Exod 34:22*; *Lev 23:15-22*).\n\n
16:13	idm22688					 The **Festival of Shelters** is called this because the people of Israel were instructed to camp out for a week in crude huts made of tree limbs as a memorial to their years of wilderness wandering (*Lev 23:33-43*). It was also a celebration of the fall harvests.\n\n
16:16	idm22696					 Participation in the festival was required of **every man***,* but women and children could participate as well (*16:11*, *14*; cp. *Luke 2:41*).\n\n
16:18	idm22707					 The community of Israel, like any political entity, needed leaders of different kinds to provide cohesion and guidance. The Lord directed Moses to establish an appropriate leadership structure. He also laid out the criteria for selecting the leaders and the responsibilities of each office.\n\n
16:18	idm22713					 The combination of the words **judges and officials** might suggest that here the two terms are functionally synonymous. Usually **officials** is a generic title applied to any public leader, but here it seems to refer to an administrator of law and justice or something like police officers, as in modern Hebrew. • **fairly:** The idea was to measure up to an objective standard of equity that neither public nor private pressure could alter.\n\n
16:19	idm22722					 **show partiality:** See *study note on 1:16-17*.\n\n
16:21	idm22730					 **Asherah pole . . . sacred pillars:** See *study note on 7:5*; see also *12:3*; *Isa 27:8-9*; *Mic 5:13-15*.\n\n
17:1	idm22741					 A **sick or defective** animal had little monetary value, so it was no sacrifice to surrender it to the Lord (cp. *15:21*).\n\n
17:3	idm22749					 The **forces of heaven** are visible objects such as the **sun, moon,** and **stars,** as well as invisible beings such as angels. Worship of anyone or anything created by God is a clear violation of the second commandment (see *5:9*).\n\n
17:4	idm22759					 Anything offensive to the Lord could be called a **detestable thing** (see *7:25*; *12:31*; *13:14*).\n\n
17:5	idm22769					 **the gates:** A typical town in ancient Israel was small (about 10 acres or less) and crowded. It had few open areas except for a plaza just inside or outside the main gate where public meetings were held, including trials and other judicial proceedings. The place here is clearly outside of the town because stoning to death would not occur inside the walls (*22:24*; *1 Kgs 21:10*) except under unusual circumstances (*Deut 22:21*).\n\n
17:7	idm22779					 The instruction for **witnesses** to **throw the first stones** guarded against unfounded allegations. False testimony carried serious consequences. Requiring a witness to take the leading role in an execution helped guarantee the reliability of his testimony; he would personally bear the guilt if he took the life of an innocent person (see *John 8:1-11*). • **The people** would **purge the evil from among you** by executing those whose sin brought the stain of guilt upon the community of Israel (see “*Purge the Evil*” Theme Note; cp. *1 Cor 5:12-13* and *study note*).\n\n
17:8	idm22793					 **whether someone is guilty of murder or only of manslaughter:** In Old Testament law, as in modern jurisprudence, murder was intentional, manslaughter was accidental (cp. *19:1-13*).\n\n
17:9	idm22801					 **priests or the judge:** Both types of officials could decide matters of either a religious or a secular nature.\n\n
17:11	idm22808					 **do not modify it:** This Hebrew term envisions keeping on a straight path (cp. *Prov 4:25-27*; *Heb 12:13*). Once a verdict has been rendered, the sentence must be applied according to the law and the rules of evidence. Justice must be carried out on an unswerving path of fairness and righteousness.\n\n
17:12	idm22817					 **purge the evil:** The effects of evil should not be allowed to fester in the community. Like a cancer, they must be completely eradicated.\n\n
17:15	idm22824					 **the man the** Lord** your God chooses:** Human monarchy was not contrary to God’s will for Israel (cp. *1 Sam 8:6-7*)—God promised Abraham and Sarah that their descendants would include kings (*Gen 17:6*, *16*; see also *Gen 35:11*). But the abuses of kingship were condemned. The theology that views the Messiah in a kingly role (*2 Sam 7:11-15*; *Pss 2*; *110*; *Isa 9:6-7*) provides for both human and divine royalty.\n\n
17:16	idm22841					 **never return to Egypt:** Going there would show a king’s lack of dependence on God, who had redeemed Israel from bondage to Egypt. The best horses were found in Egypt (see *1 Kgs 10:28-29*).\n\n
17:17	idm22849					 **many wives:** Polygamy is neither prohibited nor sanctioned here. This guideline was meant to moderate and regulate the practice. In the ancient world, kings married many wives to cement political alliances with other kingdoms, showing trust in human power rather than God’s provision. David (*2 Sam 5:13*; *12:11*) and Solomon (*1 Kgs 11:3-4*) both ignored this warning to their own great harm and that of the nation. • **must not accumulate:** The amassing of wealth was another sign of dependence on human resources.\n\n
17:18	idm22860					 **This body of instruction** (literally *this torah*) refers to the book of Deuteronomy or perhaps only to this passage concerning the Israelite monarchy. For *torah,* see *study note on 4:44*.\n\n
18:1	idm22870					 The term **Levitical priests** described the entire **tribe of Levi**. Technically, however, only Aaron’s descendants were priests. The non-priestly Levites were their assistants (see *12:12*).\n\n
18:2	idm22879					 **The** Lord** himself is their special possession:** The allotment of the Levites was spiritual, not territorial or material. They possessed the Lord by giving their whole lives to his service. This idea is a remarkable inverse of the idea that Israel was the Lord’s possession (see *7:6*).\n\n
18:3	idm22889					 In the dietary fare of ancient Israel, **the shoulder, the cheeks, and the stomach** of oxen and sheep were the choice cuts. God’s priestly servants were to be honored by receiving the very best (see *Lev 7:28-34*).\n\n
18:8	idm22897					 **support from his family:** Although Levites were in full-time ministry at the Tabernacle and (later) the Temple, they could still hold material assets of their own (see *Num 35:1-8*). The Levites were to be supported by the regular offerings designated for that purpose without having to forfeit any of their own assets.\n\n
18:10	idm22905					 **never sacrifice your son or daughter as a burnt offering:** Some Canaanite religions included child sacrifice to appease their gods. Israel was strictly warned never to engage in this practice (*Exod 34:15-16*; *Lev 18:21*; *20:2-5*). When they did, it aroused God’s judgment (*2 Kgs 17:16-17*; *21:6*; *Ezek 23:37*). • **fortune-telling:** Throughout the ancient Near East, diviners were considered experts at reading and interpreting omens. Divination was commonly done through *extispicy,* the examination of livers, kidneys, and other internal organs of various animals. • **sorcery:** Sorcerers conjured up the spirits of the dead. • Divining cups were often used to **interpret omens** (see *Gen 44:5*). Drops of oil would be placed in containers of water, and the spread of the oil communicated some message to the expert. A parallel would be reading tea leaves. • The practice of **witchcraft** included performing unusual acts or signs (*Exod 7:11*) to mislead people (*Mal 3:5*).\n\n
18:11	idm22926					 **cast spells:** These incantations wereto destroy or injure others by invoking curses on them. The false prophet Balaam was hired for this purpose against Israel (*Num 22:2-6*). • **Mediums** and **psychics** were especially adept at conjuring up and communicating with the spirits of the dead (see *1 Sam 28:3-25*).\n\n
18:15	idm22937					 **A prophet like me** would be beyond the ordinary because Moses was without peer among the prophets (see *34:10-11*). This prophet would be **from among your fellow Israelites** (literally *from among your brothers*), and Israel was required to listen to him (*18:19*). The prophets of Old Testament Israel would partially fulfill the function of God’s spokesman to whom Israel **must listen.** Later, Judaism looked for this prophet as a major messianic figure (see *John 1:21*; *6:14*; *7:40*); the New Testament identifies Jesus as this prophet (*Acts 3:18-26*).\n\n
18:18	idm22953					 The **prophet** (*18:15*) would be the Lord’s spokesman, as Moses was (see *4:10-17*; *Exod 7:1*).\n\n
18:19	idm22963					 Not to listen to the Lord’s spokesman is not to listen to the Lord.\n\n
18:22	idm22969					 Any prophet whose **prediction** fails must be branded as false, even if he claims to speak for God. The mere claim is insufficient if it goes unfulfilled.\n\n
19:1	idm22976					 **Cities of refuge** (*19:2*) were strategically located throughout the land so those accused of homicide could find protective sanctuary until their cases came to trial (see *4:41*; *Num 35:6-29*).\n\n
19:2	idm22986					 The **three cities** were those in Canaan, west of the Jordan; there were three more in Transjordan (see *Num 35:13-14*; *Josh 20:7*).\n\n
19:4	idm22995					 A **slayer** who **kills . . . unintentionally** does not plan ahead of time to commit the act (see *17:8*).\n\n
19:6	idm23004					 **avenger** (literally *the redeemer of blood*): The law allowed murder to be avenged by members of the victim’s family. When they found the killer, they could put him to death (*Num 35:16-21*). The idea was that blood shed by the victim must be paid for by the blood of the person responsible for the act (see *Gen 4:15*; *9:6*). In this way, the land polluted by the shed blood could be purified (*Num 35:33-34*).\n\n
19:9	idm23016					 If Israel proved faithful to the covenant (*19:8*), God would grant the nation even more territory, so much so that **three additional cities of refuge** would be needed. Sadly, this need never arose because of Israel’s disobedience to the Lord.\n\n
19:11	idm23024					 The Hebrew term rendered **is hostile** (literally *is a hater*) indicates a constant and long-standing hateful attitude, which constituted evidence that the killer was predisposed to commit a crime and therefore probably did it.\n\n
19:13	idm23032					 **Purge** (literally *burn*): The only way for the land to be free of culpability in matters of homicide was for blood vengeance to be enacted, which would burn out the impurity. See also *13:5*; *17:12*.\n\n
19:15	idm23042					 The word of one witness alone would count no more than the word of the accused. However, **two or three witnesses** would confirm or discount each other’s testimony. For New Testament references to this law, see *Matt 18:15-20*; *John 8:17-18*; *2 Cor 13:1-2* and *study note*.\n\n
19:21	idm23053					 The legal principle described as **life for life** is known as *lex talionis* (“law of retaliation”), according to which the punishment must fit the crime (see *Exod 21:23*; *Lev 24:20*); it should be neither too lenient nor too severe. Appropriate punishment is a necessary function of government (cp. *Rom 13:1-7*), and it served to maintain Israel’s spiritual integrity as God’s people (see *study note on Deut 17:7*). But vengeance belongs to God, not individuals (see *1 Sam 25:26*, *33*; *Matt 5:38-39*; *1 Cor 6:1-8*).\n\n
20:4	idm23069					 **He will fight for you:** This promise affirms that God initiates wars, carries them out, and brings them to successful conclusion against his enemies. The purpose of war initiated by God was to eradicate hopelessly unrepentant enemies and prevent them from contaminating his people (see *1:30*).\n\n
20:7	idm23077					 **someone else would marry her:** In this situation, a man who died would be deprived of offspring to carry on his name, which was a great tragedy in ancient Israel.\n\n
20:10	idm23084					 The people in the land had already been placed under the ban (*7:1-6*), so this instruction refers to those whom Israel would engage outside the land (*20:15*).\n\n
20:11	idm23092					 **forced labor:** Involuntary service was pressed upon prisoners of war and sometimes on Israelites (*1 Kgs 5:13-18*; *9:15*, *21*; *12:18*).\n\n
