Reference	ID	Tags	SupportReference	Quote	Occurrence	Note
9:5	idm53977					 The Levites’ prayer praised God for his **glorious** reputation, his sole divinity, his creation of the universe, his providential care for life on **earth,** and his worship by **angels.** Putting the focus on God brought Israel’s present circumstances into proper perspective.\n\n
9:7	idm53986					 God’s actions with **Abram**—calling him (*Gen 12:1-3*; *15:7*), giving him a new name and identity (*Gen 17:5*), making a covenant with him (*Gen 15:6-21*; *17:4-5*), and fulfilling his promises of land and descendants (*Gen 15:18-21*)—demonstrated God’s faithfulness and inspired confidence about what God would do in the future.\n\n
9:9	idm53999					 God had paid attention to his people’s **misery** under foreign domination (*Exod 2:23-25*; *3:7*; *14:10-14*), which was analogous to their present situation (*Neh 9:32-37*).\n\n
9:10	idm54010					 **You have a glorious reputation:** In the Exodus, God had demonstrated his character with plagues, parting the sea, and defeating the arrogant Egyptian army (*Exod 15:5*, *9-10*, *19*).\n\n
9:12	idm54020					 This prayer reminded the people of God’s miraculous direction of Israel in the wilderness (*Exod 13:21-22*), his personal appearance at **Mount Sinai** to reveal his covenant laws through Moses (see *Exod 19–20*), and his faithfulness in providing **bread . . . and water** (see *Exod 16:4*; *17:1-6*). Despite all of that, Israel’s **ancestors** had been **proud and stubborn** and **refused to obey** (see *Exod 32*; *Num 14:4*). Yet in his grace, God remained faithful and had compassion (see *Exod 34:6*) and provided his Spirit to direct and teach them (cp. *Exod 33:2*; *Num 11:17*).\n\n
9:24	idm54040					 **You subdued whole nations:** See *Josh 6–12*.\n\n
9:25	idm54048					 Cp. *Deut 6:10-11*; *8:6-10*. • **they were full and grew fat:** Prosperity proved to include spiritual danger (see *Deut 8:11-20*).\n\n
9:26	idm54058					 The prayer recounts the pattern in the book of Judges (see *Judg 2:11-23*).\n\n
9:28	idm54065					 The people did not learn from mistakes made in the period of the judges (*9:26-27*), and the same pattern of disobedience emerged during the subsequent monarchy (cp. *2 Kgs 17*). Despite the nation’s persistent disobedience (*Neh 9:29*), God was persistent in his **love***,* patience, compassion, and guidance through the **Spirit** and **through the prophets**.\n\n
9:32	idm54078					 **And now:** The prayer moves to the current situation, petitioning **the great . . . God**—who has **unfailing love**—for continued love and mercy to his people in their present difficult situation (*9:32*). The leaders recognized God’s justice in punishing them for their sins (*9:33-35*), and they lamented their enslavement under the Persians (*9:36-37*).\n\n
9:38	idm54090					 **The people***,* embracing the prayer, renewed their dedication to God and his word. They signed their names to indicate their commitment (*9:38–10:27*) and took an oath to live by the covenant (*10:28-39*).\n\n
9:38	idm54100					 **making a solemn promise . . . putting it in writing:** These actions indicate a serious vow of faithfulness to the covenant. The **sealed document** had legal standing.\n\n
10:1	idm54108					 The eighty-four names included **the governor: Nehemiah** (*10:1*), and a group of **priests** (*10:2-8*; cp. *12:1-7*), **Levites** (*10:9-13*; cp. *9:4-5*; *12:8-9*), and **leaders** (*10:14-27*; cp. *3:4-31*).\n\n
10:28	idm54126					 **separated themselves from the pagan people:** See *9:2*; cp. *Ezra 9–10*.\n\n
10:29	idm54135					 **swore a curse on themselves if they failed to obey the Law:** Cp. *Lev 26:14-35*; *Deut 28:15-62*.\n\n
10:30	idm54144					 Although the community had committed itself broadly to all the instructions in the law of Moses, some specific issues were being addressed in this commitment. These issues related to maintaining the purity of the community and worship at the Temple.\n\n
10:30	idm54150					 Cp. *Ezra 9–10*.\n\n
10:31	idm54157					 Ceasing trade on the Sabbath was necessary for covenant faithfulness (cp. *13:15-22*; see *Exod 16:29*; *20:8-11*; *31:15*; *Num 15:32-36*; *Amos 8:5*). • **Every seventh year:** See *Exod 23:10-11*; *Lev 25:2-7*; *Deut 15:1-3*.\n\n
10:33	idm54173					 **Bread of the Presence:** See *Lev 24:5-9*; *Num 28:1-8*. • **everything necessary:** With the money from the annual tax, priests could purchase the animals for daily sacrifices and maintain the **Temple** complex (cp. *2 Kgs 12:11-12*; see also *Exod 30:11-16*).\n\n
10:34	idm54186					 Because the fire **on the altar** burned continually (*Lev 6:12*), a good deal of wood was used. The Gibeonites provided it at an earlier time (*Josh 9:27*), but now it was a joint responsibility.\n\n
10:35	idm54195					 Offerings from the community provided food for **the priests** and **Levites***,* who had no allocations of agricultural land and no means of providing for themselves. These provisions came from **the first part of every harvest** (see *Exod 23:19*; *34:26*; *Num 18:12-13*; *Deut 26:1-11*), the redemption money of five shekels paid for the **oldest sons** and the **firstborn** of all the **herds and flocks** (see *Exod 13:13*; *34:20*; *Num 18:15-17*), as well as **a tenth of everything** (see *Num 18:21-24*; *Deut 14:22-29*).\n\n
10:37	idm54218					 The **Levites** collected the tithes **in all . . . rural towns** and sent a tenth of that collection to the Temple in Jerusalem (see *Num 18:25-32*).\n\n
11:1	idm54227					 The narrative returns to the issue of repopulating the secure city of Jerusalem (see *7:1-5*). The list of names roughly parallels the list in *1 Chr 9:2-17*.\n\n
11:1	idm54235					 **Sacred lots** were probably the Urim and Thummim (*10:34*; *Josh 7:14*, *16-18*; *14:2*).\n\n
11:4	idm54246					 **Perez** was one of Judah’s sons (*Gen 38:29*).\n\n
11:16	idm54254					 **The work outside the Temple** probably included collecting tithes from people and caring for the tithes in storehouses (*10:37-39*; see also *1 Chr 26:29*).\n\n
11:17	idm54263					 **a descendant of Asaph:** David had chosen Asaph and his sons to provide music for the Temple worship (*1 Chr 25:1-8*). Asaph’s descendants took up this role again when the new Temple was built.\n\n
11:21	idm54271					 **The hill of Ophel** was high ground just south of the Temple (*3:26*). It provided an ideal location to house those who worked in the Temple.\n\n
11:24	idm54279					 The **royal adviser** informed the king of events in Jerusalem and notified Jewish officials of the king’s **public administration** of Persian policies.\n\n
11:30	idm54287					 **all the way from Beersheba . . . to the valley of Hinnom:** Earlier descriptions of places where people settled concentrated on areas north of Jerusalem (ch *3*; *11:31-36*); this list (*11:25-30*) reflects progressive expansion of places where Jewish people lived as they occupied many of their preexilic towns, both north and south of Jerusalem.\n\n
12:1	idm54297					 These lists of priests and Levites include a list of those who originally returned from exile with Zerubabbel (*12:1-9*), a chronological list of high priests (*12:10-11*), and the priests and Levites who served at the time of Joiakim, the high priest at the time of Nehemiah and Ezra (*12:12-26*).\n\n
12:1	idm54306					 **priests and Levites who returned with Zerubabbel . . . and Jeshua:** See *Ezra 1:1-5*. Only those who could prove their priestly lineage could serve at the Temple, so it was important to maintain an accurate genealogical record of these families.\n\n
12:7	idm54314					 **leaders of the priests:** Cp. *Ezra 2:36-39*. • **Jeshua** was the high priest in Jerusalem when the people returned from captivity shortly after 538 BC (*Ezra 2:2*; *3:2*, *8*; *4:3*). He was still serving in 520 BC when Haggai and Zechariah encouraged the people to finish building the Temple (*Ezra 5:1*; *Hag 1:1*; *Zech 3:1*).\n\n
12:8	idm54332					 **Their associates . . . stood opposite:** To provide antiphonal singing (*12:24*; *Ezra 3:1-11*).\n\n
12:10	idm54341					 **Joiakim** probably served in the early years of Ezra’s service. • **Eliashib** and **Joiada** served during Nehemiah’s time (*3:1*; *13:4*, *28*). • **Johanan:** An Aramaic papyrus document from a Jewish colony that settled in Elephantine, Egypt (about 410 BC) and Josephus (*Antiquities* 11.5.4, AD 93) both mention Johanan serving after Nehemiah’s time.\n\n
12:12	idm54357					 This list was probably compiled **when Joiakim was high priest** (*12:12*) to verify the legitimacy of the priests and Levites who were in office. Except for the omission of Hattush (see *12:2*), this list contains the same names as *12:1-7*.\n\n
12:27	idm54367					 **The dedication of the new wall** probably happened shortly after its completion (*6:15-19*). This account probably came from Nehemiah’s personal memoirs.\n\n
12:27	idm54375					 Since few **Levites** had returned to live in Jerusalem (see *Ezra 2:40-42*; *8:15-19*), all those **throughout the land** were recruited to create two impressive choirs and orchestras. • **Netophathites** were from near Bethlehem (*1 Chr 2:54*). • **Beth-gilgal** was near Jericho. • **Geba** and **Azmaveth** were in the territory of Benjamin.\n\n
12:30	idm54390					 The dedication ceremony required that **the priests and Levites** be **purified** and ready to enter the Temple area (see *Exod 19:10*; *Num 8:5-7*).\n\n
12:31	idm54400					 This impressive march **proceeded southward along the top of the wall to the Dung Gate** at the southern end of the city (*3:13-14*). Then the procession continued north on the wall along the east side of the city, past the ruins of **the house of David** and up to the **Water Gate** (*3:26*; *8:1*) near the Temple.\n\n
12:35	idm54412					 Long, slender, metal **trumpets** were played for festive, joyous occasions (*1 Chr 13:8*; *15:23*; *16:6*, *42*; *Ezra 3:10*) by the descendants **of Asaph.**\n\n
12:38	idm54425					 **The second choir . . . went northward,** up the western wall past the **Broad Wall** (*3:8*), the **Old City Gate** (*3:6*), and the **Fish Gate** (*3:3*), then across the northern side of the wall until it came to the **Sheep Gate** (*3:1*) on the northeast corner of the Temple. • The **Guard Gate** might be the Inspection Gate (*3:31*).\n\n
12:43	idm54442					 This community celebration included everyone. God was the true source of their **great joy** because his power had enabled them to accomplish the huge task of rebuilding the walls. *Psalm 147* might have been written for this occasion.\n\n
12:44	idm54450					 **On that day***,* the day of the dedication of the wall (*12:44*; *13:1*), **men were appointed** to take care of the tithes and gifts given for the physical needs of the priests and Levites. Their duties were **to collect** the gifts of the people for the priests and Levites (*10:32-39*; see also *Exod 30:11-16*; *38:25-26*), to perform **the service of their God** (probably sacrifices; see *Lev 1–5*), and to oversee **the service of purification** of those people who were unclean. They also purified pans, knives, and clothing used in Temple worship as described in *Lev 11–15* (see also *1 Chr 23:28*).\n\n
12:46	idm54470					 **David** had given instructions for ordering the music at the Temple (*1 Chr 23–26*), and he had put **Asaph***,* along with Heman and Jeduthun, in charge of the music (*1 Chr 25:2-5*).\n\n
12:47	idm54481					 From the time of the first returnees to Jerusalem **in the days of Zerubbabel** in 538 BC (*Ezra 3:1*) until the time of **Nehemiah** around 445 BC, Israelites brought food for those working at the Temple. Most of the **Levites** lived in cities around the country; they collected the tithe and brought a tenth of what they received to the Temple in Jerusalem to support its ministry (see *Neh 10:38-39*).\n\n
13:1	idm54494					 On the **same day** the Temple workers were appointed (*12:44*), the text from *Deut 23:3-6* was read. It said that **no Ammonite or Moabite should ever be permitted to enter the assembly of God.** Nehemiah later discovered (*Neh 13:4-14*) that these teachings were no longer being observed.\n\n
13:4	idm54505					 **Eliashib the priest** (see *12:10*, *22*; *13:28*) had stopped following the practice of excluding the Ammonites and Moabites (*13:1*), and the people quit giving their tithes to the Levites (*13:10-12*). Now, Nehemiah corrected these problems.\n\n
13:4	idm54517					 **Eliashib**’s family intermarried with the families of Sanballat (*13:28*) and **Tobiah**. Both of these men were enemies of the Jewish community (*2:10*, *19*; *4:1*). Tobiah’s use of the storeroom meant there was less room to store tithes and gifts for the Temple workers (cp. *10:39*; *13:10-12*; *2 Chr 31:11*) and less space for supplies needed to conduct regular worship at the Temple (*Lev 2*).\n\n
13:6	idm54533					 Nehemiah had returned to Persia after twelve years of service in Jerusalem (445–433 BC). The text does not say how long he stayed there, but it was probably no longer than a year or two. When he arrived back in Jerusalem, he found Tobiah living in the Temple storeroom (*13:1-5*).\n\n
13:8	idm54541					 **I became very upset. . . . I demanded:** When people rejected God’s instructions, Nehemiah refused to be silent. • Everything associated with the Temple had to be **purified** and consecrated to God. The clothes that the priests and Levites wore (*Exod 29*), the priests themselves (*Lev 8–9*), the Temple building and altars (*Lev 16:15-33*), and all the holy things (*1 Chr 23:28*) were purified (cp. *2 Chr 29:5*, *15-19*).\n\n
13:10	idm54555					 With Tobiah using the storeroom, there had been no place to store tithes to feed the Levites and Temple singers (*Num 18:21-24*; see *Neh 12:44*, *47*). They had to farm outside of Jerusalem (*12:28-29*) to support themselves and could not serve in the Temple.\n\n
13:13	idm54565					 **These men had an excellent reputation:** Cp. *Acts 6:1-6*.\n\n
13:14	idm54573					 Because he stood up for God, Nehemiah asked God to **remember** his deeds and not abandon him in his time of need. Perhaps he experienced opposition from those he had corrected. See similar refrains in *13:22*, *29*, *31*.\n\n
13:15	idm54583					 Nehemiah instituted two additional reforms to restore proper Sabbath observance (*13:15-22*) and proper marriage practices (*13:23-31*). These two sections have similar structures: Nehemiah discovered a problem, corrected the problem, and asked God for his blessing.\n\n
13:15	idm54591					 Normal work was to cease **on the Sabbath** in order to keep it holy (*Exod 20:8-11*; *31:14-17*; *35:2-3*; *Jer 17:19-27*).\n\n
13:19	idm54602					 The Sabbath began at sunset on **Friday evening** and lasted until sunset on Saturday evening.\n\n
13:22	idm54609					 **Have compassion on me:** Nehemiah’s prayer implies that he felt the pressure of this unpopular decision. He knew that God’s **unfailing love***,* not his own popularity, would sustain him.\n\n
13:23	idm54618					 The earlier marriage reforms (*9:2*; *10:28*; *Ezra 9:1–10:44*) had not lasted. The children’s inability to speak Hebrew (**the language of Judah**) was disastrous because they could not read or understand the Scriptures.\n\n
13:25	idm54628					 When Nehemiah **called down curses on them***,* it was because the parents avoided Hebrew and did not teach their children the language of the Hebrew Bible. A curse called on God to remove his blessing on people. • **I beat some of them and pulled out their hair:** Apparently, some of the men did not accept Nehemiah’s rebuke at first, so he **made them swear in the name of God** not to intermarry with pagans.\n\n
13:26	idm54638					 **King Solomon** had led the nation **into sin by his foreign wives** (*1 Kgs 11*). If intermarriage with pagans was allowed to continue, the same apostasy would overtake the community. Nehemiah would not let that happen.\n\n
13:28	idm54647					 Even the family of **the high priest***,* who were supposed to be Israel’s spiritual leaders, had participated in the sin of intermarriage with unbelieving foreigners (cp. *Lev 21:14*). Nehemiah **banished** the offender, stripping him of status and removing his rights in the Jewish community.\n\n
13:29	idm54657					 **Remember them, O my God:** Many would probably resent Nehemiah’s aggressive attack on intermarriage in the family of the high priest. So he prayed for God’s judgment to fall on these spiritual leaders who **defiled the priesthood**.\n\n
13:30	idm54665					 These final verses summarize Nehemiah’s reform. The emphasis on **making certain** and making **sure** shows that Nehemiah checked to see that the people did what they agreed to. He held people accountable for their commitments and did not allow for half-hearted reform.\n\n