Reference	ID	Tags	SupportReference	Quote	Occurrence	Note
27:18	idm19461					 **Joshua** had a solid background for the role (cp. *Exod 17:8-16*). He had been Moses’ assistant for a long time (*Num 11:28*; cp. *Exod 33:11*). He was also one of the faithful spies (*Num 13–14*) who knew the people of Israel well. Joshua possessed **the Spirit** and recognized the special presence of God in his life (cp. *11:25-29*). His relationship with God also gave him wisdom for the tasks ahead (e.g., *Deut 34:9*). • **lay your hands on him:** This act symbolized the transfer of authority from an elder statesman to his assistant (cp. *Num 8:10-14*). Moses did this **publicly** so that Joshua’s leadership would be incontestable.\n\n
27:20	idm19478					 Joshua assumed only **some** of Moses’ **authority**. Moses had face-to-face contact with God (*12:6-8*; *Deut 34:10-12*), but Joshua had only indirect access to revelation, since he had to consult with **Eleazar the priest** on important matters (*Num 27:21*; cp. *Exod 28:30*; *Lev 8:8*). Israel would keep military and spiritual leadership separate hereafter.\n\n
28:1	idm19492					 These two chapters contain information about Israel’s ritual calendar, including a list of required daily, weekly, and monthly offerings and a list of annual religious events. Thus Israel was instructed to worship God “properly and in order” (*1 Cor 14:40*). The annual cycle of sacrifices involved a tremendous investment of animals, grain, oil, and wine. Israel marked these special days by stopping their normal work, a kind of sacrifice that recognized the importance of these holy days. This annual cycle included eight different occasions for worship, all of which recalled Israel’s relationship with the Lord. Each worship event included a different combination of burnt, grain, liquid, and/or sin offerings. • For details on the grain and liquid offerings, see *Num 15:1-16*. For explanations of the different types of offerings, see *Lev 1:1–7:38*. For a description of Israel’s festivals, see *Lev 23:1-44*. For the New Testament perspective on the Old Testament sacrificial system, see *John 1:29*; *Rom 12:1*; *Heb 9:9-15*; *10:1-2*; *1 Pet 2:5*.\n\n
28:1	idm19507					 The Lord accepted **special gifts** (cp. *15:3*) as **a pleasing aroma***,* a figurative expression describing God’s acceptance and enjoyment of these gifts (see also *Gen 8:21*; *Lev 1:9*; *Eph 5:2*; *Phil 4:18*). Offerings were made at **appointed times** according to specific **instructions** (see *Num 28:3–29:39*).\n\n
28:2	idm19524					 **they are my food:** See study notes on *Exod 29:18*; *Deut 8:2*.\n\n
28:3	idm19533					 The daily offering was the foundation of the sacrificial system. Its practice was **instituted at Mount Sinai** (see *Exod 29:38-46*). • **alcoholic drink:** Cp. *Num 6:3*; *Lev 10:9*; *Deut 14:26*.\n\n
28:9	idm19545					 Special days called for additional offerings. The **Sabbath day** required a sacrifice over and above the **regular burnt offering and its accompanying liquid offering**. Other passages highlight the importance of the Sabbath (e.g., *Exod 20:8-11*; *Lev 23:3*; *Deut 5:12-15*).\n\n
28:11	idm19556					 The offering of the **first day of each month**—the New Moon—called for the sacrifice of bulls, rams, and lambs as burnt offerings, along with a male goat as a sin offering.\n\n
28:16	idm19563					 The Passover, followed by the Festival of Unleavened Bread, was the first of five great annual festivals; it was held in early spring (March~April). The Passover required no public sacrifices—it was a family occasion celebrated at home (see also *9:1-4*; *Exod 12:1–13:10*; *Lev 23:5-8*; *Deut 16:1-8*). This festival played a special role in the background of the Last Supper (see *Matt 26:17-19*, *26-27*; *Mark 14:12*; *John 11:55*; *12:1*; *13:1*; *18:28*, *39*; *19:14*, *31*; cp. *1 Cor 5:7*).\n\n
28:26	idm19584					 The **Festival of Harvest** was later called the Festival of Pentecost (see *Acts 2:1*); see also *Lev 23:15-22*. It celebrated the end of the barley harvest and the beginning of the wheat harvest in early summer (May~June). The Greek name *Pentecost* means “fiftieth day” (i.e., after Passover; see *Acts 20:16*; *1 Cor 16:8*).\n\n
29:1	idm19596					 **the Festival of Trumpets:** See also *Lev 23:23-25*.\n\n
29:7	idm19604					 **The Day of Atonement** was a solemn occasion, a day of fasting (see also *Lev 16*; *23:26-32*; *Rom 3:23-25*; *Heb 9:7-12*, *23-28*).\n\n
29:7	idm19616					 **Ten days later, on the tenth day of the same month:** It is celebrated today as Yom Kippur (from Hebrew *yom hakkippurim**,* *Lev 23:27*).\n\n
29:12	idm19626					 **The Festival of Shelters** began on the fifteenth day of the seventh month. It was an eight-day harvest celebration (*29:12*, *35*; *Exod 34:22*) that required an enormous number of offerings. This harvest festival was an especially joyous occasion and a time for thanksgiving (see *Neh 8:13-18*). The shelters also reminded the Israelites of dwelling in tents during their wilderness sojourn (see also *Lev 23:33-43*; *1 Kgs 8:1-2*).\n\n
29:39	idm19639					 Public offerings were supplemented by a variety of **voluntary** individual gifts (cp. *Lev 23:38*).\n\n
30:1	idm19647					 Vows were an important way to express devotion or piety, but were sometimes made in haste and were often forgotten. Voluntary pledges were commonly made on special religious occasions or in times of war. Perhaps the reference to vows and voluntary offerings (*29:39*) prompted the further discussion here (cp. *15:3*; see also *6:1-21*; *Lev 5:4-5*; *27:1-34*; *Deut 23:21-23*). These instructions were applied in the case of Hannah and Elkanah (*1 Sam 1:1-28*). Such practices, which included fasting, continued into the New Testament period (e.g., *Matt 6:16*; *15:3-9*; *Acts 18:18*; *21:23*). Vows of females—young and unmarried or adult and married—were subject to approval by the responsible male who would be a financial partner in the vow. Nobody, male or female, young or old, should make a vow to God and then neglect it.\n\n
30:1	idm19664					 Vows included promises of offerings (e.g., Hannah’s vow, *1 Sam 1*) and pledges of abstinence (e.g., the Nazirite vow, *Num 6*). Jesus made reference to the instruction regarding vows in the Sermon on the Mount (*Matt 5:33*).\n\n
30:3	idm19673					 A **young woman** was under the authority of **her father***,* who was responsible for her actions and her financial obligations.\n\n
30:6	idm19682					 When a **young** Hebrew **woman** married, she came under the authority of **her husband***,* who could void the obligations of a **vow or pledge** made by his wife while she was under her father’s authority by nullifying it as soon as he heard about it.\n\n
30:9	idm19693					 A **widow** or a **divorced** woman usually returned to her father’s family (*Lev 22:13*), but a mature single woman who made a vow or pledge was required to **fulfill** her religious duties.\n\n
30:10	idm19703					 A **married** woman also needed the approval of **her husband** to make vows and pledges. Her husband could **nullify** her religious promise, but he had to make this decision on the day he heard about it. God did not hold the married woman guilty of breaking this promise if her husband cancelled it in the proper manner (cp. *30:5*, *8*, *12*). The self-denial mentioned in *30:13* probably refers to fasting. If he raised no objection, the husband’s silence implied consent. He could not delay in his objection, or he would incur the guilt of a broken vow (cp. *Lev 5:4-13*).\n\n
31:1	idm19717					 The Lord ordered Moses to lead Israel in a war of retaliation against the Midianites, who had joined the Moabites in leading the Hebrews into idolatry (ch *25*). The **Midianites** were a tribal people who inhabited the arid and semiarid regions south and east of Palestine and east of the Jordan River; they were counted among the “people of the east” (*Judg 6:3*, *33*; *7:12*). They lived in camps or settlements and were famous for their knowledge of desert transportation (cp. *Gen 37:28*, *36*; *Isa 60:6*). While they were descended from Abraham (*Gen 25:1-2*) and had been friendly toward Moses (*Exod 2:15–3:1*; cp. *Num 10:29*), the elders of Midian had joined Balak in hiring Balaam to curse Israel (*22:4*, *7*), whose presence threatened the peoples of Transjordan (the region east of the Jordan).\n\n
31:3	idm19736					 **Each tribe** contributed **1,000 men** for the **battle***,* which enabled all of them to gain experience in combat and share in the victory.\n\n
31:6	idm19746					 **Phinehas son of Eleazar** (the high priest) led this force of 12,000 into battle. His leadership helped to define this engagement as “holy war,” an act of revenge for the spiritual harm that Midian had inflicted on Israel (cp. *25:6-18*; *31:15-16*). His zeal in this situation (*Num 25:11*, *13*) was equal to what he demonstrated in the case of Zimri and Cozbi (*25:7-8*). • Many believe that **holy objects of the sanctuary** meant the Ark, which the Hebrews sometimes carried into battle (e.g., *10:35-36*; *Josh 6:6*; *1 Sam 4:3-11*; cp. *Num 14:44*). Others suggest that they were a variety of sacred vessels associated with the Tabernacle rituals (*3:31*; *4:15*; *18:3*; cp. *1 Kgs 8:4*; *1 Chr 9:29*; *2 Chr 5:5*). The Israelites probably took some or all of these holy objects as symbols of God’s participation in their holy war.\n\n
31:7	idm19769					 The Israelites **killed all** of the Midianite **men** in the particular groups they attacked from their camp in the plains of Moab (*31:12*), not all of the people who were part of the larger Midianite confederation (cp. *Judg 6–8*). The number of animals and virgins mentioned in *Num 31:32-35* indicates that the 12,000 Hebrews fought a sizable enemy force.\n\n
31:8	idm19780					 **Balaam son of Beor** deserved to die because his counsel “caused the people of Israel to rebel against the Lord at Mount Peor” (*31:16*). Balaam was punished for his villainous deeds (cp. *2 Pet 2:15*; *Jude 1:11*).\n\n
31:9	idm19791					 After the battle, the Hebrews began the practice that they sometimes followed throughout the period of conquest and beyond (e.g., *Josh 6*; *8*; *10–11*). They destroyed their enemies (sometimes the total population), burned towns, and set aside spoils for their own use or as dedicated to the Lord.\n\n
31:10	idm19800					 **towns and villages:** These were larger settlements and smaller unfortified encampments.\n\n
31:13	idm19807					 **outside the camp:** Probably to keep from contaminating the Tabernacle and all of the people, the returning troops were subjected to purification rituals because of their contact with corpses (*31:19-24*).\n\n
31:14	idm19815					 **Moses was furious:** God had commanded total destruction, but the Midianite **women** who had **followed Balaam’s advice** and were largely responsible for the apostasy of Baal-peor had wrongly been given clemency.\n\n
31:17	idm19824					 Only young virgin women were to be spared, since they had not participated in the incident at Baal-peor.\n\n
31:19	idm19830					 Israelite warriors who had contact with corpses subjected themselves and their equipment to routine, but important, purification rituals (see *5:1-4*; *19:1-22*).\n\n
31:25	idm19838					 The **plunder** was divided **into two** equal **parts***,* with half going to those who fought against the Midianites and half going to the Israelites who stayed behind (cp. *1 Sam 30:21-25*). In this sense, everyone participated in the armed conflict, but the relatively small number of warriors each received a larger portion than the much larger number of those who stayed behind.\n\n
31:32	idm19849					 The total number of animals and young girls who were not killed was quite large, which indicates that Israel fought against many Midianites.\n\n
31:36	idm19855					 The **plunder** was distributed according to the principles established in *31:25-30*.\n\n
31:48	idm19863					 Though it is unusual for no soldiers from an army to be killed in battle, it is not impossible. Classical authors also reported battles in which few or no Roman soldiers were killed. If the Israelites had the advantages of preparation, surprise, and overwhelming force, they could have defeated the Midianites and lost no troops, especially in light of God’s blessing.\n\n
31:50	idm19869					 The commanders gladly offered **gold** objects in gratitude for a great victory that resulted in no loss of life (cp. *Exod 30:12*). Ancient art and literature indicate that the Midianites and other desert peoples, both males and females, wore gold jewelry as adornment and as a form of portable wealth (e.g., *Judg 8:24-26*). **Moses and Eleazar** brought this large collection **to the Tabernacle** as a memorial of this special event (cp. *Num 16:39-40*; *Zech 6:14*).\n\n
32:1	idm19882					 From the time that Israel occupied the central part of the area east of the Jordan—during the military encounters described in ch *21*—Israel had been preparing to invade Canaan. At a moment when the Hebrews needed to safeguard their unity, two tribes asked to settle east of the Jordan River.\n\n
32:1	idm19889					 **vast numbers of livestock:** The Israelites had flocks and herds when they left Egypt (cp. *Exod 12:38*); they acquired many more animals as loot in the war with Midian (cp. *Num 31:32-33*) and perhaps in their victories over Sihon and Og (*21:21-35*). • **Gilead** can refer either to the whole northern region of the plateau east of the Jordan (e.g., *32:29*) or only to the part of that territory between the Jabbok and the Arnon.\n\n
32:3	idm19901					 Reuben, Gad, and half of Manasseh settled in the land that Israel had recently captured from Sihon the Amorite and Og of Bashan (cp. *21:21-35*). • **Ataroth, Dibon, Jazer, Nimrah, Heshbon,** and **Elealeh** have been linked with archaeological sites. • The location of **Sibmah** is unknown. • Though the location of a town called **Nebo** is unknown, it was certainly near a mountain or ridge of that same name, which was located along the escarpment that rises above the northern end of the Dead Sea. • The site named **Beon** is almost certainly the place called “Baal-meon” in *32:38*, which probably corresponds to the ruins at Ma’in.\n\n
32:6	idm19914					 Moses assumed that Reuben and Gad wanted to stay east of the Jordan River to avoid the dangers that awaited the other tribes in Canaan (cp. chs *13–14*).\n\n
32:12	idm19921					 **Caleb** is identified as a **Kenizzite,** a descendant of Esau (cp. *Gen 36:10-11*). Apparently Caleb was not a native Israelite, but a convert who was so thoroughly integrated into the life and faith of Israel that he was called upon to represent the tribe of Judah when the twelve scouts were sent out to survey the Promised Land (*Num 13:6*).\n\n
32:16	idm19931					 The Reubenites and Gadites assured Moses that they would not discourage their fellow Israelites and would support the war to its very end. There were still dangers east of the Jordan River, so they wanted to safeguard their livestock and families.\n\n
32:20	idm19937					 Moses accepted the terms offered by Reuben and Gad. If they joined their kindred in fighting the Canaanites, they would fulfill their end of the agreement and could then return to their settlements east of the Jordan (*32:22*). If they failed to keep their promise, it would be a serious sin against God (*32:23*).\n\n
32:25	idm19945					 Reuben and Gad did in fact fulfill the agreement (*Josh 4:12-13*; *22:1-9*).\n\n
32:28	idm19953					 Israel’s leaders—**Eleazar, Joshua,** and the heads of **clans**—would help enforce Moses’ terms (cp. *Josh 22:1-2*) since his death was imminent.\n\n
32:31	idm19962					 **Gad and Reuben** reaffirmed their pledge before all of Israel’s leaders.\n\n
32:33	idm19969					 The tribes of **Gad** and **Reuben***,* along with **half the tribe of Manasseh***,* settled east of the Jordan (e.g., *Deut 3:12-13*; *4:43*; *29:7-8*). These tribes occupied territory and towns taken from **King Sihon** the Amorite and **King Og of Bashan** (*Num 32:33*; see *21:21-35*). • **Half the tribe of Manasseh** suddenly appears in the discussion of territorial distribution. Part of Manasseh settled east of the Jordan River, while another part of the tribe settled in Canaan, west of the Jordan (cp. *Josh 17:1-12*; *22:7*).\n\n
32:34	idm19990					 The precise locations of **Atroth-shophan***,* **Jogbehah***,* and **Beth-haran** are unknown. **Aroer** was located on the northern rim of the Arnon canyon.\n\n
32:37	idm20002					 If **names of some of the towns** were **changed** to avoid pagan associations (e.g., “Baal,” the well-known Canaanite god, or “Nebo,” a Babylonian deity; see *Isa 46:1*), the alternate designations are not provided here.\n\n
32:39	idm20011					 Three clans of Manasseh conquered part of Gilead and Bashan (cp. *Deut 3:13-15*; *Josh 13:29-31*). The location of **Nobah** remains uncertain (cp. *Judg 8:11*). • **Towns of Jair:** Hebrew *Havvoth-jair* (cp. *Deut 3:14*; *Josh 13:30*; *Judg 10:4*; *1 Kgs 4:13*; *1 Chr 2:21-23*).\n\n
33:1	idm20028					 This review of the entire wilderness period contains the longest integrated list of place-names in the Old Testament, from Israel’s departure from Egypt (*33:3*; cp. *Exod 12:37*) until their arrival in the plains of Moab, opposite Jericho (*Num 33:49*; cp. *22:1*). The forty-two way stations on this itinerary represent far more than a geographical journey; they recall Israel’s forty-year spiritual pilgrimage. In their travels between Rameses in Egypt (*33:3*) and AcaciaAbel-shittim on the plains of Moab (*33:49*), Israel finally became the people who could invade the land of Canaan and claim the promises God made to Abraham. • This itinerary does not provide enough data to plot an accurate, specific route. Most of the places cannot be identified with certainty; many of the sites appear nowhere else in the Hebrew Bible, and there are not enough clues to pinpoint their locations precisely. Furthermore, this list is partial or selective, omitting some of the place-names mentioned earlier in the journey.\n\n
33:1	idm20040					 The itinerary contains features that reflect detailed record keeping. This is the only place where Numbers says that Moses kept a record of Israel’s history (cp. *Exod 24:4*).\n\n
33:3	idm20047					 **left defiantly:** See *Exod 14:8*.\n\n
33:4	idm20055					 **defeated the gods of Egypt:** See *Exod 6:6*; *12:12*. This historical review draws attention to those special events that forced Pharaoh to allow the Israelite exodus from Egypt.\n\n
33:5	idm20064					 For Israel’s wilderness itinerary between **Rameses** and the desert of **Sinai***,* see *Exod 13:17–19:1*.\n\n
33:6	idm20074					 **Etham:** See *Exod 13:20*.\n\n
33:9	idm20082					 **Elim** remains impossible to identify with certainty, but it may have been the oasis (with springs and palm trees) at Wadi Gharandel.\n\n
33:14	idm20089					 The entry for **Rephidim** (see *study note on 20:13*) adds a reminder of Israel’s rebellion there (*Exod 17:1-7*).\n\n
33:15	idm20098					 Tradition associates the **wilderness of Sinai** with a mountainous region in the southern Sinai Peninsula near Jebel Musa (Arabic for “mountain of Moses”), though scholars have suggested other locations.\n\n
33:16	idm20105					 The journey between **Sinai** and **Kadesh**. Our ability to locate the named sites depends on the identification of Mount Sinai.\n\n
33:16	idm20113					 **Kibroth-hattaavah . . . Hazeroth:** See *11:34–12:16*.\n\n
33:18	idm20121					 Most of the place-names in this section appear nowhere else in the Old Testament.\n\n
33:30	idm20127					 **Moseroth** was also called “Moserah” (*Deut 10:6*). This is where Aaron died and was buried (cp. *Num 20:22-29*; *33:37-39*).\n\n
33:35	idm20137					 **Ezion-geber** (cp. *Deut 2:8*) was located near the northern end of the Gulf of Aqaba.\n\n
33:36	idm20145					 Israel was residing in **Kadesh** (*13:26*; *27:14*; “Kadesh-barnea,” *32:8*) when the spies reported on their trip through Canaan.\n\n
33:37	idm20155					 Israel traveled from **Kadesh** to **the plains of Moab**.\n\n
33:38	idm20163					 These details about Aaron’s death (cp. *20:22-29*) and his age show that he was about three years older than Moses (cp. *Deut 31:1-2*; *34:7*).\n\n
33:42	idm20172					 Good candidates for the locations of most of these sites are found east of the Jordan between the southern Arabah and the plains of Moab, opposite Jericho.\n\n
33:47	idm20178					 **Almon-diblathaim** is probably the same place as “Beth-diblathaim” (*Jer 48:22*), also mentioned in the famous Mesha Inscription (see *study note on Num 21:26*).\n\n
33:50	idm20187					 After the Israelites reached **the plains of Moab opposite Jericho** (*22:1*), they camped there for the rest of the period covered in Numbers (see *36:13*) and Deuteronomy (*Deut 34:8*). While they were camped there, God gave Israel specific **instructions** for dealing with the population of Canaan. The Lord commanded his people to destroy the people groups that occupied Canaan and to obliterate all vestiges of their religious practices (cp. *Exod 23:23-33*; *34:11-17*; *Deut 7:1-6*; *12:2-4*; *Josh 23:4-8*). Moses’ commands included the destruction of **their carved and molten images** (cp. *Lev 26:1*) and the demolition of their **pagan shrines** (see *Deut 12:2-3*).\n\n
33:54	idm20207					 **distribute the land . . . by sacred lot:** See *26:53-56*. *Chapter 34* describes the boundaries of the land of Canaan, which they would soon conquer and divide.\n\n
33:55	idm20216					 Israel failed to carry out God’s instructions (*33:51-53*) and suffered the consequences predicted here (see *Judg 1:1–2:5*; *2:11–3:6*). Israel’s enemies in the period of the judges were like **splinters** and **thorns** (*Num 33:55*), harassing them militarily and spiritually (cp. *2 Cor 12:7*).\n\n
34:1	idm20229					 *Chapter 34* gives the borders of **the land of Canaan***,* which Israel was to settle according to the guidelines in *26:52-56*. Ever since the call of Abraham (*Gen 12:1-7*), the Promised Land of Canaan had stood at the heart of the Old Testament story. Though an entire generation of Hebrews died in the wilderness because they refused to believe the report of the faithful spies (*Num 13*), God had reaffirmed his promise of land (*33:53*). Here, God reviewed the plan and identified the boundaries of the Promised Land in an idealized form (cp. *Josh 13–19*; *Ezek 47–48*). Old Testament Israel did not possess the exact extent of the territory described here (though it came close in the days of David and Solomon; e.g., *2 Sam 24:1-9*), but these borders describe the region of Canaan as generally defined by Egyptian texts dating 1500–1200 BC (the period of the Hebrew invasion). The region actually occupied by Israel changed from time to time.\n\n
34:3	idm20246					 Portions of the southern boundary of Canaan were familiar to Israel from earlier experiences in **the wilderness of Zin** on the northwestern **edge of Edom** (see chs *13–14*). This southern frontier ran east to west in an arc from the southern end of the **Dead Sea** to **the Mediterranean Sea**.\n\n
34:4	idm20257					 From the southern end of the Dead Sea, the boundary ran through **Scorpion Pass** toward **Zin** (cp. *13:21*). The **southernmost point** was **Kadesh-barnea** (cp. *13:26*). **Hazar-addar** and **Azmon** are unknown.\n\n
34:5	idm20271					 **The Brook of Egypt** (not to be confused with the Nile) designates the wadi that separates the land of Canaan from Egypt; it drains toward **the Mediterranean Sea** (cp. *1 Kgs 8:65*). In Old Testament times, Israel exercised little control over this southern coastal region.\n\n
34:6	idm20280					 The natural **western boundary** of Canaan was the **Mediterranean** coast (*34:6*). The **northern boundary** began at the Mediterranean and ran eastward to **Mount Hor** somewhere in the Lebanon range (not the place of Aaron’s death, *20:22-29*). • **Lebo-hamath:** Cp. *13:21*; *1 Kgs 8:65*; *Amos 6:14*.\n\n
34:11	idm20296					 **Sea of Galilee:** Its **eastern edge** (literally *shoulder*) is the ridge that rises rather abruptly from its eastern shoreline.\n\n
34:12	idm20305					 The natural eastern border of Canaan followed the **Jordan River** down to the **Dead Sea**. As part of the Great Rift Valley, the Jordan and the Dead Sea were formidable, though not impassable, barriers. This boundary excluded the lands east of the Jordan that were occupied by Reuben, Gad, and the half-tribe of Manasseh. Those settlements were not part of Canaan per se and stood outside the Promised Land as originally defined.\n\n
34:13	idm20313					 **you are to divide . . . by sacred lot:** Cp. *26:55-56*. Because of the settlement of two and a half tribes (**Reuben, Gad, and half the tribe of Manasseh**) in Transjordan (cp. *32:33*), Canaan was to **be divided among the nine and a half remaining tribes**.\n\n
34:16	idm20324					 Eleazar (the high priest) and Joshua (the political leader) were to divide the land among the remaining tribes. The ten tribal leaders who would help them are listed in *34:19-28*.\n\n
34:19	idm20331					 **Caleb son of Jephunneh** is the only tribal leader who appears elsewhere in Numbers (*13:6*, *30*; *14:6-38*). Nearly all of the older generation had already died during the wilderness period (*Num 26:63-65*), but the two faithful spies were still leading their people.\n\n
