Reference	ID	Tags	SupportReference	Quote	Occurrence	Note
1:1	idm16119					 The Israelites prepared to leave for the Promised Land by registering all the troops eligible to participate in the conquest. The nation was transitioning from slavery to nationhood.\n\n
1:1	idm16125					 One family leader from each tribe (except Levi) was appointed to count Israel’s men of fighting age.\n\n
1:1	idm16131					 In the **year after Israel’s departure from Egypt, the** Lord frequently communicated his will to the people through **Moses** and gave them every opportunity to conform to his divine plan. • God’s self-disclosure often took place at the **Tabernacle** (literally *the Tent of Meeting*; see *study note on Exod 27:21*). • **The wilderness of Sinai** was a great, terrifying, and inhospitable desert (*Deut 1:19*). This relatively unpopulated region was the anvil on which God forged Israel as the environmental challenges of Sinai tested Israel’s dependence upon the Lord throughout the book of Numbers. Sinai reminded later biblical authors of the law and of Israel’s rebellious spirit (*Ps 106:19*; *Heb 12:25-26*).\n\n
1:2	idm16147					 **men twenty years old or older who are able to go to war:** In this effort to register Israel’s men of military age, more information was gathered than in the previous registration (cp. *Exod 38:26*). • **the tribes and the names of the leaders:** Hebrew culture was tribal, built around clans and families. The tribal leaders were readily identified and appear again as a group in *Num 7*. • Moses and Aaron did not include Levi’s tribe in this registration, since it had a special status in Israelite society (cp. *1:47-53*; *26:51-62*; *Deut 18:5*; *33:8-11*).\n\n
1:16	idm16161					 These tribal **leaders** had apparently shown themselves responsible and trustworthy by fulfilling other important duties.\n\n
1:17	idm16168					 The tabulation yields the same number of qualified men (**603,550**) as mentioned in *Exod 38:26*. *Exodus 12:37* and *Num 11:21* give an approximate number of 600,000. These numbers have been interpreted in different ways. They might reflect the literal size of this army (cp. *Exod 1:9-10*); alternatively, the figures might be symbolic, projected backward from a later period, or simply misunderstood in translation. See also *study note on Exod 12:37*.\n\n
1:20	idm16180					 In this second list of the tribes, **Gad** is placed alongside **Reuben** and **Simeon***,* the tribes with whom Gad would camp while Israel was on the march.\n\n
1:47	idm16190					 The tribe of Levi did not serve in Israel’s army with the other tribes. This section of Numbers describes the organization of **Levites** for service in the Tabernacle, which was their primary responsibility.\n\n
1:50	idm16197					 **The Levites** inherited the task of erecting, dismantling, transporting, and guarding **the Tabernacle**. By keeping unauthorized persons from getting too close or desecrating it, they protected the Hebrews **from the** Lord**’s anger**.\n\n
1:50	idm16208					 **Tabernacle of the Covenant:** This portable sanctuary symbolized the presence of the Lord and represented Israel’s covenant relationship with him.\n\n
2:1	idm16215					 Israel’s camps were to be organized by tribal groupings. This arrangement may have reflected concerns for social status, access to water, and security for the Tabernacle, which represented the Lord’s presence. The Egyptian army from approximately this same era camped in a similar defensive formation to protect the sacred objects that accompanied their field campaigns.\n\n
2:2	idm16221					 Each area of the Hebrew **camp** was identified by **family banners***,* which were probably flags or streamers (*1:52*). The use of such tribal symbols or battle flags finds an analogy in modern bedouin life, where the divisions of tribe, clan, and family have long held great importance. • The tribes camped around the sanctuary at a safe distance (cp. *Josh 3:4*) that respected the gap between God’s holiness and the non-Levitical tribes.\n\n
2:3	idm16232					 The tribes of **Judah, Issachar, and Zebulun** camped in the most prestigious place **on the east side of the Tabernacle** and led the way when Israel was on the move. This largest of the tribal groups (**186,400**) could provide adequate protection for the sacred tent and its attendants.\n\n
2:10	idm16241					 The tribes of **Reuben, Simeon, and Gad** camped **on the south**. With their **151,450** warriors, they took second place in the line of march.\n\n
2:18	idm16250					 The tribes of **Ephraim, Manasseh, and Benjamin** marched behind the Tabernacle and the Levites.\n\n
2:25	idm16257					 The tribes of **Dan, Asher, and Naphtali** brought up the rear.\n\n
2:34	idm16264					 The Hebrews initially obeyed God by camping and marching in the manner Moses had specified, but this obedient spirit did not last for long.\n\n
3:1	idm16270					 The duties of Israel’s priests and Levites included the transportation, assembly, safety, and upkeep of the Tabernacle. The physical arrangement of Israel’s tribes reflected concern for these activities.\n\n
3:1	idm16276					 **The family line of Aaron** provided the professional priests who led Israel’s worship. Aaron’s four sons were the foundation of Israel’s priesthood; they stood in God’s presence and served him on behalf of the people. They were appointed to lead the people and serve the Lord as ministers in the Tabernacle and as guardians of God’s covenant with his people.\n\n
3:4	idm16283					 The deaths of **Nadab and Abihu** (see *Lev 10:1-2*) highlighted the importance of guarding the holiness of the sanctuary and of strict obedience to God’s instructions (*Num 26:61*; *Lev 16:1*; *1 Chr 24:2*; cp. *Acts 5:1-11*; *1 Cor 10:6-11*; *11:29-30*). • **Eleazar and Ithamar:** See “*Eleazar*” Profile.\n\n
3:5	idm16299					 The Levites were appointed as **assistants** to the priests, who were represented by **Aaron**. Their ministry included **sacred duties** (*3:7*) in maintaining **the Tabernacle** and its **furnishings** (*3:8*; described in greater detail in *4:1-33*).\n\n
3:10	idm16313					 The **sanctuary** was sacred (*1:51*; *3:38*; *18:7*); it was not to be approached by the unqualified (cp. *3:4*).\n\n
3:11	idm16324					 **The firstborn sons . . . of Israel** belonged to God, having been spared when the Egyptian firstborn sons died (*3:13*; see *Exod 11–12*). **The Levites** were **chosen . . . to serve as substitutes** in their place.\n\n
3:14	idm16335					 This first phase of a two-stage registration **of the tribe of Levi** (see *4:34-49* for stage two) summarized each family group’s special responsibilities (described in greater detail in *4:1-33*). This numbering was not linked with military duties, so it enrolled male Levites from the age of one month (*3:40-41*). • Three family groups are descended from **Gershon, Kohath, and Merari,** the three sons of Levi. These clans (often called the Gershonites, Kohathites, and Merarites) later inherited the “cities of refuge” (*Josh 21*) and filled various important posts in the Jerusalem Temple (*2 Chr 29:3-17*).\n\n
3:27	idm16348					 Aaron and Moses, sons of Amram, were **descendants of Kohath** (see *Exod 6:18*, *20*, *26*). Because they were caretakers of the **sanctuary** (the Most Holy Place) and its very sacred furnishings (described in *Num 3–4*), the Kohathites were the most highly regarded of the three clans.\n\n
3:28	idm16360					 **8,600:** Some Greek manuscripts read *8,300*. The “six” (Hebrew *shsh*) in 8,600 could result from misreading a “three” (Hebrew *shlsh*).\n\n
3:32	idm16370					 **Eleazar***,* Aaron’s third son, presided over the Levites as **administrator** (perhaps as an executive secretary), while his father dealt with other matters; he had **special . . . oversight** of the Tabernacle (*4:16-20*). He played an important role in Israel’s wilderness period and later succeeded his father as high priest (see *16:37-39*; *19:3-6*; *20:25-28*; *26:1-3*).\n\n
3:38	idm16385					 The preeminent campsite east of the Tabernacle **was reserved for . . . Moses***,* Aaron, and his priestly sons.\n\n
3:39	idm16393					 **22,000:** The numbers listed for each clan (*3:22*, *28*, *34*) add up to 22,300. See *study note on 3:28*.\n\n
3:40	idm16404					 There were 273 more **firstborn sons in Israel** (in the non-Levite tribes) than there were Levite males (cp. *3:39*). Because the Levites served **as substitutes** for the firstborn of Israel (*3:41*; see *study note on 3:11-13*), a **redemption price** (*3:48*) of **five pieces of silver** (*3:47*) had to be paid for each of the **extra firstborn sons** (*3:46*; cp. *Lev 27:6*). It is not clear who covered this cost. This provision for a special class of substitutes points to Christ’s role as a substitute; through his death, Christ paid the **redemption price** for all humanity (see *Mark 10:45*; *Gal 3:13*; *Eph 1:7*; *Heb 9:15*).\n\n
4:1	idm16427					 This section expands the discussion begun in *3:21-37* on the duties of the three clans of Levites. The Levites—on the march and encamped—carried and cared for the Tabernacle and were always surrounded by the other tribes so that they and their precious cargo would be safe (*2:17*). The sacred things associated with God were placed in the middle of the tribes, and the role of the priests and their Levitical assistants was to keep them holy by keeping them separate. • God, in his holiness, is worthy of attention to the details of his will. His Tabernacle and its furnishings were sacred, and the tribe of Levi was responsible to maintain the distinction between holy and common, between clean and unclean. This explains why so much information is provided about the duties of the three clans of Levites.\n\n
4:1	idm16435					 **Moses and Aaron** were mediators of God’s will regarding the care and transport of the Tabernacle, the primary charge of the three Levitical families.\n\n
4:3	idm16442					 Of the 22,000 Levites (*3:39*), only **men between the ages of thirty and fifty***,* those in the prime of their life, were allowed to serve in the sanctuary. The summary of this registration (another “numbering”) found in *4:34-49* gives the total number of qualified males as 8,580.\n\n
4:4	idm16452					 **The duties of the Kohathites** (see *3:27-32*) are listed first because they performed a special service related to **the most sacred objects** (perhaps because Aaron and the priests came from this clan; *1 Chr 6:2-3*). The tasks of carrying, setting up, and disassembling these sacred coverings and furnishings were extremely important. All the things entrusted to Kohath’s descendants—**the Ark of the Covenant***,* the table of **the Bread of the Presence***,* **the lampstand** (Hebrew *menorah*), **the gold incense altar***,* and **the altar for sacrifices**—held tremendous value. These objects are first described in *Exod 25–30*, but Numbers shows how they were integrated into Hebrew life. The Kohathites carried these items on poles or in frames, and they were not to **touch** them or **enter the sanctuary to look at** them on penalty of death.\n\n
4:15	idm16474					 Aaron and his surviving sons Eleazar and Ithamar had to cover **the sanctuary and all the sacred articles** completely before the camp was **ready to move***,* with the groups of non-Levitical tribes marching before and behind the Levites who carried the Tabernacle. The royalty of these objects is seen in the symbolic colors of the coverings, and their sacredness underlies the stern warning that even though the Kohathites were the designated handlers, **they must not touch the sacred objects, or they** would **die**. Such respect marked the holiness of Israel’s Lord. The dangers of disregarding these instructions are apparent in *1 Sam 6:19-20* and *2 Sam 6:6-7*.\n\n
4:21	idm16487					 The men of the **Gershonite** clan (see *3:21-26*) were **responsible for general service and carrying loads** (*4:24*). This involved handling the curtains and coverings, ropes, and related equipment that was less central to Israel’s worship. Their duties focused on the Tabernacle in general instead of on the sacred objects of the inner sanctuary that were the responsibility of Kohath’s clan.\n\n
4:29	idm16497					 Even this assignment to the **Merarite** clan, which focused on items of lesser priority than those handled by the Kohathites and Gershonites, had to be done in a specific way, and **the various loads** were assigned **to each man by name** (*4:32*; cp. *1 Cor 14:40*). While the Gershonites and Merarites lacked the status of Kohath’s family, each group contributed to the process of moving and erecting the Tabernacle.\n\n
4:34	idm16508					 The process of numbering and recording the Levites’ names and making sure that each man understood his assignment was an important step in organizing Israel to travel and camp in the correct manner and in safeguarding the Tabernacle.\n\n
5:1	idm16514					 These legal matters were to ensure the purity of the Israelites, their priesthood, and the Tabernacle. Such regulations drew constant attention to ancient Israel’s identity as a theocracy of which Moses was the primary spokesman.\n\n
5:1	idm16520					 These laws concern purity, restitution, and marital faithfulness.\n\n
5:1	idm16526					 Modern Westerners find the need for ceremonial or ritual purity difficult to understand. Westerners view skin diseases, bodily discharge, and contact with corpses as concerns of health and hygiene, but the primary issue in the Old Testament is guarding God’s holiness against ceremonial uncleanness (see *Lev 11–15*). The community had to safeguard the holiness of the camp so that unclean things or people did not ceremonially defile things associated with the Lord (*Num 5:2-3*). The community had to choose between having God in the camp or letting a defiled person remain in the camp, because both could not remain (*5:3*). • The importance of purity extends from Leviticus and Numbers to the book of Revelation: All that is ceremonially unclean will be forbidden to enter the New Jerusalem where God resides (see *study note on Rev 21:27*). In the New Testament, however, impurity is limited to what is morally impure (*Acts 10:28*; *Eph 5:5*; *1 Thes 2:3*; *4:7*).\n\n
5:2	idm16540					 **skin disease:** The Hebrew word used here describes various skin diseases that were regarded as contagious (cp. *Lev 13–14*). • **Discharge** refers to fluids associated with sexual organs (*Lev 15*; cp. *Luke 8:43-48*). • **touching a dead person:** See *Num 6:6-11*; *19:11*.\n\n
5:5	idm16554					 Guidelines regarding confession and **restitution** for wrongdoing emphasize the strong Hebrew concern for morality (*Lev 6:1-7*).\n\n
5:6	idm16562					 Doing something wrong to another human being is the same as betraying—literally *breaking faith with*—the Lord (cp. *5:8*). A right relationship with God produces right relationships with people; a wrong relationship with others shows a wrong relationship with the Lord.\n\n
5:7	idm16570					 This **restitution** and the guilt offering (see *Lev 6–7*) associated with the sin was intended to inculcate a heightened sense of individual responsibility to God’s holiness.\n\n
5:8	idm16578					 Because sin is ultimately against God (*5:6*; *Ps 51:4*), the perpetrator had a moral obligation to make restitution **to the** Lord*,* who authorized the human victims of the sin to receive that payment; if none were living, the Lord received payment through the priest. Perpetrators also had to offer a valuable sacrifice that restored their ritual purity (*Num 5:1-4*) and their relationship with God. • **purified and made right with the** Lord**:** See *study note on Lev 1:4*.\n\n
5:9	idm16594					 Priests supported their families partly by receiving a share of the sacrifices. In some instances, surplus sacrifices could be sold to provide funds for the priesthood, for maintaining the sanctuary, and for other religious needs (cp. *1 Cor 8:4-13*).\n\n
5:11	idm16601					 This detailed test for adultery, a “trial by ordeal,” is the only such case found in the Old Testament, though trial by ordeal was a common procedure in the ancient Near East. God had a special interest in safeguarding marriage as the foundation of Hebrew society, and the purpose of this ordeal was to promote marital faithfulness. We cannot determine how commonly such ordeals actually occurred. This procedure appealed to God’s own intervention to ensure justice in cases lacking evidence (cp. *1 Cor 5:5*).\n\n
5:14	idm16608					 **The husband** presented his case before **the priest***,* and the “ritual law for dealing with suspicion” (*5:29*) took the husband’s jealousy and suspicion to a higher court.\n\n
5:17	idm16618					 The **holy water** and the **dust** were sacred because of their association with the sanctuary.\n\n
5:21	idm16626					 **when he makes you infertile, causing your womb to shrivel:** Literally *when he causes your thigh to waste away.* “Thigh” is a euphemism for the reproductive organs (cp. *Gen 24:2*; *47:29*); something would go wrong with her reproductive abilities. The punishment suited the crime as sexual immorality resulted in the inability to have children.\n\n
5:23	idm16636					 The symbolism of drinking disturbing words is repeated in *Ezek 2:8–3:3* and *Rev 10:8-11*.\n\n
5:29	idm16644					 As the trial by ordeal is summarized and justified, it is clear that a husband’s questions about his wife’s guilt or innocence did not burden him with any guilt. We might raise the question of a double standard, but it was very common for ancient laws to draw attention to the woman’s failure in the matter of adultery. However, Israel’s legal system provided for the punishment of both parties to an affair (as in *Lev 20:10*; *Deut 22:21-22*).\n\n
6:1	idm16652					 The voluntary Nazirite vow allowed men or women to set themselves apart for the Lord. There was considerable variation in how the Nazirite lifestyle was practiced in various periods of Hebrew history. Vows were taken very seriously in ancient times as a well-established means of expressing devotion or gratitude to God. This vow could be temporary or permanent; it involved refraining from alcoholic drinks, hair cutting, and contact with corpses. Nazirite restrictions gave members of non-Levitical tribes a way to enter into a more demanding and highly respected relationship with God. The Nazirite vow is probably best known because of Samson (*Judg 13–16*). See also *1 Sam 1:11*; *Jer 35*; *Acts 18:8*; *21:23-26*; cp. *Luke 1:15*.\n\n
6:2	idm16664					 **Nazirite:** The Hebrew term *nazir* is derived from a verb that means “to separate.”\n\n
6:3	idm16672					 The law required priests to avoid drinking **wine** before they served in the Tabernacle (*Lev 10:9*); the Nazirite vow allowed non-Levites to broaden that law to include all places, all times, and **anything that comes from a grapevine**.\n\n
6:5	idm16681					 Hair had special symbolic significance (cp. *Lev 19:27*); religious persons often left their hair uncut or shaved it off entirely (*Num 8:5-7*). The Israelites were not expected to leave their hair entirely uncut, but the Nazirites were.\n\n
6:6	idm16689					 Dead bodies defiled whoever touched them (*9:6-10*). Priests were only allowed to touch the dead bodies of close relatives (*Lev 21:1-4*), but even that was forbidden to Nazirites.\n\n
6:9	idm16697					 Provisions were made for restoring purity in cases of unavoidable contact with a corpse. Special procedures and offerings brought the period of the Nazirite vow to a conclusion. A stern warning is added about actually fulfilling the vow (*6:21*).\n\n
6:22	idm16704					 The priestly benediction is related to the overall theme of worship and purity in chs *5–6*. This is a prayer on behalf of the people as the priests sought God’s blessings for Israel. Since the priest represented God, such prayer was part of the priestly duty (cp. *Lev 9:23*; *Deut 10:8*). This prayer is not unlike Jesus’ high priestly prayer in *John 17*.\n\n
6:24	idm16714					 *Psalm 67:1* contains an abbreviated version of this benediction, much like one inscribed on a silver amulet excavated at Ketef Hinnom, southwest of Jerusalem’s Old City. On a second, larger silver amulet from the same tomb, the complete benediction was inscribed in words almost identical to those here. In the days of the Second Temple (from Ezra to the time of Jesus), priests pronounced a blessing at each day’s sacrifice or at the end of services. This blessing is still used in Jewish and Christian liturgy as a way of seeking divine blessing (as in *6:27*).\n\n
6:24	idm16722					 The blessings sought in the first half of this verse include health, wealth, and fertility, while the protection mentioned in the second half was needed for all manner of dangers. This supplication is echoed in the language of *Pss 121:3-8*; *140:4*; *and 141:9*. These heartfelt appeals are still good models for prayer and for the blessings that God’s people can seek for all humanity. The entire poem draws attention to the Lord as the source of all good things.\n\n
6:25	idm16731					 The desire for God’s **smile** is often translated more literally *may he make his face shine upon you.* • **be gracious to you:** God’s people need his grace and mercy in a dangerous world (cp. *Pss 31:16*; *67:1*; *80:3*, *7*, *19*).\n\n
6:26	idm16745					 God’s **favor**—the display of his face, or countenance—refers to his approval and special attention (cp. *Ps 30:7*). Divine **peace** (Hebrew *shalom*) is not just the absence of conflict or violence; God’s peace brings complete well-being, health, and wholeness.\n\n
6:27	idm16755					 The priests were the mediators of God’s covenant with Israel, so their duty was to pray for God’s people and invoke his blessing on them. Jesus has the same role in relation to the church (see *Rom 8:34*; *Heb 2:17-18*; *4:14-16*).\n\n
7:1	idm16764					 This detailed description of offerings presented by Israel’s twelve tribes at the dedication of the Tabernacle includes the dedicatory gifts brought on twelve successive days.\n\n
7:1	idm16770					 **The day Moses set up the Tabernacle** was the first day of the second year after the Exodus (*Exod 40:1-2*). • Once Moses finished setting up the Tabernacle, he **anointed and set apart** (or *consecrated*) its furnishings, the altar, and its utensils (cp. *Exod 40:9-10*; *Lev 8:10-11*). As the locus of sacrifice, the altar held special importance among the sacred furniture.\n\n
7:2	idm16782					 The same tribal leaders that assisted in the registration of ch *1* are found in *7:2-3*. The non-Levitical tribes supplied the Gershonites and Merarites with the wagons and oxen needed to transport the heavy structural components of the Tabernacle and other items (cp. ch *4*). • These vehicles and draft animals were the first offerings from the Hebrew tribes (*7:2*); these practical gifts were accompanied by more elaborate dedicatory offerings that were also presented by the tribal leaders (*7:10*, *12-83*).\n\n
7:9	idm16794					 A later Israelite attempt to transport the Ark by cart ended in tragedy (*1 Sam 6:8*, *11*; *2 Sam 6:3*, *6-7*).\n\n
7:10	idm16804					 In addition to the wagons and oxen, the tribal leaders also presented gifts of silver and gold vessels and other religious offerings **for the altar at the time it was anointed.** Beginning with the tribe of Judah, the tribal leaders brought these gifts to the Tabernacle on twelve consecutive days. The gifts came from items collected from the Egyptians when Israel departed from Egypt (cp. *Exod 12:35-36*; *25:3*).\n\n
7:12	idm16813					 One by one, the tribal leaders brought their dedicatory gifts and offerings until the entire Hebrew confederation had participated. The repetitious pattern of describing each tribal gift emphasizes the communal nature of this ceremony; all tribes played a role in consecrating their place of worship. The detailed listing might reflect the meticulous record keeping of an archive or ledger. As noted in the record for each tribe, the **silver** vessels contained **grain offerings***,* and the **gold** vessels held **incense**. Every tribe also brought animals as **a burnt offering***,* **a sin offering***,* and **a peace offering***,* as specified in Leviticus.\n\n
7:84	idm16830					 The gifts and offerings of each tribe having been described, this paragraph tabulates these expensive containers, their offerings and incense, and the sacrificial animals. These large and costly gifts and sacrifices drew attention to the importance of the altar, the Tabernacle, and the God who was served there. The sacrifices were required by law; the Hebrews presented the special gifts with a generous spirit.\n\n
7:89	idm16836					 Once **the Tabernacle** had been dedicated and set apart as holy, it was the center of divine revelation. There **Moses** spoke with God, God’s will was disclosed, and his presence came to rest (*Lev 16:2*, *13-17*). Such communication emanated from the Ark of the Covenant **between the two cherubim above the Ark’s cover***,* also known as the “mercy seat” (cp. *Exod 25:17-22*). • For the Israelites, this was the special place associated with atonement, even as the Cross has assumed that significance in Christian faith (see *Heb 9–10*, especially *Heb 9:5*). God’s voice, as heard by Moses the mediator, fulfilled the expectation established by *Exod 25:22* and *Num 30:6*. The Lord’s presence guaranteed the holiness of Israel’s wilderness sanctuary.\n\n
