Reference	ID	Tags	SupportReference	Quote	Occurrence	Note
8:1	idm16853					 Here are specific guidelines for the placement of the elaborate **lampstand** (Hebrew *menorah**;* see *Exod 25:31-40*) in the Tabernacle. Since the inside of the Tabernacle was dark, the illumination provided by this stylized tree of lamps aided Israel’s worship.\n\n
8:5	idm16863					 The Lord prescribed the dedication and cleansing of the Levites.\n\n
8:7	idm16869					 The ceremony to make the Levites **ceremonially clean** consisted of sprinkling with water, shaving all hair, and donning clean clothes; this resembled the ceremonies of cleansing from ritual defilement. • **water of purification:** This expression appears only here. This sprinkling symbolized the washing of sin from their lives and thus contained some of the symbolic significance of later Jewish washings and even of Christian baptism. Perhaps this water was the same as the sin-removing mixture that included ashes from the red heifer mentioned in *19:9* (see *Heb 9:13*). • The requirement to **shave their entire body** was also part of the process of being declared clean from the ritual impurity of defiling diseases (*Lev 14:8*). • The washing of clothing accompanied all instances of cleansing from ritual defilement (e.g., *Lev 15:5-27*).\n\n
8:10	idm16882					 By the laying on of hands, Israel recognized the Levites’ special status and offered them as their representatives before the Lord (*8:16*).\n\n
8:11	idm16889					 The reference to Aaron’s raised hands suggests that Israel offered the Levites to the Lord as a “wave offering”—the type of offering lifted up to the Lord (cp. *Lev 7:30*). The Levites were dedicated to duties that made them “living and holy sacrifices” (cp. *Rom 12:1*).\n\n
8:12	idm16897					 The Levites had to offer appropriate sacrifices before they performed their duties in the Tabernacle (*8:15*).\n\n
8:19	idm16904					 A **plague** was an appropriate punishment for unlawful actions (*11:33*; *14:37*).\n\n
8:23	idm16913					 Guidelines regarding the Levites’ length of service. • Whereas *4:3* states that their Tabernacle service began at age 30, *8:24* gives the age as 25. The discrepancy might reflect age requirements followed in different periods when the number of Levite men available for service varied, or those aged 25–29 may have been considered unofficial workers or apprentices. • Both passages establish the retirement age at 50; retired Levites could serve the Tabernacle as guards (cp. *Ps 84:10*).\n\n
9:1	idm16922					 **A year after Israel’s** exodus **from Egypt***,* the time came for Israel to celebrate their second Passover **in the wilderness of Sinai**. Those unable to celebrate it on time were given permission to do so a month later.\n\n
9:2	idm16932					 The Hebrews were told to celebrate **the Passover at the prescribed time** (see *Exod 12:6*). • **at twilight:** The Hebrew day begins at sundown.\n\n
9:4	idm16941					 When it was time to celebrate the Passover, some men were prevented by the restrictions of *Lev 7:20-21*. Their objection arose from a desire to keep the regulation in a case where there seemed to be no good way for them to do so.\n\n
9:8	idm16948					 Moses agreed to inquire of the Lord regarding this difficult case (cp. *7:89*).\n\n
9:9	idm16955					 God’s response to the quandary was to allow a makeup ceremony one month later for two special cases (see also *2 Chr 30*), but with this provision he warned that the Israelites must not neglect the Passover and must celebrate it according to the regulations.\n\n
9:12	idm16962					 The bones of the Passover lamb were not to be broken (see *Exod 12:46*; *Ps 34:20*; *John 19:32-36*; cp. *John 1:29*; *1 Cor 5:7*). The apostle John made reference to this instruction when reporting that Jesus’ legs were not broken on the cross (*John 19:36*).\n\n
9:13	idm16974					 If they ignored the required **Passover***,* they must **be cut off from the community.** It is not clear whether this refers to the death penalty or banishment (see *study note on Lev 7:20-21*).\n\n
9:14	idm16984					 **Foreigners** who lived among the Hebrews and wanted **to celebrate the Passover** could do so by following **the same laws***,* but circumcision was required for males who desired to eat the Passover meal (see also *Exod 12:48-49*).\n\n
9:15	idm16995					 This passage parallels *Exod 40:17*, *34-38* and provides additional details about God’s use of the pillar of cloud and fire to lead his people (see also *Exod 13:21-22*). The Lord faithfully and unmistakably guided his people in the wilderness.\n\n
9:19	idm17004					 The fiery cloud, witnessed even by Israel’s enemies (*14:14*), was a clear symbol of God’s glorious presence and the means by which he directed their movement.\n\n
10:1	idm17011					 Israel needed signals that were loud and clear so that the tribes could receive instructions. Two silver trumpets provided a simple, effective means to signal all the tribes to move. • These trumpets were not the ram’s horns (Hebrew *shopar*) mentioned frequently in the Old Testament (e.g., *Josh 6:4-6*); they were fashioned by Israelite craftsmen from **hammered silver** brought out of Egypt.\n\n
10:2	idm17020					 The **two trumpets** were used to get people’s attention for important pronouncements (cp. *Rev 8–11*).\n\n
10:5	idm17028					 When it was time to **break camp***,* the sound of the trumpets supplemented the movement of the pillar of cloud (cp. *9:15-22*) by signaling when to camp and when to move on (see ch *2*).\n\n
10:8	idm17038					 **Only the priests . . . are allowed to blow the trumpets:** All uses of these trumpets were related to God and his government of Israel, both of which the priests served.\n\n
10:9	idm17045					 **The trumpets** marked holy events that might not readily be recognized as such. Trumpets that sounded a call to arms (*Hos 5:8*; *Joel 2:1*) would **remind . . . the** Lord to rescue the Hebrews from their enemies.\n\n
10:11	idm17056					 Leaving Sinai was a pivotal moment in Israel’s history. Now the Israelites had the law and would be tested as to how they would keep it. The departure from Sinai was the beginning of the march toward Canaan, though it turned into a long journey (cp. *Deut 1:6-8*, *19*). This passage summarizes the daily procedures on the journey.\n\n
10:12	idm17064					 **The Israelites** marched to **the wilderness of Paran,** an arid or semi-arid region in the northeastern part of the Sinai Peninsula, south of the Negev and west of the Dead Sea/Arabah Rift (cp. *Gen 21:21*).\n\n
10:13	idm17073					 The order of march is different here than in *2:3-34*, which specifies that all three clans of Levites were to carry the Tabernacle and its furnishings in the middle of the troop, between the groups headed by Judah and Reuben and the groups headed by Ephraim and Dan. Here, the Gershonites and Merarites carried the components of the Tabernacle structure between Judah and Reuben, and the Kohathites carried the most sacred furniture between Reuben and Ephraim. This useful arrangement allowed time for the Gershonites and Merarites to set up the Tabernacle before the Kohathites arrived with the sacred objects. It also provided security for their special cargo, and it spread the Levites out among the tribes, perhaps enhancing the leavening effect of their influence (cp. *Matt 13:33*; *16:6*, *11-12*; *1 Cor 5:6-7*).\n\n
10:29	idm17084					 After the trek toward Paran had begun, Moses took the practical step of asking **his brother-in-law, Hobab** (cp. *Judg 4:11*), to join the Israelites as their **guide** (literally *to serve as Israel’s eyes*) and so to share in their promised blessings. As a Midianite shepherd, Hobab knew the routes and possible sources of food and water in this region of the Sinai Peninsula. • **Reuel the Midianite:** See “*Jethro (Reuel)*” Profile. • **my own land and family:** Midian was probably in northwestern Arabia. *Judges 1:16* suggests that Hobab accepted the appeal.\n\n
10:33	idm17098					 **The mountain of the** Lord refers here to Mount Sinai; elsewhere the expression refers to Mount Moriah or Zion in Jerusalem (*Gen 22:14*; *Ps 24:3*; *Isa 2:3*; *Zech 8:3*).\n\n
10:35	idm17110					 Moses’ invocation, spoken when **the Ark set out***,* acknowledged the Lord as a warrior who would give Israel the Promised Land and called him to fight Israel’s battles (cp. *Ps 68:1*).\n\n
10:36	idm17119					 This invocation called the Lord to join his people and protect Israel while they camped.\n\n
11:1	idm17125					 This is one of many occasions in the wilderness when Israel was disobedient to the Lord.\n\n
11:1	idm17131					 **Soon the people began to complain. . . . Then the** Lord**’s anger blazed:** The link between Israel’s complaints and God’s anger is a major theme of Numbers and throughout the Old Testament (e.g., *Deut 9:22*; *Ps 78*). God is holy and just, and he demands obedience from his people. Complaints are equivalent to rejecting him (cp. *Num 11:20*). • **their hardship:** Mount Sinai had provided a stable residence for a year; the road to Paran provided heat, thirst, and fatigue. • **fire . . . destroyed some:** Cp. *Lev 10:2*.\n\n
11:2	idm17146					 The people sought Moses’ intercession again (cp. *Exod 15:25*; *32:11-14*), which brought an end to the fire of God’s judgment. • **Taberah:** Cp. *Num 11:34-35*; see *Deut 9:22*.\n\n
11:4	idm17157					 Israel had not relinquished the attitude that brought about the judgment at Taberah (*11:1-3*), so they readily joined the **foreign rabble** in craving the delicacies of Egypt, forgetting the misery of slavery there.\n\n
11:4	idm17165					 **Oh, for some meat!** The Israelites had flocks and herds (e.g., *32:1*; *Exod 12:32*, *38*; *17:3*; *34:3*), but the animals were more valuable for their dairy products and other benefits produced while alive and were only butchered for meat on a selective basis. The Hebrews would not have had enough meat to feed such a large population regularly (cp. *Num 11:21-22*).\n\n
11:6	idm17178					 The Lord had earlier provided **manna** and quail (*Exod 16*).\n\n
11:7	idm17186					 **The manna** has often been explained as one of various edible substances that occur naturally (but see *Deut 8:3*); even so, its quantity and duration were miraculous.\n\n
11:10	idm17194					 The Israelites’ persistent **whining** led a frustrated Moses to register his own complaints with God. With biting sarcasm, Moses reminded God that he had not wanted this job in the first place (cp. *Exod 4:10*). Israel became such a burden that Moses wished that God would do him the favor of killing him (cp. *Job 6:9*). • Moses’ complaint was acceptable, unlike the complaints of the people, because he was seeking the Lord rather than pining for the delights of Egypt.\n\n
11:16	idm17203					 When Jethro proposed a judicial hierarchy (*Exod 18:13-26*), he was concerned with practical matters, as were the tribal leaders who helped Moses with the registration (*Num 1:5-15*). By contrast, this group of **seventy . . . elders** would provide Israel with spiritual guidance. They needed a share of God’s **Spirit** that already rested upon Moses and made him the Lord’s special spokesman. Their capacity as leaders depended on the presence of God’s Spirit (cp. *1 Sam 10:6*; *19:20*; *Joel 2:28*; *Acts 2:16-18*; *1 Cor 12:10*; *2 Pet 1:20-21*).\n\n
11:25	idm17219					 We are not told what happened when **the Spirit rested upon them** and **they prophesied.** Whatever happened (possibly ecstatic utterances; cp. *Acts 2:4*; *1 Cor 14:2*), it was a unique occurrence.\n\n
11:28	idm17229					 Joshua’s zealous protest was prompted by his jealousy in a worthy but immature desire to safeguard his master’s status. Moses was humble (*Num 12:3*) and was not threatened by Eldad and Medad’s prophecy. Instead, he was magnanimous about sharing the spotlight and happy to learn that God was working through others in such special ways. Moses had leadership qualities that the younger Joshua had not yet acquired (cp. *Mark 9:38-40*).\n\n
11:31	idm17237					 God responded to the people’s complaints by sending a storm of quail and a plague. God had provided **quail** along with manna in *Exod 16:13*, but here they expressed God’s judgment in their sickeningly overabundant supply.\n\n
11:34	idm17245					 The precise locations of **Kibroth-hattaavah** and **Hazeroth** are unknown.\n\n
12:1	idm17253					 Rebellion was not restricted to the “foreign rabble” or to the Israelites who were bored with manna (*11:4*). Moses’ own brother and sister, Aaron the high priest (*Exod 29:30*) and Miriam the prophet (*Exod 15:20*), rebelled against him. Israel was near the nadir of its rebellion against God (*Num 13:25–14:12*).\n\n
12:1	idm17263					 **Miriam and Aaron** might have perceived Moses’ marriage as a threat to their status and ambitions. Miriam is named first, which suggests that she instigated this family feud and could explain why God punished her and not Aaron (*12:9-10*).\n\n
12:1	idm17271					 Most interpreters understand the **Cushite woman** to be Moses’ wife Zipporah from Midian (*Exod 2:16-22*), understanding *Cush* as referring here to Cushan, a region and people near Midian (*Hab 3:7*). Other interpreters, taking *Cushite* in its usual sense as referring to Kusi (in northern Arabia), Ethiopia, or Sudan, think that she was a different wife. In either case, it is possible that Miriam and Aaron disapproved of his having married a non-Israelite or that they were jealous of her influence over Moses.\n\n
12:2	idm17282					 The challenge to Moses’ authority was, by implication, a rejection of the Lord’s choice of Moses as Israel’s leader. • **the** Lord** heard:** The same phrase in *11:1* foreshadows the Lord’s response.\n\n
12:3	idm17292					 Moses’ incomparable humility contrasts his godly character (see also *Prov 3:34*; *Matt 5:5*) with Miriam and Aaron’s jealousy. • This parenthetical comment, a simple statement of the truth from God’s perspective, could be the words of Moses or of a later editor.\n\n
12:4	idm17300					 In response, the Lord reconfirmed Moses’ special status and authority.\n\n
12:6	idm17306					 The Lord’s **trust** in Moses resulted in an intimate relationship. God spoke to prophets in visions and dreams, but he spoke to Moses **face to face** (literally *mouth to mouth;* see *Exod 33:8-11*, *18-23*; *Deut 34:10*).\n\n
12:9	idm17318					 **Miriam** bore the brunt of God’s wrath (see *study note on 12:1-2*). Once **Aaron saw what had happened to her***,* he admitted his error and sought Moses’ intercession (cp. *11:2*). Both **Moses** and **the** Lord accepted Aaron’s confession.\n\n
12:14	idm17332					 Miriam was required to follow the normal procedure for achieving ritual purity after a skin disease (*5:2-4*; *Lev 13–14*).\n\n
12:16	idm17340					 The camp in **the wilderness of Paran** was at Kadesh-barnea (*13:26*; *Deut 1:19-22*).\n\n
13:1	idm17349					 Twelve spies investigated the rich land of Canaan and found it defended by formidable foes. Israel’s disobedience in earlier chapters foreshadows more of the same. The Israelites lacked the obedience, courage, and faith to take the land, so the Lord destined them to spend forty years in the Sinai wilderness; that generation failed to receive their inheritance in the Promised Land.\n\n
13:1	idm17355					 Moses selected a leader from each tribe to explore the territory that God had promised to give the Hebrews. The tribes listed are those of ch *1*, though the order is different. Caleb and Joshua are later shown to be men of faith (*14:30*).\n\n
13:17	idm17363					 The military purpose of the scouting mission is evident; the spies were also to gather information about natural resources and food, which had been on the Israelites’ minds since they left Egypt (ch *11*; *Exod 16*).\n\n
13:20	idm17371					 **The season for harvesting the first ripe grapes** came in late July or August.\n\n
13:21	idm17378					 The spies explored the land, which was unusually fertile in contrast with the Sinai wilderness.\n\n
13:21	idm17384					 It was about 275 miles **from the wilderness of Zin,** located roughly between the wilderness of Paran and the southern frontier of Canaan (see *34:3-5*; *Josh 15:1-4*), to **Lebo-hamath** (“entrance of Hamath,” either a notable mountain pass or another city near Hamath) in Syria. • The exact location of **Rehob** is uncertain, but it was probably the same as Old Testament Beth-rehob, situated near a major route to Hamath. The text thus already identifies the approximate borders of the Promised Land (see *1 Kgs 8:65*). The phrase “from Dan to Beersheba” (*Judg 20:1*; *2 Sam 3:10*), frequently used to demarcate Israel’s traditional boundaries, referred to a considerably smaller area than the territory visited by Israel’s spies.\n\n
13:22	idm17398					 Israel’s spies made their way into Canaan’s hill country via the **Negev***,* the dry southland next to the wilderness of Zin. In the southern part of Canaan’s central hill country, they came to **Hebron***,* where Israel’s ancestors had lived (*Gen 13:18*; *23:19*; *35:27*; *37:14*). • The **descendants of Anak** were famous for their size and strength (e.g., *Deut 9:2*). • **Zoan** (later called Tanis by the Greeks) was a famous city in Egypt’s eastern delta (see also *Pss 78:12*, *43*; *Isa 19:11-13*; *30:3-5*).\n\n
13:25	idm17419					 The spies agreed that the land was good, but most doubted that Israel could conquer it. The strong, well-fed Canaanites had built fortified towns to protect themselves.\n\n
13:26	idm17425					 **Kadesh** is often identified with ‘Ain el-Qudeirat, a spring at the northern border of Sinai and the southern edge of Canaan. There is no evidence of a Hebrew camp at this site during the period of the Exodus or the wilderness wanderings, so some scholars have suggested that ancient Kadesh was located elsewhere.\n\n
13:27	idm17432					 The Promised Land is often described as **a land flowing with milk and honey.** Milk and dairy products constituted a major part of the diet in biblical times, and “milk” is used in figurative language for abundance (see *Deut 32:14*; *Isa 55:1*; *Joel 3:18*). Honey provided sweetness (see *Pss 19:10*; *119:103*; *Ezek 3:3*; *Rev 10:9-10*). The phrase thus refers to a highly desirable destination, a land with an abundance of food and resources (cp. *Num 16:13-14*; see also *Exod 3:8*; *Deut 6:3*; *26:15*; *Jer 11:4-5*; *Ezek 20:6*). The New Testament emphasizes the spiritual nature of God’s promises, pointing to a promised inheritance in heaven (see *Rom 9:6-8*; *Gal 6:14-16*; *Rev 21:1-2*).\n\n
13:29	idm17455					 The spies answer the question of *13:18*. Many ethnic groups occupied ancient Canaan.\n\n
13:30	idm17462					 **Caleb** and Joshua (see *14:6*, *10*, *30*) were more optimistic in their assessment of the land than the other spies were (cp. *14:31-33*).\n\n
13:33	idm17473					 **giants:** See *study note on Gen 6:4*.\n\n
14:1	idm17481					 The testimony of the faithful spies Joshua and Caleb was rejected, and rebellion spread through the entire community. Only Moses’ intervention saved Israel from complete destruction. Those who failed to obey God died during a forty-year wilderness sojourn.\n\n
14:3	idm17487					 The threats about which they complained were real, but the Israelites should have trusted the Lord. In the ancient Near East, women and children were often taken as **plunder** in the aftermath of battle. • **return to Egypt:** How quickly the Israelites forgot their bondage (*Exod 2:23-24*) and the hardship of the wilderness (*Num 11:1*)!\n\n
14:5	idm17497					 **Moses and Aaron** prostrated themselves out of humility, fear, grief, and anguish.\n\n
14:6	idm17504					 **Joshua** and **Caleb** joined in the effort to reverse the rebellion and avert God’s wrath; they **tore their clothing** in a gesture of grief.\n\n
14:7	idm17513					 Joshua and Caleb understood that Israel’s lack of courage and their criticism of Moses and Aaron were rebellion against the Lord, and they knew what results this would produce. • **the** Lord** is with us:** This was the source of their confidence (cp. *Rom 8:31*).\n\n
14:10	idm17523					 **Joshua and Caleb***,* with their encouragement and expression of trust in God, brought even more opposition; the protests against the leaders were converted into threats of violence against the faithful spies. All of the Israelites’ objections came to a sudden stop when the Lord’s **glorious presence** (Hebrew *kabod**;* see *Exod 24:15-18*; *Ezek 1*) appeared **at the Tabernacle***,* the site of divine communication.\n\n
14:11	idm17538					 God marveled that Israel had not yet learned to trust him, even after he had miraculously rescued them from slavery and provided for their needs as they traveled in the wilderness (cp. *Deut 4:32-40*; *Matt 11:21*; *Luke 10:13*).\n\n
14:12	idm17547					 God is patient, but he will not tolerate outright rebellion from his people (cp. *Exod 32:7-10*). The writer of Hebrews refers to this episode in his effort to strengthen the faith of Christians whose trust in the Good News was wavering (*Heb 3:7-19*; *12:3*, *25*; cp. *Ps 95:8-11*).\n\n
14:13	idm17558					 Moses interceded on behalf of his people, reminding God that his reputation was bound up with that of Israel and appealing to his faithfulness.\n\n
14:17	idm17564					 Moses had used this same argument earlier when he sought pardon for Israel’s rebellion (*Exod 32:10-14*). Moses knew that God would not let the Israelites off without punishment (*Deut 7:9-10*).\n\n
14:19	idm17572					 Israel’s history since leaving Egypt had been a series of transgressions forgiven by the Lord (chs *11–12*; *Exod 15:22-27*; *17:1-7*; *32:1-14*; *Lev 10*).\n\n
14:20	idm17583					 As a result of Moses’ argument, the Lord pardoned Israel’s rebellion and did not obliterate them, but the obstinate adult generation would never see the Promised Land.\n\n
14:22	idm17589					 The people’s lack of obedience and faith was a refusal to listen to God’s voice, since they were eyewitnesses of the Lord’s **glorious presence** (see *study note on 14:10*) and **miraculous signs** (*Exod 4:29-31*; *7:1–11:10*; *14:15-31*; *16:1–17:13*).\n\n
14:23	idm17602					 Having turned their backs on the Promised Land, the Israelites were now ordered to march the other way. • **The Red Sea** could refer to bodies of water on either side of the Sinai Peninsula (the Gulf of Aqaba or the Gulf of Suez).\n\n
14:28	idm17609					 Israel’s disobedience brought on the consequences they feared would come from obeying.\n\n
14:34	idm17615					 **each day:** Cp. *13:25*. • **to have me for an enemy:** Cp. *Ezek 5:8*; *21:3*.\n\n
14:39	idm17626					 The threat of divine punishment for their sins brought grief to the people of Israel, but their hearts were still rebellious and they again disobeyed the Lord’s command (*14:25*). The promise of God’s presence had been the basis for Caleb and Joshua’s initial confidence (*14:9*), but God would not fight alongside the Israelites until all the rebels had died.\n\n
14:43	idm17634					 **The** Lord** will abandon you because you have abandoned the** Lord**:** Moses’ prediction summarizes the whole chapter.\n\n
14:44	idm17645					 **The Ark** symbolized God’s presence and blessings (cp. *1 Sam 4:1-11*).\n\n
14:45	idm17653					 **Hormah** means “destruction” in Hebrew (see *21:1-3*).\n\n
15:1	idm17661					 Chapters *1–14* took place in a relatively short period of time, but ch *15* describes the beginning of a long period—the bulk of the forty years in the wilderness—about which relatively little is known, though there are references to events that took place during the wilderness wanderings (e.g., *Deut 8:2-6*; *29:5-6*; *Josh 5:4-8*; *Ezek 20:10-26*; *Amos 5:25-26*; *Acts 7:42-43*). During this period, Moses continued to deliver legislation to govern Israelite society, especially for that day when survivors of the wilderness would finally enter the Promised Land. This chapter deals with three categories of legal matters. Presented in the middle of stories about a stubborn and disobedient Israel, *Num 15* raises hope that the Promised Land still awaited Israel’s descendants.\n\n
15:1	idm17676					 The implication of these **instructions** is that the Israelites would someday settle in the Promised Land (*14:31*; *15:18*).\n\n
15:3	idm17685					 **special gifts . . . a pleasing aroma to the** Lord**:** God is pleased by the honor and thanksgiving that sacrifices and offerings show him.\n\n
15:12	idm17694					 All inhabitants of the land, Israelite and foreign-born, were to be **equal before the** Lord in all matters (see also *Lev 24:22*).\n\n
15:17	idm17703					 These gifts, signs of gratitude to God for agricultural bounty, were expected to begin after the Hebrews reached the Promised Land and had begun planting crops.\n\n
15:22	idm17709					 Unintentional sins were treated differently than intentional sins (*15:30-31*), and the actions of the community were distinguished from those of an individual (see also *Lev 4–5*).\n\n
15:30	idm17717					 While atonement could be made for unwitting or inadvertent sins (*15:22-29*), anyone who **brazenly** (literally *with a high hand;* cp. *Exod 14:8*) violated **the** Lord**’s will** was guilty of blasphemy and suffered the consequences (cp. *Lev 24:10-16*; see also *Deut 17:2-6*; *Heb 10:26-31*). • **cut off from the community:** See study notes on *Exod 31:14-15*; *Lev 7:20-21*.\n\n
15:32	idm17736					 This case illustrates *15:30-31*. **The Sabbath** was the Lord’s holy day, which was not to be disregarded (*Exod 20:8-11*; *31:14-15*; *35:1-3*).\n\n
