Reference	ID	Tags	SupportReference	Quote	Occurrence	Note
15:34	idm17747					 Though there was no question about the man’s guilt, it is possible that the community was uncertain how to punish him. The death sentence was an appropriate penalty, because disregard of the Sabbath signaled a rejection of God’s gracious covenant with Israel (*Exod 31:12-17*) and was akin to blasphemy (*Num 15:30*; *Lev 24:10-16*; cp. *1 Tim 1:20*).\n\n
15:37	idm17757					 Had the Hebrews remembered their special relationship with the Lord, they might have avoided the problems reported in Numbers. The **tassels** reminded Israel of their special relationship with a holy God and his demands. He had redeemed his people from Egypt, and in keeping with his call to covenant relationship with himself he expected them to observe the law (cp. *Deut 6:6-9*; *Matt 9:20*; *14:36*; *23:5*). • The color **blue** signified royalty and reflected God’s holiness.\n\n
16:1	idm17769					 Another rebellion called for a clear delineation of the duties of priests and Levites. This power struggle was a more serious challenge than any of the previous rebellions against God’s authority (ch *11*; *12:1-15*; *14:1-45*). As in all of these historical episodes, the coconspirators protested relatively minor issues and questioned the actions of their leaders, but Moses reminded them that they were really rebelling against God. Once again, the Israelites suffered the deadly consequences of their rebellion.\n\n
16:3	idm17778					 The rebels were “jealous of Moses and envious of Aaron” (*Ps 106:16*). They insisted that **Moses and Aaron** had **gone too far** because all Israelites were God’s chosen people (*Exod 19:6*). Their egalitarian protest against Moses and Aaron’s authority was probably intended to replace that authority with their own.\n\n
16:4	idm17788					 **Moses . . . fell face down on the ground** in intercession (cp. *14:5*; *16:22*), then challenged **Korah and his followers** to a test.\n\n
16:6	idm17798					 **prepare your incense burners:** Korah and his company were to act like priests by burning incense (as in *Lev 16:11-13*); God would decide who was legitimate.\n\n
16:10	idm17806					 The **special ministry** of the Levites is described in chs *3–4*. The **priesthood** was the province of Aaron’s descendants (*3:1-4*). The rebels’ complaint was not with Moses or Aaron, but with the Lord.\n\n
16:13	idm17816					 **land flowing with milk and honey:** This sarcastic allusion to the spies’ earlier description of Canaan (*13:27*) is a deliberate distortion of life in **Egypt** (see *study note on 11:4-15*).\n\n
16:14	idm17826					 The Israelites were heading away from their **new homeland** precisely because they had rebelled against Moses, who had done all he could to take them to that land (chs *13–14*). • **Are you trying to fool these men?** They were accusing Moses and Aaron of trying to mislead the Israelites (to “pull the wool over their eyes”).\n\n
16:15	idm17835					 **Do not accept their grain offerings!** Cp. *Ps 109:7*; *Prov 28:9*.\n\n
16:16	idm17844					 **Moses** gave final instructions concerning the test to see if the Lord would accept what the rebels brought or what Aaron offered.\n\n
16:18	idm17851					 At the height of the insurrection, the Lord intervened to save **Moses and Aaron***,* and they interceded for the people.\n\n
16:19	idm17859					 The **community . . . gathered at the Tabernacle entrance,** either to see the test or to overthrow Moses and Aaron.\n\n
16:21	idm17866					 The Lord threatened to **destroy** the entire community because of its pervasive sin (cp. *Gen 18:16-33*). **Moses and Aaron** interceded to narrow the Lord’s judgment down to those who were guilty of this particular rebellion.\n\n
16:26	idm17875					 **don’t touch anything that belongs to them:** These men and their belongings were now “set apart for destruction” (see *Lev 27:28-29*; cp. *Deut 7:26*; *13:17*; *Josh 6:18*; *7:1-26*).\n\n
16:28	idm17887					 Moses had faith that God would enact his own justice, and God did so (*16:31-35*; cp. *1 Kgs 18:18-40*). • **into the grave:** *Sheol* was the place of the dead (see *1 Sam 2:6*; *2 Sam 22:5-6*; *Job 3:20-22*; *Ps 16:10*; *Acts 2:27-33*; *1 Cor 15:15*; *Rev 20:13-14*).\n\n
16:31	idm17904					 Korah’s sons did not die at this time (*26:10-11*). In fact, his descendants eventually became gatekeepers and musicians in the Temple (*1 Chr 9:19*, *31*; *26:19*; *2 Chr 20:19*; cp. the titles of *Pss 42*; *45–49*; *84–85*; *87–88*).\n\n
16:34	idm17919					 The **250** Israelite leaders who attempted to offer **incense** shared the fate of Nadab and Abihu (*Lev 10:1-2*) and of those who complained about the hardships of the wilderness (*Num 11:1*; cp. *2 Kgs 1:10*).\n\n
16:37	idm17930					 Although the men who used the **incense burners** were wicked, the vessels themselves were **holy** and had to be treated with care and respect. The **burning coals** were also holy and had to be scattered so that they would not be used for any other purpose.\n\n
16:38	idm17939					 The bronze **sheet** made by Eleazar to cover the altar replaced or supplemented the one made previously (*Exod 38:2*). Like the simple blue tassels of *Num 15:37-41*, it reminded **the people of Israel** of their need to obey God.\n\n
16:41	idm17949					 The Israelites still exhibited the same self-destructive, defiant behavior that had caused all their troubles. Then they blamed **Moses and Aaron** for what happened.\n\n
16:42	idm17956					 In reply, the Lord’s **glorious presence** reappeared and threatened to **destroy** the people of Israel (cp. *16:19-20*). Once again, **Moses and Aaron** intervened by falling **face down on the ground.**\n\n
16:46	idm17967					 Moses and Aaron acted quickly to rescue the Israelites from God’s wrath. In an unusual procedure, Aaron carried **an incense burner** with burning coals among the people and thus stopped the plague.\n\n
17:1	idm17974					 The Lord prescribed another trial to reinforce the lessons taught by the incidents in ch *16* and to introduce the instructions of ch *18*.\n\n
17:1	idm17982					 The shepherd’s staff was a common possession (cp. *Ps 23:4*) and, like the scepter, was a symbol of authority (cp. *Jer 48:17*). This trial was especially appropriate because the Hebrew words translated **staffs** and **tribes** are homonyms; the Lord’s choice of staff would indicate his choice of tribe.\n\n
17:4	idm17992					 The staffs were in the Lord’s presence (*17:7*), a safe spot where no one would tamper with them.\n\n
17:8	idm17999					 **Aaron’s staff . . . produced ripe almonds!** This was more than enough proof that Aaron was God’s chosen leader and that the Levites held a special position. The cups on the Tabernacle’s lampstand were shaped like almond blossoms (*Exod 25:33-36*). Later, Jeremiah’s vision of an almond branch represented the Lord’s vigil and his intention to carry out his plans (see *Jer 1:11-12*). • There is no natural explanation for the budding of Aaron’s staff. Almond wood is soft while alive and only becomes hard enough for use as a staff long after it has been cut off and allowed to dry.\n\n
17:9	idm18008					 After each tribal leader **claimed his own staff***,* it was clear that **Aaron’s** deserved special treatment. It was placed **permanently before the Ark** to warn potential **rebels** and to deter Israelites who complained about the Lord and his appointed leaders. The Ark eventually contained this staff, a jar of manna, and the stone tablets of the law (cp. *Heb 9:4*) to remind the Israelites of their wilderness wanderings.\n\n
17:12	idm18020					 The Lord and his Tabernacle were holy, and because of God’s holiness, his sanctuary could be a dangerous place for those who were not qualified to enter it. Moses’ efforts to make the people understand and respect the God of Israel were bearing fruit.\n\n
18:1	idm18026					 The instructions given here arose from the need demonstrated in ch *17* for clear boundaries between the people and the priests and Levites. The distinctive privileges of the Levites were matched by significant responsibilities. One very important aspect of their work was to safeguard the Tabernacle from unauthorized entry (ch *16*).\n\n
18:1	idm18034					 **The** Lord gave special authority to **Aaron***,* his **sons** (the priests), and his **relatives** (the **Levites**), all of whom were **held responsible** for offenses against **the sanctuary**. But the priests alone were held responsible for their own **violations** of God’s instructions for their service.\n\n
18:3	idm18050					 **all their assigned duties:** See *1:47-53*; *3:5-38*; *4:1-33*. • **they must be careful:** The Levites could **go near** only when **the sacred objects** were covered for transport.\n\n
18:5	idm18063					 Only the priests (Aaron and his descendants) could perform **sacred duties inside the sanctuary** proper or approach **the altar***,* a sacred space that deserved special reverence. Only the high priest could serve in the Most Holy Place. The Levites were to serve only in the courtyard, away from the altar, except when it was time to assemble or disassemble the Tabernacle (ch *4*).\n\n
18:5	idm18073					 Aaron and the priests were the people’s representatives before the Lord, so their actions had consequences for all of Israel (cp. *16:18-21*).\n\n
18:6	idm18080					 **Levites . . . your special assistants:** As explained in *Num 3–4*; see also *3:9*; *8:16*, *19*.\n\n
18:7	idm18091					 **Any unauthorized person . . . will be put to death:** This verse warned Israelites at all levels in the sacred hierarchy to avoid areas where they were not allowed. Certain sacred places were off limits to those not qualified in a technical religious sense. Access to the most sacred areas was restricted, set apart for the holiest members of the religious community. Those who broke that taboo violated God’s holiness at the cost of their lives (see also *1:51*, *53*; *3:10*, *29-38*; *4:1-20*).\n\n
18:8	idm18103					 The priests and Levites were to be supported by the sacrificial system (see, e.g., *Lev 7:28-36*). God’s appointed representatives deserve compensation for their efforts (cp. *Matt 10:9-10*; *1 Cor 9:3-10*).\n\n
18:9	idm18112					 **The most holy offerings** were consumed only by Aaron and his sons, the priests set apart to serve in God’s presence (*Exod 28:1*; *29:44-46*). • **This portion** was a holy offering presented to God, and the priests had to respect it as such (*Num 18:10*). Other categories of offerings provided food for the priests and their families (*18:11-12*), but only if they were **ceremonially clean**.\n\n
18:14	idm18125					 Offerings **specially set apart for the** Lord were available to Aaron and his extended family. The Hebrew term used here refers to the complete consecration of things or people to the Lord, either by destroying them or by giving them as an offering (see *Lev 27:28-29*); the second sense is intended here.\n\n
18:15	idm18134					 The Lord provided for the Hebrew priests and their families out of what was set aside for the Lord. The priests had rights to firstborn animal offerings and to the redemption fee for Israel’s firstborn sons. Both the firstborn sons and the offspring of unclean animals had to be redeemed by a fee paid in silver, since neither could be sacrificed (see *3:13*, *40-51*; *Exod 13:2*).\n\n
18:19	idm18143					 These arrangements were part of **an eternal and unbreakable covenant** (literally *a covenant of salt*; cp. *2 Chr 13:5*). The covenant was apparently meant to be permanent, since salt (a preservative) was a symbol of permanence (*Lev 2:13*).\n\n
18:20	idm18153					 The priests and Levites did not have a tribal homeland but were scattered among Israel’s other tribes (cp. *35:1-8*; *Deut 12:12*; *Josh 21:1-42*). • **I am your share and your allotment:** Instead of their own territory, Israel’s priests received the assurance that God himself would be their homeland, while **the tribe of Levi** received **tithes** in compensation for their sacred service.\n\n
18:23	idm18165					 The **Israelites’ tithes** were one tenth of the year’s production of goods (see *Deut 14:22-29*; *26:12*; *Neh 10:35-39*; *Mal 3:8-12*; *Matt 23:23*; cp. *Gen 14:17-20*; *Heb 7:5-10*).\n\n
18:25	idm18179					 Just as the Levites received a tithe of the Israelites’ goods (*18:24*), they in turn were required to **give . . . a tithe of the tithe** to the priests as their own **harvest offering** (*18:27*).\n\n
18:31	idm18189					 Any food received in tithes could be consumed by Levites and their families. That food was **compensation** (i.e., a salary) for Tabernacle service.\n\n
18:32	idm18196					 The food tithes had a sacred origin as **holy gifts of the people of Israel***;* they were not to turn these gifts into something **common** by neglecting to give a tithe to the priests.\n\n
19:1	idm18205					 This account considers the procedure by which ordinary Israelites defiled by contact with a corpse (see *9:4-12*; *Lev 17:15*; *21:1-4*, *11-12*) could regain ceremonial purity and keep from defiling the Tabernacle. God’s holiness requires that the place where his presence dwells be kept pure and set apart from pollution (cp. *1 Cor 6:9-11*, *18-20*).\n\n
19:1	idm18217					 The **water for the purification ceremony** (*19:9*), prepared with ashes of the red heifer, may have been the same as the water of purification in *8:7*; see also *31:19-24*. This ceremony required the **ashes** of a **red heifer;** the color probably represented blood (cp. *Heb 9:13-14*).\n\n
19:3	idm18230					 The need to safeguard Aaron’s consecrated status (see *Lev 21:10-12*) required that **Eleazar** perform the offering of the red **heifer***,* since it caused ritual impurity. The ceremony of the red heifer contrasted with the regular sacrifice (cp. *Lev 4:3-12*).\n\n
19:6	idm18241					 The only other passage where **a stick of cedar, a hyssop branch, and some scarlet yarn** occur together is *Lev 14*, which describes another ceremony (also “outside the camp”) that brought about ceremonial purification. Some scholars suggest that Eleazar added cedarwood and hyssop to produce an aroma. Hyssop is associated with purification (*Exod 12:22*; *Ps 51:7*; cp. *Heb 9:19*), and the scarlet yarn, like the red heifer, probably symbolized blood. Taken together, the cedarwood, hyssop, and scarlet symbolize cleansing.\n\n
19:7	idm18252					 Three people were needed to produce and collect the heifer’s ashes—Eleazar, the man who burned the animal, and the man who gathered its ashes. All three became ritually impure for a day because of this process. This was also true for the person who used the finished product, a potion made from the ash dust and water (cp. *19:21*) that had the same defiling effect as blood associated with sacrifices (*Lev 6:27-28*).\n\n
19:9	idm18260					 The purpose of the ceremony of burning the red heifer was to produce **ashes**. These were collected and deposited **in a purified place outside the camp** until the Israelites needed them **in the water for the purification ceremony** to remove such defilement as coming into contact with a corpse (*19:11-22*).\n\n
19:11	idm18270					 Coming into contact with a human corpse produced ritual impurity for **seven days** (cp. *Lev 21:1-3*). The remedy was the **water of purification***,* applied **on the third and seventh days**.\n\n
19:13	idm18281					 The impurity caused by contact with a corpse was especially dangerous since a ceremonially defiled person would **defile the** Lord**’s Tabernacle** (cp. *Lev 15:31*). This was grounds for being **cut off from the community of Israel** (cp. *Num 9:13*; *Exod 12:15*; *Lev 7:20-21*; *17:4-14*; *20:17-18*).\n\n
19:14	idm18297					 Death’s contagion could be transmitted to an object or to a place where death had occurred (cp. *Lev 15:1-12*).\n\n
19:17	idm18304					 To cleanse with the heifer’s ashes, a special purifying mixture was made by combining **ashes from the burnt purification offering** with **fresh water** (cp. *5:17*).\n\n
20:1	idm18313					The number of years since leaving Egypt is not specified, but Aaron’s death (*20:22-29*) took place in Israel’s fortieth year in the wilderness (*33:36-39*). • **Miriam died:** All in her generation shared this fate (*14:26-30*), including Moses and Aaron (*20:2-13*, *22-29*).\n\n
20:2	idm18326					 In the face of yet another complaint by the people of Israel about a lack of water and food (cp. *11:4-35*; *21:4-5*; *Exod 15:22-25*), Moses and Aaron disobeyed the Lord and lost the privilege of entering the Promised Land.\n\n
20:2	idm18335					 **There was no water:** Throughout most of the year, Sinai and the Negev are very hot and dry.\n\n
20:3	idm18342					 **our brothers!** The Israelites identified themselves with Nadab and Abihu (*Lev 10:1-5*), the gluttons killed by the first plague (*Num 11:33*), the skeptics who had already died in the wilderness (*14:29*), the ten unfaithful spies (*14:36-37*), Korah, Abiram, and Dathan, the 250 prominent men, and the 14,700 who died in the second plague (*16:32*, *35*, *49*).\n\n
20:6	idm18356					 **they fell face down on the ground:** As in previous conflicts (*14:5*, *10*; *16:4*, *19*, *22*), they prostrated themselves and awaited **the glorious presence of the** Lord to resolve the crisis.\n\n
20:7	idm18370					 God heard Israel’s complaints, regarded them as legitimate, and commanded Moses to solve the problem.\n\n
20:8	idm18376					 The **staff** was kept before the Ark of the Covenant to prevent the Israelites from complaining (cp. *17:10*); it represented God’s authority in the hands of Moses and Aaron. The instructions that God gives his representatives are very precise and must be followed exactly (cp. *Jas 3:1*; see also *2 Tim 2:24-26*).\n\n
20:10	idm18386					 Instead of reverently obeying God’s instructions, Moses rebuked the people (**Must we bring you water from this rock?**) and angrily **struck the rock twice with the staff** (*20:11*). God regarded Moses’ words and actions as a serious breach of faith; Moses “spoke foolishly” (*Ps 106:32-33*; cp. *Jas 1:20*) and **did not trust** God **enough to demonstrate** his **holiness.** By not doing exactly as he was told, Moses demonstrated a lack of faith in God to provide for his people. This lack of faith is also apparent in Moses’ words to the people. The Lord requires obedience and faith; anything less is an affront to his holy character (*Num 20:24*; *27:14*). Such serious lack of obedience and faith had the same result as it had earlier (*14:20-23*; see also *1 Cor 10:4-12*).\n\n
20:13	idm18404					 **Meribah:** As they had at Rephidim (*Exod 17:1-7*), the Israelites coined a name (“**Arguing**”) that referred more to the incident than to a geographical location. • God **demonstrated his holiness** through his judgment on Aaron and Moses’ sin.\n\n
20:14	idm18414					 Here the Israelites began their trek toward the Promised Land. Moving from Kadesh, they left the Sinai Peninsula behind and entered the area east of the Jordan (Transjordan), approaching the Promised Land from the east by a less direct point of entry (see *14:25*; cp. *Deut 2:2-6*).\n\n
20:14	idm18422					 Israel tried unsuccessfully to establish peaceful relations with **Edom***,* with which it had apparently had no dealings since Esau (Edom) and Jacob (Israel) buried their father, Isaac (*Gen 35:29*; *36:6-8*; cp. *Gen 32:28*). Moses’ appeal resembles the formal diplomatic correspondence of that era. While contacts with the Canaanites and other people groups were marked by hostility, communication with Edom was polite because of kinship ties (cp. *Deut 2:4*; *23:7*). Those ties, however, were apparently not strong enough to overcome the ancient tension between Jacob and Esau (*Gen 27:41*).\n\n
20:17	idm18436					 **We won’t even drink water from your wells:** Edom is very dry; food and water were too scarce to provide for this substantial number of Hebrew immigrants. • **We will stay on the king’s road:** The “King’s Highway” (also *21:22*) is well known in the Old Testament, though its exact route is not certain. As its name indicates, this route was maintained for official purposes, including the movement of troops and trade. Along this trail, travelers could find settlements, food, and water between the Red Sea and Damascus. The route remained important into Roman and even modern times. This royal road contrasted with a much less hospitable route farther to the east called the Desert Highway.\n\n
20:18	idm18445					 **Stay out of my land:** As their ancestor Esau had distrusted Jacob (*Gen 27:36*), the Edomites now distrusted Jacob’s descendants. So **Israel was forced to turn around** and find another way to approach Canaan (cp. *Deut 2:4-6*).\n\n
20:22	idm18455					 Israel did not follow the more direct route through the southern region east of the Jordan, the Edomite heartland (*20:21*). • After leaving Kadesh, the Hebrews reached **Mount Hor***,* located **on the border of the land of Edom**. The precise location of Mount Hor remains unknown, though Josephus (writing in AD 70–100) linked it with the Petra region (at Jebel Haroun, “mountain of Aaron”).\n\n
20:24	idm18466					 Aaron’s participation in the rebellion of his generation resulted in his death outside the Promised Land (*20:10-12*).\n\n
20:27	idm18473					 Priestly authority was transferred when Moses placed Aaron’s **priestly garments** (cp. *Lev 8:7-9*) **on Eleazar**. Afterward, **Aaron died** at the age of 123, in the fortieth year after the Hebrews left Egypt (see *Num 33:37-39*). • **all Israel mourned for him thirty days:** This was an unusually high honor (see also *Deut 34:8*), since the normal period of public mourning was seven days (*Gen 50:10*; *1 Sam 31:13*).\n\n
21:1	idm18488					 In the march toward the Promised Land, Israel moved from Mount Hor to the plains of Moab (*22:1*). The account of Israel’s march is punctuated by the book’s emphasis on the Lord’s patient plan to lead Israel into Canaan despite their frailties. • Although the general direction of travel is clear, the exact route taken by the Hebrews remains unknown. Many of the places are hard to identify, and the archaeological evidence from some sites does not fit the time frame usually associated with the wilderness period. An honest appraisal of the wilderness itinerary is still beset by significant geographical and historical uncertainties.\n\n
21:1	idm18495					 It is possible that **the Canaanite king of Arad** was provoked by many enemies to the south of his territory (cp. *14:44-45*). • **Arad** and Hormah (*21:3*) were far to the north of Mount Hor (*20:22-29*; *21:4*; see *study note on 20:22-23*). Ancient *Arad* is usually identified with Tell Arad, located west of the modern Israeli town of Arad and about fifty miles north of Kadesh. While excavation at Tell Arad has revealed important ruins from the Early Bronze Age (about 3300–2000 BC) and the Iron Age (about 1200–500 BC), there is no evidence of occupation during Israel’s exodus and wilderness period (the Late Bronze Age, 1500–1200 BC). Some solutions link ancient Arad with another archaeological site in the region. Others claim that all such stories come from a much later period and that there is no reason to expect a correlation between excavated data and literary traditions. Another set of solutions recognizes that the evidence is fragmentary, insufficient to settle scholarly debate or to reach a definitive conclusion. The same general kinds of problems with geographical and archaeological details are found in other parts of the Old Testament, and the solutions are often uncertain. • **Atharim** is otherwise unknown.\n\n
21:2	idm18513					 **completely destroy** (Hebrew *kharam*): Israel was instructed to completely destroy their enemies and their enemies’ property (see *Lev 27:28-29*; *Deut 7:2*; *20:17*; *Josh 6–7*; *10:1–11:23*). • This battle reflects a play on words between *kharam* and **Hormah** (Hebrew *khormah**,* *Num 21:3*). It marks a turning point in Israel’s interaction with the Canaanites, who remained a formidable enemy throughout the period of the conquest.\n\n
21:4	idm18531					 The “vow to the Lord” and consequent victory (*21:2-3*) did not eliminate Israel’s criticisms **against God and Moses,** even though the **long journey** was punishment for the same kind of complaining (*14:26-35*).\n\n
21:6	idm18542					 This whole region provided (and still provides) habitat for extremely **poisonous snakes** (cp. *Isa 30:6*).\n\n
21:7	idm18550					 Jesus alluded to this incident when discussing his identity and mission (*John 3:14-15*). • By Hezekiah’s day (around 700 BC), this **bronze snake** had become an object of worship in Jerusalem (*2 Kgs 18:4*).\n\n
21:10	idm18560					 The location of **Oboth** is uncertain.\n\n
21:11	idm18567					 The Israelites made their way along the east side of Edom. • **Iye-abarim** (“ruins of Abarim” or “ruins of the region beyond”) was probably near the northern bank of **Zered Brook** (cp. *Deut 2:13-14*) which separated ancient Edom from **Moab** (*Deut 2:8-25*).\n\n
