Reference	ID	Tags	SupportReference	Quote	Occurrence	Note
1:1	idm170315					 Revelation opens with a three-part introduction, including a prologue (*1:1-3*), a letter introduction (*1:4-8*), and a historical introduction (*1:9-11*).\n\n
1:1	idm170324					 The word **revelation** (Greek apokalupsis) introduces the book’s visionary nature as apocalyptic writing (see *Revelation Book Introduction*, “Apocalyptic Writing”). God communicates his inspired message through mysterious symbols, numbers, and word pictures. • **from** (or *of*) **Jesus Christ:** He is both the source and the main subject of the book. • **the events that must soon take place:** Cp. *3:11*; *22:6-7*; *Luke 18:8*; *Rom 16:20*.\n\n
1:2	idm170341					 **reported** (Greek martureō) . . . **testimony** (Greek marturia): These closely related Greek words indicate an authentic witness and emphasize that the sacrificial witness of Jesus and the authentic testimony of John are the basis for the revelation.\n\n
1:3	idm170351					 **God blesses:** Revelation contains seven promises of blessing (*1:3*; *14:13*; *16:15*; *19:9*; *20:6*; *22:7*, *14*). • **listen . . . and obey:** Authentic hearing entails obedience.\n\n
1:4	idm170366					 The second introduction (see *study note on 1:1-11*) is in the style of a Greek letter.\n\n
1:4	idm170373					 **To the seven churches** does not mean that there were only seven churches in the Roman **province of Asia** but that these seven churches represent the entire group. **Grace and peace** is a typical Christian greeting (see study notes on *2 Cor 1:1-2*; *2 Thes 1:1-2*). The order of the two words is consistent in the New Testament, suggesting that peace follows from God’s grace. • **who is, who always was, and who is still to come:** God controlled the past, will surely control the future, and is sovereign over every present crisis (see also *Rev 1:8*; *4:8*; *11:17*; *16:5*). • **the sevenfold Spirit** (literally *the seven spirits*): Some argue that the “seven spirits” are seven angels, but the phrase fits between references to God the Father (*1:4*) and to God the Son (*1:5*), making this passage a description of the Trinity (see *Matt 28:19*; *John 14:26*; *15:26*; *2 Cor 13:14*; *1 Pet 1:2*). The number seven acknowledges the Holy Spirit’s perfection (cp. *Zech 4:2*, *6*, *10*).\n\n
1:5	idm170401					 In this doxology, John gives reasons for praising Jesus. • Doxologies often conclude with the confessional **Amen** (see *Rom 11:36*; *Phil 4:20*), which expresses affirmation.\n\n
1:5	idm170410					 John gives three descriptions of **Jesus Christ**. (1) As **the faithful witness***,* Jesus is our model for proclaiming the Good News of salvation (*1:2*). (2) The truth that Jesus was **the first to rise from the dead** is foundational to Christian faith (*1 Cor 15:14*, *17*). (3) As **ruler of all the kings of the world** (see also *Rev 17:14*; *19:16*), he is the absolute Lord of everything. Inhabitants of the Roman world were expected to declare Caesar as absolute lord; many early Christians died for their conviction that Jesus alone holds that position.\n\n
1:8	idm170426					 **I am** is the name of God in the Old Testament (*Exod 3:13-14*; *6:2*; *Deut 6:4*). Jesus applied this name to himself (cp. *John 4:26*). **Alpha** and **Omega** are the first and last letters of the Greek alphabet; they signify that God’s actions are all-encompassing. God is fully in control.\n\n
1:9	idm170439					 This third introduction (see *study note on 1:1-11*) is historical; it shows God communicating with humanity in historical events. God gave John a significant mission while in exile.\n\n
1:9	idm170446					 **your brother and your partner:** Though separated from other Christians by his imprisonment, John shared a sense of community with them **in suffering***,* based on hope in **God’s Kingdom** and a willingness to endure. • The Roman fortress on **the island of Patmos** housed prisoners and exiles. Patmos was in a group of islands that protected the thriving seaport of Miletus. • **for preaching . . . and for my testimony:** In typical Semitic parallelism, the second statement means essentially the same as the first. By John’s time, Jews were persuading Roman authorities that Christianity was different from Judaism and therefore not an authorized religion.\n\n
1:10	idm170458					 **the Lord’s Day:** This designation was used in the Roman world to refer to celebrations in honor of Caesar, but Christians used it to refer to their weekly worship, celebrating Jesus’ resurrection. The earliest Christians worshiped in Jewish synagogues on the Sabbath, the last day of the week (*Acts 18:4*), but by the time of Revelation, they were excluded from synagogues and gathered on the day that commemorated the resurrection, the first day of the week (see *study note on Luke 24:1*; see also *Acts 20:7*). • The **loud voice like a trumpet blast** was an announcement of the Lord’s coming.\n\n
1:11	idm170469					 **Write . . . and send:** God authorized John as a prophet and herald of his revelation (see *22:8*, *10*; cp. *Isa 6:8-9*; *Jer 2:1-2*; *Ezek 2:1-3*; *34:1-2*).\n\n
1:12	idm170482					 John’s first vision is a symbolic picture of Christ as the wise, secure, and powerful agent of God who always cares for his people.\n\n
1:12	idm170488					 **I turned to see who was speaking:** This statement refers to the loud voice of *1:10*. • **seven gold lampstands:** The lighted menorah was a symbol of God’s presence among his people (*Exod 27:21*; *Lev 24:1-4*) and of his all-seeing eyes in the world (*Zech 4:10*).\n\n
1:13	idm170500					 **the Son of Man** (or *a son of man.*): *Son of Man* is a title Jesus used for himself (see *Dan 7:13*; *Matt 8:20*; *9:6*; *16:13*; *Mark 2:28*; *9:9*; *14:41*; *John 1:51*; *3:13*; *5:27*). • The **long robe** and **gold sash** give Christ an authoritative appearance (see *Rev 19:13-16*; *Dan 10:5*). The robe was a priestly garment symbolizing purity and holiness.\n\n
1:14	idm170523					 **White** hair represents wisdom and maturity; this vision reflects Daniel’s vision of the Ancient One (*Dan 7:9*). • His **eyes** *. . .*** like flames of fire** pierce through pretense; the One who knows everything will judge everyone (see *Dan 10:6*; *Heb 4:13*).\n\n
1:15	idm170536					 **Refined** or hardened **bronze** in the **feet** implies stability, firmness, and security (cp. *Dan 10:6*). • The thundering **voice** suggests God’s power—when he speaks, he will be heard (cp. *Ezek 43:2*).\n\n
1:16	idm170548					 The **seven stars** represent the complete church. The church is secure in the **right hand** (i.e., in the acceptance and blessing) of the Son of Man. • The **sharp** *. . .*** sword** coming **from his mouth** is his effective message and his judgment (see *19:15*; *Gen 3:24*; *Eph 6:17*; *Heb 4:12*). Jesus proclaims both grace and judgment, but here the emphasis is that he carries out judgment (see *Rev 2:12*, *16*; *19:15*, *21*; cp. *Isa 11:4*).\n\n
1:17	idm170569					 **When I saw him, I fell . . . dead:** Terror and a dead faint, if not death itself (see *Exod 33:20*), frequently result when someone sees God (see *Isa 6:1-5*; *Matt 28:4*). The Lord graciously responds by the touch of his **right hand** (cp. *Matt 25:34*) and the words **“Don’t be afraid!”** (cp. *Luke 1:13*), indicating both grace and acceptance. • **I am:** The phrase identifies Jesus as God (see *study note on Rev 1:8*).\n\n
1:18	idm170585					 **the living one:** Because the Son of Man (*1:13*) has conquered death, he holds **the keys of death** and controls the outcome of our greatest fear (see *20:14*; *Heb 2:14-15*). Jesus has complete authority to provide hope in a hostile world. • **the grave:** Greek *Hades.* See *study note on Rev 6:7-8*.\n\n
1:19	idm170599					 **Write:** In the vision, God gives instructions for what John is to do on his behalf (see *Isa 6:9-10*). This vision’s purpose is to help the church (*Rev 1:20*) understand the present and the future from God’s perspective.\n\n
1:20	idm170608					 John is to record what he sees because Revelation is an instructive word for the **churches**. • The **angels** (or *messengers;* Greek angelos) **of the seven churches** could be (1) the guardian angels of these churches (cp. *Matt 18:10*; *Acts 12:15*); (2) the leading officials of the churches (cp. *Matt 11:10*, where “messenger” is angelos); or (3) a personification of the *ethos* of the church. The best understanding is probably a combination of 1 and 3.\n\n
2:1	idm170624					 The seven messages to the seven churches reflect the state of Christ’s church when Revelation was written, and it is similar today. God still calls Christians to faithfulness and integrity. Those who heed Christ’s message will reap God’s promised rewards; those who fail to do so will be judged.\n\n
2:1	idm170630					 The letter to **the church in Ephesus** addresses tradition-bound Christians who are faithful but have lost their early, zealous love for Christ and for each other (see *2:5*).\n\n
2:1	idm170638					 **Write . . . to the angel:** This repeated command that introduces each of the seven letters suggests the importance of the message. • **Ephesus** had become the main city of the Roman province of Asia. It contained the temple of Artemis (see *Acts 19:23-35*) and became the richest banking center in that part of the world. The people of Ephesus were very independent; they declined help from Alexander in rebuilding their temple after it was destroyed (300s BC), arguing adroitly that one god should not stoop to build a temple to another god (see Strabo, *Geography* 14.1.22). The Ephesians’ protective pride also led to the uproar against Paul (*Acts 19:23-41*).\n\n
2:2	idm170650					 **I know:** This repeated refrain (*2:9*, *13*, *19*; *3:1*, *8*, *15*) shows Christ’s total knowledge of his people, their activities, and their circumstances. • The Ephesian Christians had a correct theology marked by perseverance and faithfulness. They had **examined** various **claims***,* exercised discipline on **evil people***,* could tell what is true and what is false, and had **patiently suffered** for their faith in Christ.\n\n
2:4	idm170669					 **You don’t love me or each other as you did at first:** When the church was first established, their love for Christ and for each other had been strong. Struggles with false teachers and persecution had caused that original love to grow cold. Correct theology, action, and even suffering (*2:2-3*) are just an empty shell of Christian life if dynamic love is absent (*1 Cor 13*).\n\n
2:5	idm170678					 Christ calls even those who keep the faith to **turn back** to him and **repent** of cold-heartedness. The warning, **I will come and remove your lampstand***,* means that they would lose their status as a church; God would treat them as he did the apostates within Israel (see *Rom 11*).\n\n
2:6	idm170689					 Not much is known of **the Nicolaitans***,* but their teaching (*2:15*) seems to link them with those who ate food sacrificed to idols and who were involved in sexual immorality, behavior prohibited by the council in Jerusalem (see *Acts 15:20*, *29*). Irenaeus argued (about AD 180) that the Nicolaitans were dependent on Nicolas (*Acts 6:3-5*) and that John’s writings were directed against the heresies of the Nicolaitans who followed Cerinthus (see *1 John Book Introduction*, “Setting”).\n\n
2:7	idm170703					 The reward for obedience is **fruit from the tree of life**—that is, eternal life (*22:2*; *Gen 3:22*).\n\n
2:8	idm170712					 The letter to **the church in Smyrna** pictures suffering Christians under intense pressures who need a message of assurance. Smyrna typifies a small church that remains faithful to God despite difficult circumstances.\n\n
2:8	idm170719					 The seaport village of **Smyrna** had been destroyed and rebuilt several times. Like Christ, the city had been **dead** but was **now alive**. It is the only city of the seven that has survived to this day (Izmir, Turkey).\n\n
2:9	idm170728					 Jesus connected material **poverty** with the blessing of being **rich** in God’s Kingdom (*Matt 5:3*, *10-12*; *Luke 6:20*). • **Jews** who had no faith are condemned for aligning themselves with **Satan** in hostile opposition to the Christian faith (*Rev 3:9*; see *John 8:44*; *Acts 14:2-5*; *17:13*; *18:6*; *20:3*; *Gal 5:11*; *1 Thes 2:14-16*). At the Jewish council of Jamnia, the Jews excluded Christians as unholy heretics. John was not anti-Semitic; he was a Jew describing the actions of fellow Jews against Jewish and Gentile Christians.\n\n
2:10	idm170749					 John saw **the devil** as the source of human hostility against Christians. • The period of their suffering would be **ten days***,* symbolizing a limited time of persecution (see *1 Pet 1:6*). If they would **remain faithful***,* their reward would be the **crown** of eternal **life**. • **when facing death:** John’s pupil Polycarp was a martyr in Smyrna in the mid-100s AD.\n\n
2:11	idm170765					 Faithfulness until death is described as being **victorious***;* overcoming **the second death** means receiving eternal life (see *20:5-6*, *14*; *21:8*).\n\n
2:12	idm170777					 The letter to **the church in Pergamum** portrays Christians who are tempted to compromise their morality and their loyalty to God. The city of Pergamum was the earliest capital of the Roman province of Asia. It contained a famous library, and its citizens developed the use of animal skins as writing materials.\n\n
2:12	idm170784					 Christ’s **sharp two-edged sword** indicates that these Christians would receive the Lord’s most severe judgment (see *2:16*; see *study note on 1:16*). The *two-edged sword* was the Roman symbol of authority, which typified Pergamum as capital of the province. If the church failed, the true governor of the city (Christ) would turn his authority against them.\n\n
2:13	idm170794					 The **throne** of **Satan** might refer to the altar of Zeus on the mountain above the city or to emperor worship at the temple of Augustus. For many years, the Roman proconsul had his throne there, and the great temple of Athena and other shrines were also located in Pergamum. Its description as **Satan’s city** might also refer to the temple of Asclepius, whose symbol was coiled snakes. The city was dedicated to the Roman pantheon and emperor worship. • **Antipas** is otherwise unknown.\n\n
2:14	idm170804					 **Some** in Pergamum were syncretists, combining Christianity with paganism and engaging in immoral activities. John compares them to **Balaam***,* who lured **Israel** into **sin** (see *Num 25:1-3*; *2 Pet 2:15*; *Jude 1:11*). • **Nicolaitans:** see *study note on Rev 2:6*.\n\n
2:17	idm170820					 Those who remain faithful to Christ will receive **manna***,* nourishment from heaven (see *Exod 16:11-36*). • **hidden away in heaven:** During the Exodus, a jar of manna was placed in the Ark of the Covenant (*Exod 16:33-36*). Jewish tradition said that at the coming of the Messiah, the Ark would reappear and manna would be eaten at the messianic banquet. Jesus is the bread from heaven and the bread of life (*John 6:32-35*; cp. *Exod 16:4-21*). • A **white stone** was often given to victors in athletic competitions, and it was common for special banquets or festivities to use a white stone for admission. It therefore suggests acceptance and victory. • The **new name** probably refers to the recipient’s transformed nature in Christ (see *Gen 17:5*; *32:28*; *John 1:42*).\n\n
2:18	idm170838					 The letter to **the church in Thyatira** confronts Christians who mix Christianity with pagan practices and a worldly lifestyle.\n\n
2:18	idm170845					 **Thyatira** was an outpost city known for its many trade guilds, including weavers and dyers (*Acts 16:14*). • The flaming **eyes** of the **Son of God** indicate penetrating perception; the solid **feet** portray Christ’s stability, in vivid contrast to the famous Colossus of Rhodes, an enormous statue which had once been thought to be firmly planted until an earthquake destroyed it in 226 BC.\n\n
2:19	idm170857					 Christ emphasizes knowing and seeing all things as he praises the Thyatirans.\n\n
2:20	idm170863					 The mention of **Jezebel***,* who led Israel into pagan idolatry and immorality (*1 Kgs 16:31-33*; *21:5-26*), indicates a serious problem. Like the Old Testament queen who led the pagan cult of Baal (see *1 Kgs 16:31*; *18:4*; *19:1-3*), this unknown Jezebel called **herself a prophet** but was leading God’s people into various forms of **immorality***,* including sexual misconduct and straying from God into idolatrous alliances and actions (*Exod 34:15-16*; *Ps 106:39*; *Isa 57:7-8*).\n\n
2:21	idm170882					 Through messengers such as John, Christ had given this false prophet opportunity to **repent** of her sinful teachings and actions, but like many, she had refused (cp. *9:20-21*).\n\n
2:22	idm170890					 Christ’s judgment on this “Jezebel” and her followers comes in three stages: (1) Jezebel is **on a bed of suffering**; (2) her followers **will suffer greatly**; and (3) **her children** will die (cp. *Acts 5:5*, *10*; *1 Cor 11:30*). This judgment echoes the plagues on Egypt that ended with the deaths of Egypt’s firstborn sons (see *Exod 12:29-30*). • God sees **thoughts and intentions** (see *Jer 17:10*; *Acts 1:24*; *Heb 4:12-13*), and he gives whatever sentence people **deserve** (see *Rev 22:12*; *Jer 17:10*; *Matt 16:27*).\n\n
2:24	idm170911					 The **depths of Satan** might be a striking reference to the Gnostic god named “Depth” (*Bythos*), who with his partner “Silence” (*Sigē*) formed a philosophic godhead. Gnosticism placed great emphasis on secret knowledge.\n\n
2:26	idm170920					 Christ promises that those who are obedient will share **authority** with him, as symbolized by the **iron rod** that will **smash** the opposition **like clay pots** (quoting *Ps 2:8-9*; cp. *Rev 12:5*; *19:15*). • The **morning star** is the planet Venus, which signals the coming of a new day. Here it refers to the promise of resurrection at Christ’s return (*22:16*; *2 Pet 1:19*).\n\n
3:1	idm170936					 The letter to **the church in Sardis** warns Christians who are reputed to be spiritually alive (when actually dead) that without genuine transformation they face God’s judgment.\n\n
3:1	idm170943					 **Sardis***,* nearly 50 miles (80 kilometers) east of Smyrna on the southeast highway from Pergamum and Thyatira, was home to a large colony of prosperous Jews, called “Sephardic” after the city’s ancient name. Its fortified acropolis gave its inhabitants an overconfident sense of security. • **a reputation for being alive—but you are dead:** Other churches may have believed that the Sardian Christians comprised a dynamic church, but their secularism revealed their lack of spiritual life.\n\n
3:2	idm170952					 The church of Sardis needed to **wake up** or it would **suddenly** fall. The city of Sardis had fallen when the forces of Cyrus (549/546 BC) and of Antiochus III (189 BC) made **unexpected** attacks through a secret tunnel and caught the watchmen off guard. The same would be true of the Christians there if they did not **meet the requirements of** . . . **God** (see *20:12*; *Eph 2:10*; *Jas 2:20*). • **as a thief:** Like the invaders in the city’s history, Christ would come suddenly (see *Rev 16:15*; *Matt 24:43*; *1 Thes 5:2*; *2 Pet 3:10*).\n\n
3:4	idm170973					 **Soiled** *. . .*** clothes** represent an impure life (*Zech 3:4*), while **white** clothes depict purity (see *Rev 6:11*; *7:13-14*; *22:14*). • **Walk** expresses how a person lives (see *Gen 17:1*; *Pss 81:13*; *82:5*; *Rom 8:4*; *Gal 5:16*).\n\n
3:5	idm170993					 Having one’s name recorded in **the Book of Life** (see *20:12-15*; *Dan 7:10*) symbolizes having assurance of God’s acceptance and eternal life (see *Rev 17:8*; *20:12*; *Phil 4:3*; see also *Luke 10:20*). For God to **erase** a name implies condemnation and eternal death (see *Exod 32:32-33*; *Ps 69:28*).\n\n
3:7	idm171009					 The letter to **the church in Philadelphia** encourages Christians who seem to be weak and powerless to realize that their true strength is in Christ. This comforting message includes no words of disapproval. The Kingdom of God does not depend on human strength or wisdom but on God’s power and authority.\n\n
3:7	idm171016					 **Philadelphia** was situated in the foothills of the Timolus Mountains, open to fertile plains in the east. The city repeatedly experienced severe earthquakes that left it weak and impoverished. • This verse quotes phrases from *Isa 22:22*. • **key of David:** Jesus the Messiah is successor to David’s royal line. As the gatekeeper of heaven, Jesus has authority to **open** and **close** the way to heaven (cp. *Matt 16:19*).\n\n
3:8	idm171028					 **I know:** See *study note on 2:2-3*. • **little strength:** Like the city of Philadelphia itself (see *study note on 3:7*), the Christians there were not prosperous, and they lacked status and power. But Christ had **opened a door** for them (see *3:7*) to claim his status and authority. In spite of their weakness, the Philadelphia church **obeyed** Christ’s **word** and **did not deny** him under pressure.\n\n
3:9	idm171043					 **those who belong to Satan’s synagogue:** The Christians in Philadelphia had suffered maltreatment by anti-Christian Jews (see *study note on 2:9*). • **bow down at your feet:** In the ancient world, captives were often forced to prostrate themselves before their conquerors (see *Isa 49:23*; *60:14*). The church’s human enemies will ultimately **acknowledge that** Christians **are the ones** God loves.\n\n
3:10	idm171056					 Jesus will **protect** Christians who **persevere** through trials (cp. *Isa 43:2-4*; *John 10:27-28*; *1 Cor 10:13*; *Heb 6:18-19*). • **The great time of testing** refers to the end times, when the world experiences tribulation.\n\n
3:11	idm171069					 Christians must **hold on***;* they must persevere in difficulty so they will not lose their **crown***,* their expected reward.\n\n
3:12	idm171079					 **Victorious** Christians are secure in God’s household since, like **pillars***, . . .*** they will never have to leave it**. • **The name of** *. . .*** God** that is inscribed **on them** portrays God’s ownership and the security Christians thus enjoy (see *7:4*; *14:1*). • The **new Jerusalem** is not a realm constructed by humans, but is God’s gift **from heaven** (*21:2-10*). • A **new name** was a sign of God’s blessing (see also *2:17*); Abram, Jacob, Simon, and others were given new names (*Gen 17:5*; *32:28*; *John 1:42*).\n\n
3:14	idm171103					 The letter to **the church in Laodicea** castigates lukewarm Christians whose inconsistent lives stand for nothing but themselves. They sicken Christ to the point of his spitting them from his mouth.\n\n
3:14	idm171110					 **Laodicea***,* situated 40 miles (65 kilometers) southeast of Philadelphia, was the economic and judicial center of a metropolitan region that included Colosse and Hierapolis. The citizens of Laodicea were very proud of their self-sufficiency. After a severe earthquake (AD 60), Laodicea refused aid from Rome and rebuilt their city themselves (Tacitus, *Annals* 14.27), making it very beautiful. • **the Amen:** Used as an oath, “Amen” is a promise of truth (*Isa 65:16*). Jesus is the truth (*John 8:32*; *14:6*), and his message is authenticated by the truthfulness and reliability of his word. • The description of Christ as **the faithful and true witness** declares that he knew them as they really were: Though wealthy and proud of their status and accomplishments, they were not measuring up to God’s expectations.\n\n
3:15	idm171125					 **neither hot nor cold:** The hot springs in Hierapolis were famous for their healing qualities. Colosse was equally famous for its cold, refreshing springs. In contrast, the water available in Laodicea was smelly and **lukewarm**. Such water is distasteful; Jesus was saying that the church’s indecisive commitment to him was revolting.\n\n
3:17	idm171133					 Although Christians in Laodicea felt prosperous and self-sufficient (see *study note on 3:14*), Jesus accurately saw their **wretched and miserable and poor** spiritual condition.\n\n
3:18	idm171141					 Jesus’ prescription for Laodicea required a complete change of attitude from self-reliance to dependence on God. • **buy gold from me:** Materially, they could buy whatever they wanted, but they needed to acquire the treasures of heaven so they would have spiritual riches through faith in Christ. • **purified by fire:** While material wealth will not withstand God’s purging *by fire* (cp. *1 Cor 3:12-15*), spiritual wealth has eternal value. • **White garments** represent spiritual purity. Black wool cloth and garments were prized exports of the city of Laodicea. This famous black wool cloth was a source of Laodicea’s material wealth; it probably represents the Laodiceans’ proud and unredeemed spiritual condition. • Laodicea’s material prosperity was also due to their well-known Phrygian eye **ointment***,* which may have been used there in the eye clinic associated with the famed physician Demosthenes Philalethes. The Laodiceans needed to buy *ointment* from Christ through faith. Only his eye salve would enable them to **see** their sin and repent.\n\n
3:19	idm171156					 Christ will **correct and discipline** those whom he loves (*Prov 3:11-12*; *Heb 12:5-6*), rather than rejecting them. His faithfulness extends even to the unfaithful (*2 Tim 2:13*).\n\n
