Reference	ID	Tags	SupportReference	Quote	Occurrence	Note
3:20	idm171166					 A person or a church must **hear** Jesus knocking and **open the door** to him. Christ provides a pattern of revival for a church that has grown spiritually weak and fallen out of fellowship with him. Simply opening the door can renew their former bond. • **we will share a meal:** A shared meal symbolizes acceptance, deep friendship, and a covenant relationship (*19:9*; see *Gen 18:1-5*, *16-19*; *Exod 12:1-31*; *18:12*; *Matt 26:26-30*).\n\n
3:21	idm171181					 The reward for **victorious** and obedient faith is to **sit with** Christ on his **throne**. Christians do not become divine, but they share in Christ’s victorious reign (*20:4*, *6*; *22:5*; *Col 3:1-4*; *2 Tim 2:12*).\n\n
4:1	idm171195					 This section introduces the visions and judgments to come. John presents God in his heavenly court—the scene of the drama of Revelation (*4:1-11*)—and the Lamb, who has a central role (*5:1-14*). John contrasts the majesty of God with the so-called majesty of Caesar. God’s power and splendor is unequaled by the ceremonial court of any earthly ruler.\n\n
4:1	idm171203					 The description of God’s throne room stretches the imagination. It builds on the visions of *Isa 6:1-4*, *Ezek 1:4-28*, and *Dan 7:9-10*, where God is seen enthroned in power and majesty. God’s throne dominates Revelation, and the worship in the rest of the book flows from this scene. God’s magnificence, grace, and glory are fundamental to the church’s worship.\n\n
4:1	idm171212					 **Then . . . I saw:** This introductory phrase (see also *7:9*; *15:5*; *18:1*; cp. *19:1*) does not signal chronological sequence but the beginning of a new visionary experience. • **Come up here:** The **voice** of the Lord invites John to look at things from God’s perspective.\n\n
4:2	idm171225					 By being **in the Spirit***,* John could experience spiritual realities (see *1:10*; *17:3*; *21:10*; *Ezek 11:1*) and grasp insights about God’s presence, the heavenly realm, and God’s intentions in history.\n\n
4:3	idm171237					 Rather than painting a visual picture of God (*Exod 20:4*; *Deut 4:15-19*), John uses **gemstones** and the **rainbow** (*Gen 9:8-17*; *Ezek 1:28*) to suggest God’s qualities. The rainbow speaks of God’s grace as it recalls God’s covenant with Noah (*Gen 9:13-17*) that he would never again destroy the earth with water. In Revelation, however, we see the earth destroyed by fire (cp. *Gen 19:24-29*).\n\n
4:4	idm171251					 The **twenty-four elders** on their **thrones** probably represent all of God’s people. They might correlate to the twelve tribes of the old covenant and the twelve apostles of the new (see *21:12-14*), although some have identified them with the twenty-four divisions of the Israelite priesthood (*1 Chr 24:1-19*). In the drama, they act as an antiphonal chorus (alternating groups of speakers or singers).\n\n
4:5	idm171261					 The **thunder** that follows **flashes of lightning** is God’s call to attention (see *8:5*; *11:19*; *16:18*). • **in front of the throne were seven torches:** In ancient times, torches were set before rulers to show their authority. These torches **with burning flames** represent the perfect **Spirit of God**.\n\n
4:6	idm171275					 **a shiny sea of glass, sparkling like crystal:** The most eye-catching part of ancient theaters was the glistening mosaic where the speaking orchestra was positioned to provide perspective (cp. *15:2-4*). • The **four living beings** represent the whole created order. • **covered with eyes:** This phrase probably indicates that they had knowledge or understanding. In the ancient world, figures were covered with a particular feature to emphasize that quality (e.g., statues of Artemis were covered with breasts to emphasize fertility). Cp. *Ezek 1:18*.\n\n
4:7	idm171286					 These four creatures symbolize four types of beings: **a lion** represents wild animals, **an ox** represents domesticated animals, **a human** represents humanity, and **an eagle** represents the birds (cp. *Ezek 1:10*). These four figures are drawn from *Ezek 1* (cherubim) and *Isa 6* (seraphim). They probably represent the best of creation as worshiping God. Missing from this worldwide orchestra are fish, which ancient people associated with the evil sea (see *Rev 21:1*), and insects, represented by locusts in the evil kingdom (see *9:1-11*).\n\n
4:8	idm171301					 **day and night:** The four beings ceaselessly praised God’s basic characteristics: his holiness, his power (**the Almighty**), and his eternity (see *study note on 1:4*). • **Holy, holy, holy** comes from *Isa 6:3* and is the highest worship affirmation in Scripture. To double something makes it emphatic; to triple it makes it ultimate.\n\n
4:9	idm171312					 The antiphonal chorus of twenty-four elders provides divine perspective on creation. • **The one sitting on the throne** is typical Jewish indirection to avoid speaking God’s name.\n\n
4:11	idm171319					 **You are worthy:** This phrase is never used of God in the Old Testament but was frequently used in Rome during emperor worship. As emphasized here, only God deserves worship. • **you created all things:** Many in the ancient world believed that the gods were too busy to be concerned with humans. But God is Almighty in more than a philosophical sense; he is involved as Creator and **Lord**. In Revelation, creation affirms that God is in sovereign control of the world (see *3:14*; *10:6*; *14:7*; *21:1*). • **they exist because you created what you pleased:** God had a purpose for everything that he created.\n\n
5:1	idm171333					 John introduces the Lamb, Jesus Christ, the central figure of Revelation and God’s chosen agent for accomplishing his purposes.\n\n
5:1	idm171339					 The **scroll***,* like a dramatic script, details God’s plan for the world (*Ps 139:16*). • **The right hand** represents God’s gracious authority and power (see *Rev 1:17*, *20*). • The **writing on the inside and the outside** means that God’s plans for history are full and complete. • **sealed with seven seals:** God has put his purposes for history in an impermeable safe (*Isa 29:11-12*; *Dan 8:26*). His purposes will be completed only when the seals are broken (see *Rev 5:4*).\n\n
5:2	idm171356					 At first, **no one** in the entire universe seemed to have the divine authority or power to answer the angel’s call.\n\n
5:4	idm171363					 John wept because even though the revelation had been promised to him, he thought he would be denied knowledge of the divine script—God’s plan for history (*4:1*; see *10:4*). John’s weeping highlights the significance of the anticipated revelation.\n\n
5:5	idm171371					 Designations for Jesus as **the Lion of** *. . .*** Judah** (see *Gen 49:9-10*) and **the heir to David’s throne** (see *Isa 11:10*) are Old Testament metaphors for the Messiah (see *Jer 23:5*; *30:9*; *John 7:42*). • Because Jesus **won the victory** at the cross (*John 16:33*), he is the only one **worthy to open the scroll** and reveal God’s purposes (*Rev 4:11*; *5:2*, *12*). God’s plan for history centers around Jesus and what he has done. His relationship to the scroll indicates his control of history.\n\n
5:6	idm171392					 The Jews expected the Messiah to appear as a conquering lion. Instead, Jesus came as **a Lamb** (*John 1:29*, *36*; *Acts 8:32-35*; *1 Cor 5:7*; *1 Pet 1:19*). The Lamb that **had been slaughtered** but **was now standing** refers to Jesus’ death and resurrection. • The Lamb’s **seven horns** represent his complete power, and the **seven eyes** represent his complete knowledge (see *Zech 4:10*). He is also fully related to the perfect **Spirit of God** (*Rev 1:4*).\n\n
5:8	idm171411					 **fell down before the Lamb:** The crucified and risen Christ has divine authority to initiate the events of this age; he is fully worthy of worship. • The **prayers of God’s people** become a significant basis for the judgments and plagues (*6:9-11*; *8:2-5*).\n\n
5:9	idm171421					 The whole created order joins in **a new song** of praise to the Lamb (cp. *14:1-5*; *Ps 149:1*; *Isa 42:10*). • The Lamb is **worthy** because, through his sacrifice, he won the right to **break** the **seals** of the **scroll** and enact God’s purposes in history. • The song summarizes the implications of the Good News about Jesus (*1 Pet 1:18-25*).\n\n
5:10	idm171436					 The description of God’s people as **a Kingdom of priests** who will enjoy ultimate victory and will **reign** with Christ reflects the images of Jesus as both King (*Rom 1:3*) and High Priest (*Heb 6:20*).\n\n
5:11	idm171446					 A huge angelic **chorus** numbering **thousands and millions** provides an antiphonal response; all heaven responds to creation’s confession of Christ’s sacrifice.\n\n
5:12	idm171454					 This doxology ascribes to Jesus divine honors that are reserved for God alone (see *4:11*; *5:13*; *7:12*).\n\n
5:13	idm171463					 The second antiphonal response resounds from **every creature***,* even those **under the earth** (the place of the dead) and **in the sea** (usually associated with evil), possibly implying a mandatory response even by those in rebellion against God (*Isa 45:23-25*; *Rom 14:11*; *Phil 2:10-11*).\n\n
5:14	idm171476					 The dramatic introduction of **the Lamb** (*5:1-14*) closes with the **living beings** (*4:6-9*). Their **Amen** affirms the truth of what John had seen, as **the twenty-four elders** prostrate themselves in worship.\n\n
6:1	idm171488					 Three sets of seven judgments—the seals, trumpets, and bowls—form the core of Revelation. Some suggest that the judgments form a chronological sequence from beginning to end, with each set of judgments flowing from the seventh judgment of the previous set for a total of twenty-one successive judgments. More likely, the relationship is cyclical (as in other Jewish apocalyptic works; cp. *Dan 2*, *7*, *8*, *11*), with each set conveying increasing intensity and adding new details of God’s judgment on those who rebel against him. In this perspective, all three cycles end at the same chronological point, with the return of Christ.\n\n
6:1	idm171498					 The Lamb breaks the seven seals to reveal the significance of history from God’s perspective.\n\n
6:1	idm171504					 The four horses and their riders (see *Zech 1:8-11*; *6:1-8*) sum up the power structures of the world; their activities primarily lead to war, violence, economic imbalance, and death. It is pointless to put our hope in these power structures.\n\n
6:2	idm171512					 While some have understood the **rider** on **a white horse** to be Christ, as in *19:11*, the only similarity between these two images is the horse. The four riders represent the destructive, senseless world and show no redeeming qualities. • The **bow** was typical Greco-Roman military hardware; here it is a symbol of war. • **win many battles . . . gain the victory:** The double use of the Greek word nikaō (conquer) confirms that this rider is powerful. The focus on war and conquest illustrates human depravity.\n\n
6:3	idm171524					 The **red** horse represents bloody violence on the earth. Although peace was what the Roman Empire promised (the *pax Romana*), widespread violence was the horrible reality. This rider represents **slaughter***,* including civil upheavals and ethnic cleansing.\n\n
6:5	idm171534					 The **black horse** represents economic and social dysfunction, indicated by **scales** used in commerce. Rampant inflation is shown by the cost of the staples of life: **A loaf of wheat bread or three loaves of barley will cost a day’s pay**. Yet the prices of luxuries such as **oil and wine** would remain unchanged. It is an image of social and economic imbalance.\n\n
6:7	idm171544					 With **the fourth seal** comes a ghastly looking horse. In the ancient world, **pale green** was the color for depicting a corpse. • **the Grave:** Greek *Hades.* In Greek thought, Hades was the underworld abode of bodiless beings. The Hebrew idea of *Sheol,* the place of the dead (*1 Sam 28:15*), was similar. • The killing of **one-fourth** of those on earth indicates that the final judgment has not yet arrived (contrast *Rev 6:16-17*). • This fourfold set of woes (**sword and famine and disease and wild animals***;* cp. *Ezek 14:21*) summarizes the tragedies of earthly existence. The world cannot offer hope to humanity.\n\n
6:9	idm171561					 In counterpoint to the world’s destructive ways (*6:1-8*), **the fifth seal** introduces Christian martyrs who ask how God intends to deal with evil.\n\n
6:9	idm171569					 Rather than follow the world’s destructive ways, the martyrs gave their lives **for the word of God**.\n\n
6:10	idm171576					 The martyrs **shouted** to the **Sovereign Lord** because they trusted in his power to redress their grievances. • **how long:** Is God slow to act? Will justice be done? God does act decisively (see *6:12-14*); his wrath (*6:16-17*) must be understood in terms of justice, fairness, and righteousness (see *Exod 34:5-7*; *Neh 9:17*; *Pss 103:8*; *145:8*; *Joel 2:13*; *Jon 4:2*; *Rom 2:6-11*). • **avenge our blood:** This cry for God’s justice follows the pattern of imprecatory (vengeance) psalms (see *Pss 6:3*; *74:10*; *79:5*; *80:4*; *137:1-9*). It also reflects the covenant curses of *Deut 28:53-57*; *32:35* (quoted in *Rom 12:19*).\n\n
6:11	idm171603					 **A white robe** is symbolic of the martyrs’ victory and of God’s full acceptance. • **they were told to rest:** Death is a state of rest (cp. *John 11:11-12*) in which martyrs await God’s justice. • **the full number:** Only God knows how many Christians will be martyred before the end. In his sovereignty, God will fulfill his purposes through his children who are **martyred** and will vindicate them at the appropriate time. • **brothers and sisters:** Greek adelphoi; this term refers to people, both male and female, who are members of the same family.\n\n
6:12	idm171616					 The opening of **the sixth seal** offers a glimpse into the end of the created order.\n\n
6:12	idm171623					 These cataclysmic signs are associated in Scripture with the day of the Lord, when God’s judgment will overturn the whole created order (see *Isa 13:4-12*; *34:1-4*; *Joel 2:1-32*; *Zeph 2:1-3*; *Mark 13:1-37*).\n\n
6:15	idm171634					 **hid themselves:** In the face of God’s judgment, unredeemed people will be terrified and seek a safe hiding place, but in vain (*Isa 2:19-21*; *Ezek 38:20*; *Hos 10:8*; *Luke 23:30*). The prophets repeatedly warned that **the great day** would be a day of **wrath** and judgment (*Isa 13:6-11*; *Joel 1:15*; *Amos 5:18*; *Zeph 1:14-15*). • The ultimate question concerning God’s judgment is, **who is able to survive?** (*Mal 3:2*). God’s children will rejoice to see him (*Rev 5:13-14*; *14:3-5*) because they understand God’s response to the martyrs’ cry for vengeance (*6:9-11*), and they themselves have nothing to fear from God’s judgment (*Acts 10:34-36*; *Rom 5:1-2*). Those who have persecuted God’s people, however, will quake in fear as they face **the wrath of the Lamb**.\n\n
7:1	idm171659					 Three interludes occur in chs *6–14* (ch *7*; *10:1–11:14*; *12:1–14:20*) to define the place of God’s holy people and to provide perspective on the previous scenes. In this first interlude before the seventh seal is broken, two visions communicate how God protects his people and assures them of his calling.\n\n
7:1	idm171669					 The interlude’s first vision shows how God protects his faithful followers from ultimate **harm**.\n\n
7:1	idm171676					 **Wait!** God calls for a temporary halt by the **four angels** of destruction. • **The seal of the living God** implies membership in God’s household; God owns and protects his people (*2 Cor 1:22*; *Eph 1:13-14*). In the ancient world, sealing or tattooing was a sign of ownership. • The **angel** *. . .*** carrying the seal** identified God’s people, answering the question of who would survive God’s wrath (*Rev 6:17*; see *Ezek 9:3-8*; *John 17:14-15*) and furthering the promise of protection (*Rev 3:10*; see also *11:1-2*).\n\n
7:4	idm171695					 Who are the **144,000**? This listing of the **tribes of Israel** does not exactly correlate with the twelve physical tribes. Instead, it communicates that God knows precisely which people on earth belong to him. By the AD 90s, Israel’s twelve tribes no longer existed; ten tribes were dispersed when Assyria conquered the northern kingdom of Israel (*2 Kgs 17:1-41*). The early Christian church regarded itself symbolically as the Israel of God (*Matt 19:28*; *Rom 2:28-29*; *9:6-8*; *Gal 3:29*; *6:16*; *Phil 3:3*). The *144,000* probably represent all faithful Christians (cp. *Rev 14:1-5*; *21:12-17*). The list begins appropriately with Judah (the royal tribe of Jesus) but substitutes Manasseh (one of the two tribes of Joseph) for Dan. The tribe of Dan fell into idolatry (*Judg 18:14-31*; *1 Kgs 12:25-30*), and early Christians regarded it as the epitome of evil.\n\n
7:9	idm171716					 The interlude’s second vision shows heaven with an innumerable crowd rejoicing because they are secure in Christ and all tears and sorrows have ended.\n\n
7:9	idm171722					 This **vast crowd** of believers (*7:14*) is **too great to count***,* fulfilling God’s promises to Abraham (*Gen 15:5*; *17:4-5*; *Rom 4:16-24*; *Gal 3:29*). • **White robes** (*Rev 6:11*) and **palm branches** (*John 12:13*) are ancient symbols of victory and success, adding to the celebration that occurs after God ends the hostile world.\n\n
7:10	idm171740					 Ancient victory parades, heralding the accomplishments of conquerors, included loud chants. The shout of **Salvation** (“victory,” “deliverance”) honors God’s triumph and prepares readers for his reign.\n\n
7:11	idm171747					 The **angels***,* **elders***,* and **four living beings** all prostrated themselves before God and responded together in a sevenfold (i.e., comprehensive) doxology to recognize God’s eternal nature. The doxology is preceded and followed by **Amen**—a powerful affirmation of God’s victory.\n\n
7:14	idm171759					 **who died in** (literally *who came out of*): See *6:9*; *20:4*. • **the great tribulation:** A time of horrible and distressing events (see *1:9*; *2:9-10*; *Deut 4:30-31*; *Matt 24:21-22*; *Acts 14:22*). • **They have washed their robes in the blood of the Lamb:** This description symbolizes Christ’s redeeming death for them. • **made them white:** This description expresses their victory over sin and death and their acceptance by God into eternal life.\n\n
7:15	idm171777					 **serve him day and night:** Service to God is the continual duty of Christians. • God’s **Temple** symbolizes his presence (also *11:19*; cp. *21:22*).\n\n
7:16	idm171787					 For desert-dwellers, **life-giving water** and relief from the scorching **sun** represent paradise (see also *21:6*; *22:1*, *17*; *Ps 23:1-2*; *Ezek 47:1-12*; *John 7:37-38*). • **on the throne** (literally *on the center of the throne*): The **Lamb** is closely identified with God. • Christ’s designation as the **Shepherd** of God’s people (cp. *Ps 23*; *Matt 15:24*; *John 10:3*, *11*, *14*; *Heb 13:20*; *1 Pet 2:25*) means that he protects and provides for the sheep, bringing hope and salvation to his people (see *Ezek 34:11-16*, *23-24*).\n\n
8:1	idm171814					 The opening of **the seventh seal** concludes the first act and dramatically initiates **silence***,* which suggests the mystery of God in his dealings with the world (*10:4*; *1 Kgs 19:11-12*). Perhaps the mysterious silence here is analogous to God’s rest on the seventh day of creation (*Gen 2:1-3*; see also *Heb 4:1-11*). • **half an hour:** This brief hush precedes the unfolding of the second act of divine judgment when God will answer the prayers of his people.\n\n
8:6	idm171828					 The second cycle of judgments is structured around **seven trumpets**. Like the first cycle (*6:1–8:1*), this one contains an interlude (*10:1–11:14*; cp. *7:1-17*) and ends with a glimpse of God’s eternal Kingdom (*11:15-19*; see *7:9–8:1*). • The trumpet judgments are reminiscent of the ten plagues of Egypt (*Exod 7:14–11:10*) and have the same purpose—to show the powerlessness of earthly gods (or satanic powers) and to demonstrate beyond doubt the power and sovereignty of God.\n\n
8:2	idm171841					 This scene of preparation in heaven introduces the seven trumpets of judgment and continues the theme of God’s receiving and answering prayer (*5:8*; *6:9-11*).\n\n
8:2	idm171849					 The dramatic sounding of **trumpets** by **angels** heralds an approaching end (see *Isa 27:13*; *Zech 9:14*; *Matt 24:31*; *1 Cor 15:52*; *1 Thes 4:16*).\n\n
8:3	idm171862					 **The prayers of God’s people** ask for God’s ultimate justice and judgment (*6:10-11*; see also *5:8*; *Ezra 9:5-6*; *Ps 141:2*; *Dan 9:21*). The mixture of **incense** and **prayers** that reaches God’s presence shows that God hears their prayers (see *Rev 6:9-11*) and is prepared to act.\n\n
8:5	idm171877					 The action of **the angel,** as he throws **fire** *. . .*** down upon the earth,** signals the dramatic beginning of God’s judgment (see *Gen 19:24*; *Exod 9:23*; *Lev 10:2*; *Deut 9:3*; *2 Kgs 1:10*). • **thunder . . . lightning . . . earthquake:** These earthly portents remind us of God’s power, presence, and judgment (also *Rev 11:19*; *16:18*; see *Exod 19:18-19*; *1 Kgs 19:11-12*; *Isa 29:6*).\n\n
8:7	idm171898					 Each of the first four trumpets affects **one-third** of its target (see *Ezek 5:1-4*, *12*; *Zech 13:8*). The point is not to convey an exact measurement; instead, it indicates that God’s judgment on the earth is beginning but has not reached its zenith. Together, the first four trumpets form a unified message of judgment on the whole physical world (as with *Rev 6:1-8*).\n\n
8:7	idm171909					 **Hail and fire mixed with blood** signal the destruction of plant life, as did the seventh plague on Egypt (see *Exod 9:13-35*; *Joel 2:31*; *Acts 2:19*). • **all the green grass was burned:** Nothing escapes God’s judgment. • This vision need not be harmonized with *Rev 9:4* because each scene is self-contained and communicates its own message.\n\n
8:8	idm171921					 **water . . . became blood:** This judgment is similar to the first plague on Egypt (see *Exod 7:14-25*; *Ps 78:44*). • The **mountain of fire** suggests something similar to the eruption of Mount Vesuvius in AD 79 that brought bloody destruction to ships and sea life (see Pliny the Younger, *Letters* 6.16.1-22).\n\n
8:10	idm171933					 The **star** named **Bitterness** (literally *wormwood,* a shrubby plant yielding a bitter extract) is symbolic rather than physical. Bitter water is connected with judgment from early in Israel’s national experience (*Exod 15:22-26*; *Num 5:18*; *Jer 9:13-16*; *23:15*). The message is that wide-scale judgment has begun.\n\n
8:12	idm171946					 **the fourth angel:** On the fourth day of creation, God made **the sun** *. . .*** the moon, and** *. . .*** the stars** (*Gen 1:14-19*). • **the day was dark:** This judgment replicates the ninth plague in Egypt (*Exod 10:21-23*).\n\n
8:13	idm171961					 The ancients regarded the **eagle** as a symbolic messenger of God (see *4 Ezra* 11:7-8; *2 Baruch* 77:19-26). • **Terror, terror, terror:** A threefold announcement would be recognized as a message from God (see *Acts 10:16*). • The **terror** (Greek *ouai*) that sounded like an eagle’s screech was directed against humans of **this world** who were not among God’s faithful people (*Rev 6:10*; *9:4*, *20*).\n\n
9:1	idm171978					 The fifth and sixth trumpets demonstrate how God’s judgment affects the people of the world and detail how futile it is to resist God. While these judgments should lead to repentance, they do not. Sin has such control over people that they choose to worship the evil forces that torture and murder them rather than repent and turn to God.\n\n
9:1	idm171984					 The **fifth** *. . .* **trumpet***,* the first of the three terrors (*8:13*), brings the judgment of locusts from **the bottomless pit**, a place of horror. Ancient cultures viewed the oceanic depths, or the “abyss,” as a dwelling place of demonic forces (see *study note on Gen 1:2*).\n\n
9:2	idm171997					 **The smoke** from the pit turned the sky **dark***,* as in the plague on Egypt (*Exod 10:21-29*; see *Matt 27:45*).\n\n
9:3	idm172008					 The **locusts** *. . .* **from the smoke** with their **power to sting like scorpions** are fiercer than those of the Egyptian plague (see *Exod 10:14-15*). Rather than eating plants, these locusts are like stinging **scorpions** that viciously attack people. Only people without the **seal of God** (see *Rev 7:1-8*) receive this painful judgment. While the stings cause painful torture, they are not life-threatening (*9:5-6*).\n\n
9:5	idm172023					 **torture them for five months:** This time period is a symbolically complete number based on the fingers on a hand. It is also the normal life span of locusts, suggesting that their entire purpose was to torture people.\n\n
9:7	idm172030					 While some see these **locusts** as symbolic of attack helicopters, missiles, or other modern armaments, they come from the “bottomless pit” rather than from human engineering. The description of these creatures, derived from the physical appearance of locusts, is intended to cause revulsion and terror. • Their **gold crowns** indicate that their torment dominates much of the earth.\n\n
