Reference	ID	Tags	SupportReference	Quote	Occurrence	Note
9:11	idm172038					 The **king** of the locusts is identified in three ways: (1) as **the angel from the bottomless pit** (probably different from the fallen star, *9:1*, who unlocked the abyss rather than coming from it); (2) as **Abaddon** (“destruction”), often paired with death (see *Job 28:22*; *Ps 88:11*); and (3) as **Apollyon**—**the Destroyer** (see *1 Cor 10:10*). • Although John makes no direct connection between the devil and this king of the locusts, the prince of demons is linked with Satan in the Gospels (*Mark 3:22-26*; see *Matt 12:24-27*; *Luke 11:15-18*). The New Testament also identifies the devil as the prince of this world (*John 12:31*; *14:30*; *16:11*) and as the prince of the power of the air (*Eph 2:2*), so he probably represents Satan. There is also a connection with the Roman emperor Domitian, whose patron god Apollo was symbolized by the locust.\n\n
9:13	idm172060					 The **four horns of the gold altar** (see *8:3*) are introduced with the sixth trumpet blast. Many excavations have uncovered altars with pointed horns at their four corners (see *study note on Exod 27:2*). • The **voice** carries the authority **of God** in the command to **release the four angels**. • These angels have been **bound***,* suggesting their evil nature (cp. *Rev 20:2*; *1 Enoch* 10; contrast *Rev 7:1*). Their location **at the great Euphrates River** probably refers to Assyria and Babylon, empires that had devastated the kingdoms of Israel and Judah and thus were symbols of destruction (see *2 Kgs 17:22-24*; *25:1-11*).\n\n
9:15	idm172080					 **hour and day and month and year:** The fourfold time designation for releasing **the four angels** confirms that even evil forces must observe God’s timing.\n\n
9:16	idm172088					 The relationship of the four angels to **their army** is not clear. • **200 million:** This figure represents an innumerable multitude. Even at its greatest strength, the ancient Roman army with twenty-one legions numbered only about 126,000 soldiers. It is unproductive to use this number in attempting to identify any specific country with such an overwhelming destructive force.\n\n
9:17	idm172096					 The **riders** had **armor** in colors that matched the **plagues** of their horses, with **red** for **fire***,*** blue** for **smoke***,* and **yellow** for **sulfur**—all of which are signs of judgment in Scripture (see *14:10-11*; *19:20*; *Gen 19:24-28*; *Ps 11:6*; *Ezek 38:22*; *Luke 17:29*). • The **horses** are reminiscent of the terrifying monsters of Greek tales pictured on ancient buildings and celebrated in ancient dramas. • **One-third:** See *study note on Rev 8:7-12*.\n\n
9:20	idm172122					 Even when humans are faced with **plagues** and death, repentance is not automatic. People tend to continue in their **evil deeds** and to **worship demons and idols**—things that belong to the created order—rather than worshiping the Creator (see *13:4*; *14:9-10*; *Rom 1:25*; *1 Cor 8:4*; *10:19-22*). • **murders . . . witchcraft . . . immorality . . . thefts:** What people worship parallels the ways in which they live (see *Rev 21:8*; *22:15*; *Rom 1:23*, *29-32*). • Revelation portrays the extent to which depravity controls unbelievers. It is not logical for people to worship powers and beings that torture and kill them; the powers of sin and rebellion against God are deceptively captivating.\n\n
10:1	idm172141					 This interlude between the sixth and seventh trumpets is divided into two parts: (1) the seven thunders and the small scroll (*10:1-11*), and (2) the two witnesses (*11:1-13*). The interlude ends with the announcement that the second terror is finished (*11:14*).\n\n
10:1	idm172150					 **another mighty angel** (see *5:2*; *7:2*; cp. *1:12-16*): This angel appears similar to the huge bronze Colossus that stood as a symbol of human power in the harbor of Rhodes for several decades before it was toppled by an earthquake in the late 200s BC. The statue still lay broken at the time that John wrote Revelation. It was about 100 feet tall and represented the sun god, Helios. The angel was **surrounded by a cloud***,* suggesting that he dwarfed the Rhodes statue and, by implication, all idols. The **rainbow over his head** is a reminder that the enthroned God is encircled by a rainbow (*4:3*), a biblical symbol of God’s covenant with humanity (*Gen 9:8-17*).\n\n
10:2	idm172166					 Although the **scroll** is **small***,* it is not unimportant. It reveals a small yet critical part of God’s purposes in events still to come before eternity begins. • **he gave a great shout:** Cp. *Job 37:2-5*; *Ps 18:13*; *29:3-4*.\n\n
10:4	idm172179					 Revelation reveals God’s intentions in the world without eliminating the mystery of God’s ways. The martyrs did not receive an immediate answer to their cries (*6:10*), the meaning of the seventh seal is cloaked in silence (*8:1*), and here **the seven thunders** are kept **secret** (cp. *Dan 12:9*).\n\n
10:5	idm172190					 While raising one’s **right hand** is common in taking **an oath** today, it is rare in biblical literature (cp. *Gen 14:22*; *24:9*; *Dan 12:7*). • When making an oath, Jews were very careful not to swear lightly by God’s **name** (see *Exod 20:7*). Jesus also rebuked insincere oath-taking (see *Matt 5:33-37*; *23:16-22*). When God swore an oath, he did so in his own name as the highest possible point of reference (see *Gen 22:16*; *Ps 89:35-36*; *Jer 22:5*; *Heb 6:13-18*).\n\n
10:7	idm172209					 **angel blows his trumpet:** See *1 Cor 15:51-54*; *1 Thes 4:16*. • **God’s mysterious plan** for the world is no surprise; **the prophets** who served God in the past warned that the day of the Lord would come (see *Joel 2:1-3*, *10-11*; *Amos 5:18-20*; *Zeph 1:14-18*).\n\n
10:8	idm172224					 As in Ezekiel’s experience, the **scroll** tasted **sweet** in the **mouth** (*Ezek 3:1-3*; see *Jer 15:16*; see also *Pss 19:10*; *119:103*). The experiences yet to come for God’s people would be sweet, including the victory of God’s plan and the vindication of his people. John’s **sour** *. . .*** stomach** resembles the effects of Ezekiel’s hard message for Israel (*Ezek 3:8-9*). The process of bringing God’s plan to fruition involves hardship.\n\n
10:11	idm172241					 Unlike Ezekiel, who prophesied for Israel alone, John **must prophesy** *. . .*** about** (or *against*) all the people of the world. There is debate whether “about” or “against” is the best translation; “about” allows for both promise and judgment (see both in *21:24-27*).\n\n
11:1	idm172252					 This section pictures the willful rejection of God’s continuing call for repentance. The many attempts to silence his witnesses ultimately fail, and God triumphs. • Many attempts have been made to identify the **two witnesses** of this chapter. Moses and Elijah, who appeared with Jesus at the transfiguration (*Matt 17:3*; *Mark 9:4*; *Luke 9:30*), are likely candidates (see *Rev 11:6*); they represent the law and the prophets. Others have suggested Enoch and Elijah because they did not die (see *Gen 5:21-24*; *2 Kgs 2:11-12*). Other possibilities include Peter and Paul, or James and John. More important than their identities is their role of confirming God’s message by the testimony of “two or three witnesses” (see *Deut 17:6*). God provides a twofold witness to the world about the impending judgment, making it clear that his word is certain to be fulfilled (*Deut 19:15*; *Matt 18:15-16*).\n\n
11:1	idm172268					 The instructions to **measure the Temple** are reminiscent of Ezekiel’s visions (see *Ezek 40–42*; *43:13-17*). The Jerusalem Temple was destroyed by the Romans in AD 70; these details symbolize God’s precise knowledge of and care for his people who belong to him (cp. *Rev 7:2-4*; *Zech 2:1-5*).\n\n
11:2	idm172280					 **The outer courtyard** in the Jerusalem Temple, outside the stone warning fence, was regarded as the place for the Gentile **nations**. John makes a clear distinction between the people God recognizes and those he does not. • The **42 months** and **1,260 days** refer to a period of three and a half years, or a broken seven (see study notes on *Dan 7:24-25*; *8:26*; *9:24-27*). John repeatedly uses these time designations in Revelation when persecution is evident and evil appears to dominate the world. God’s people will be secure in him (see *study note on Rev 11:1*) even though God allows evil forces to persecute them (see *13:7*; *Mark 10:30*).\n\n
11:3	idm172296					 During the period of persecution, God will not abandon the world but will send his **two witnesses** to proclaim the coming judgment, just as God sent Jonah to Nineveh (*Jon 1:2*; *4:11*). • Clothing made of **burlap** was symbolic of mourning or repentance (see *Gen 37:34*; *2 Sam 3:31*; *Neh 9:1*; *Esth 4:1*; *Jon 3:6*).\n\n
11:4	idm172311					 **two olive trees and . . . two lampstands:** See *study note on 1:12*; see also *Exod 25:31-40*; *Zech 4:2-6*.\n\n
11:5	idm172321					 In one of the psalms, God is portrayed with **fire** coming from his mouth, a picture of judgment on his enemies (*Ps 18:8*; see also *2 Sam 22:9*). Cp. Elijah, *2 Kgs 1:1-15*.\n\n
11:6	idm172331					 These two witnesses were given **power** to stop the **rain** and bring down plagues, as were Elijah (see *1 Kgs 17:1*; *18:41-46*) and Moses (see *Exod 7:14-24*; *8:1–11:10*).\n\n
11:7	idm172343					 When the witnesses finish **their testimony***,* the scene changes dramatically. **The beast** (cp. *13:1*) is introduced for the first time; it is associated with **the bottomless pit**. Like all enemies of God, the beast engages in **war** against God’s witnesses, and he kills them.\n\n
11:8	idm172355					 **their bodies will lie in the main street:** Evil is so vindictive that it even desecrates the dead. • **Jerusalem** (literally *the great city*): The designation “the great city” would have immediately suggested Rome to early readers (*16:19*; *17:18*; *18:10*, *16*, *18-19*, *21*). But John also describes it as the city **where their Lord was crucified** as well as **Sodom** and **Egypt**—all places that were hostile to God and his people (see also *17:5*, *9*). • **where their Lord was crucified:** There is a direct connection between how the Lord was treated by evil forces and the experience of persecuted Christians (see *Acts 9:5*).\n\n
11:9	idm172377					 Leaving people’s **bodies** out for public display was a way to dishonor them after their death (see *1 Sam 31:10*; the usual Roman custom was to leave bodies hanging after crucifixion). • **peoples, tribes, languages, and nations:** All the peoples of the world are represented in this exhibition.\n\n
11:10	idm172386					 **All the people . . . will gloat** and **celebrate:** God’s enemies despise and reject his messengers.\n\n
11:11	idm172394					 The death of the two witnesses is not the end of their ministry. God was not defeated in the death of Jesus and he will not be defeated in the slaughter of his witnesses. The God of the resurrection **breathed life** into the dead so that they **stood up** (see *Ezek 37:3-5*, *10*), leaving no doubt about God’s power. • **Terror struck:** It is a fearful experience for sinful humans to face the power of the living God (see *Heb 10:31*).\n\n
11:12	idm172406					 **they rose to heaven in a cloud:** The event is reminiscent of the ascent of Jesus (see *Acts 1:9*) and others (see *2 Kgs 2:11-12*; *1 Thes 4:17*).\n\n
11:13	idm172416					 An **earthquake** often accompanies key moments in biblical history (see *Exod 19:18*; *1 Kgs 19:11-12*; *Matt 27:51*). • **Seven thousand:** The number who **died** shows God’s involvement in judgment (contrast *1 Kgs 19:18*). • **everyone else . . . gave glory to the God of heaven:** Those who survived the earthquake were forced to acknowledge God’s power and sovereignty over the world (see *Phil 2:9-11*).\n\n
11:15	idm172431					 The **seventh** trumpet (“the third terror,” *11:14*; see also *9:12*) presents a scene of final judgment and the eternal Kingdom. As in *7:9-17*, this scene provides a dramatic window into the ultimate Christian hope with God. In the midst of a picture of judgment, the reader is reminded of eternity with God.\n\n
11:15	idm172441					 **Loud voices** in the court of **heaven** sing a victory hymn; the earth has been transformed into the realm of **our Lord** and **his Christ***,* who is enthroned as king **forever**.\n\n
11:16	idm172453					 **The twenty-four** **elders***,* representing the people of God, confirm God’s victorious enthronement (see *study note on 4:4*). Their worship acknowledges God’s sovereign rule as **the Almighty** (see *4:10-11*; *5:8-10*).\n\n
11:17	idm172466					 The thanksgiving prayer describes God as **the one who is and who always was***;* the description “is still to come” (see *1:4*, *8*) no longer applies, because in this scene eternity has come and God has **begun to reign**.\n\n
11:18	idm172477					 **The nations were filled with wrath** when they refused to do as God commanded (see *Ps 2*). But things will **now** be different because God’s **wrath has come**. God will **reward** his **holy people** (see *Rev 22:12*) with new life as his children (see *John 1:12*; *20:31*). • **fear your name:** God’s name implies his nature; fearing God’s name means accepting who he is (see “*Fear of the Lord*” Theme Note). • The end of the age will be the **time to destroy** those who have not accepted God’s love (see *John 3:16-20*). They will go into the lake of fire (*Rev 20:15*). This doom of God’s enemies is the third and final terror (*11:14*).\n\n
11:19	idm172498					 This verse provides a dramatic conclusion to the first half of Revelation and a link to the second half. • In this scene, the **Temple** and the **Ark** are symbols of God’s presence; the earthly Ark was the copy of the design of the Ark in heaven (see *Exod 25:40*; *Heb 8:5*).\n\n
12:1	idm172508					 The people of God, portrayed as a woman who brings forth the Messiah, are under attack by the devil even though he has already been defeated (*12:1-17*). With his two minions, the beast and the false prophet, Satan attempts to continue controlling the world (*13:1-18*) before the final confrontation with the Lord (*14:1-20*).\n\n
12:1	idm172517					 Satan (pictured as a dragon) plots to challenge God’s purposes but is thwarted. Having failed in direct confrontation with God and Christ, he attempts to attack God’s people. Three brief scenes present an overview of the story (*12:1-6*), followed by elaborations of the war in heaven (*12:7-9*) and the war on earth (*12:13-17*).\n\n
12:1	idm172526					 The number **twelve** suggests that the **woman** represents God’s people (cp. *12:15-17*; see *Jer 2:32*; *2 Cor 11:2*; *Eph 5:32*), from whom came the Messiah. This woman is marked by God’s glory in contrast with the prostitute (see *Rev 17:1-6*), who is destined for destruction.\n\n
12:2	idm172539					 The symbolic woman going through the **agony** of **labor** portrays Christ’s birth, reflecting the biblical theme of Israel’s trauma while waiting to be delivered (see *Isa 26:16-18*; *Jer 4:31*; *Mic 4:9-10*; *John 16:21*).\n\n
12:3	idm172551					 The **large red dragon** represents Satan (see *12:9*). • **seven heads and ten horns:** The numbers represent a mixture of divine and created powers (see *17:7-14*). • The historic battle between evil and the people of God is staged in cosmic dimensions (see *Gen 3:1-7*, *14-15*; *Job 1:9-12*). • Herod’s desire to kill Jesus embodied Satan’s attempt **to devour her baby** after **it was born** (see *Matt 2:7-8*, *16*).\n\n
12:5	idm172568					 Jesus was the **son who was to rule all nations** (see *Luke 1:31-33*; *2:30-32*; cp. *Ps 2:6-12*). • Although Jesus was killed by agents of the devil, he was **snatched away from the dragon** and raised from the dead (*Matt 28:6*; *Mark 10:33-34*; *16:6*; *1 Cor 15:3-4*). Jesus’ entire life on earth, from his birth to his death and resurrection, is compressed into this scene. • **caught up to God and to his throne:** See *Acts 1:9-11*.\n\n
12:6	idm172585					 Like the people of Israel who were spiritually refined in **the wilderness** (see *Hos 2:14-15*; *Acts 7:38-45*) and in exile (see *Isa 5:13*; *Ezek 12:1-3*), the Christian church must face its own wilderness. Revelation presents messages of endurance and perseverance in the face of trouble and shows that God provides places of refuge and avenues of escape for his people (cp. *1 Cor 10:13*). **1,260 days:** See *study note on Rev 11:2-3*.\n\n
12:7	idm172599					 This scene clarifies the dragon’s identity and power. • God dispatches **Michael***,* the warrior archangel (see *Dan 12:1*; *Jude 1:9*), to confront **the dragon and his angels**. God does not have to engage in the battle himself (see *Matt 26:53*), and Satan is defeated.\n\n
12:10	idm172611					 Satan’s defeat is encouraging for Christians who, like the recipients of Revelation, are not **afraid to die** (see *John 12:24-26*).\n\n
12:13	idm172619					 **When the dragon realized:** The scene picks up from *12:9*.\n\n
12:14	idm172627					 **two wings . . . of a great eagle** (see *Exod 19:4-6*; *Deut 32:10-11*; *Isa 40:29-31*): God strengthens his people; he does not promise that they will escape persecution or death. • **a time, times, and half a time:** Usually understood as three and a half years (see *Rev 11:2-3*).\n\n
12:15	idm172639					 John pictures Satan as Leviathan (cp. *Job 41:1*) trying to destroy God’s people (the woman; see *study note on Rev 12:1*). The protective **earth** responds and the waters of chaos are contained, as at creation (cp. *Gen 1:2*, *6-7*, *9-10*).\n\n
12:17	idm172651					 The **dragon** turns his hostility against the woman’s **children** (believers) who **keep God’s commandments** and continue in **their testimony for Jesus**.\n\n
12:18	idm172661					 John portrays the dragon conducting its war (*12:17*) through two beasts who with Satan form an evil trinity.\n\n
12:18	idm172668					 **on the shore beside the sea:** By contrast, the Lamb stands on the rock of Zion (*14:1*).\n\n
13:1	idm172676					 The first beast is the second member of the evil trinity (see *study note on 12:18–13:18*) and should probably be identified with Roman power (see “*Four World Empires*” Theme Note).\n\n
13:1	idm172684					 The **beast** emerges from **the sea** (symbolizing evil). Like the dragon, it has **seven heads and** **ten horns** (see *12:3*). The **crowns** represent its political and military power (cp. *17:3*, *7-11*; *Dan 7:7*, *19-20*) and indicate that Satan is the head of this beast’s empire.\n\n
13:2	idm172700					 Satan makes the beast a pseudo-deity by giving it his **power***,* **throne***,* and **authority**. In the first century, Roman emperors increasingly claimed divinity.\n\n
13:3	idm172711					 Satan often imitates God. Here **the beast** mimics the death and resurrection of Jesus. • That **one of the heads** had been fatally **wounded** but **was healed** has led to its identification with Nero. A tradition emerged that the emperor Nero (AD 54–68) was so evil that he either did not really die or would be reincarnated as another tyrant like Domitian (AD 81–96). In *17:9-10*, the beast’s seven heads are linked both to *seven hills* (Rome) and to *seven kings.*\n\n
13:5	idm172726					 The four characteristics of **the beast** are that he (1) blasphemes God, (2) has **authority** for a limited time, (3) makes **war** against God’s people, and (4) rules the world. But God is in control.\n\n
13:5	idm172735					 The **forty-two months** are the three and a half years of persecution and evil domination (see *study note on 11:2-3*).\n\n
13:7	idm172743					 The beast’s **authority** extends over all the **people** of the world.\n\n
13:8	idm172751					 Those who **worshiped the beast** receive its mark (*13:15-17*) and are not listed in the **Book of Life** (see *20:12*).\n\n
13:9	idm172761					 The scene (*13:1-10*) ends with a dramatic conclusion patterned on *Jer 15:2*; *43:11*. **Anyone with ears to hear** must pay attention, because judgment is coming (cp. *Rev 2:7*, *11*, *17*).\n\n
13:10	idm172774					 **God’s holy people** are summoned to **endure** and **remain faithful** while experiencing temporary **persecution**.\n\n
13:11	idm172784					 **another beast:** This second beast, the third member of the evil trinity (see *study note on 12:18–13:18*), is later called the “false prophet” (*16:13*). As a high priest of false religion, he leads the world into worshiping the first beast and the dragon (see also *16:13-14*).\n\n
13:11	idm172794					 The **beast** is portrayed as **a lamb***,* the same symbol used to represent Christ (see *5:6-13*; *7:9-17*; *14:1-4*), but this lamb **spoke** like **a dragon**. The image is of a fraudulent messiah. • The **two horns** might stand for two emperors, perhaps Nero and Domitian.\n\n
13:12	idm172809					 The second beast derives its power from **the first beast**, which in turn answers to the dragon (*13:4*).\n\n
13:12	idm172817					 **he required . . . people to worship the first beast:** Imperial Rome demanded worship of the emperor Domitian. • **whose fatal wound had been healed:** This description might refer to Domitian, who was viewed as the reincarnation of Nero (see *study note on 13:3*). The image is a picture of the constant reemergence of evil, particularly in the latter days (see *study note on 17:8*).\n\n
13:13	idm172827					 In New Testament times, false prophets astounded people with reports of divine visitations and of idols speaking for the gods they represented (see *Acts 16:16-18*; *1 Cor 12:2-3*). Such practices involved worship of demons (see *1 Cor 10:20-21*) and were epitomized in the Roman emperor cult. Those who refused to conform were put to death.\n\n
13:14	idm172836					 **he was allowed. . . . He was then permitted:** God never relinquishes ultimate authority. These creatures of evil have been allowed to rebel against God, but they are not in control.\n\n
13:16	idm172843					 **small and great, rich and poor, free and slave:** All humanity is required to accept the beast’s evil **mark** of ownership (see *14:9*, *11*; *19:20*; *20:4*), a precondition for all commerce (the right to **buy or sell**). The text does not explicitly tell us what the mark is or looks like. • **On the right hand or on the forehead** suggests the branding of slaves—the beast owns them. • **the number representing his name:** In both Hebrew and Greek, letters of the alphabet represent numbers, which gave names a numerical value (*13:18*).\n\n
13:18	idm172859					 **Wisdom is needed:** John is giving a clue to help his readers **solve the meaning** of the beast’s **number**. • **of a man:** John hides the man’s identity, perhaps because revealing the name would place him and his readers in danger (cp. use of Babylon as a symbol for Rome, *17:9*). • The number **666** represents supernatural evil (see “*Symbolic Numbers*” Theme Note). John might have used the transliteration *Caesar Neron* (a Hebrew spelling of the name) to arrive at the number 666. Later scribes, who spoke Greek but not Hebrew, corrected the number to *616* in some manuscripts, probably to match the name’s numerical value in Greek.\n\n
14:1	idm172874					 The true **Lamb** and his followers starkly contrast with the evil trinity.\n\n
14:1	idm172881					 **standing:** See *5:6*; *study note on 12:18*. • **144,000:** God’s righteous remnant (see *study note on 7:4-8*). • The brand on **their foreheads** (contrast *13:16-17*) is the **name** of both **the Lamb** and **his Father***,* reflecting the union of Jesus and the Father (see *John 5:20-23*; *14:5-10*; *17:22*).\n\n
14:2	idm172901					 **This great choir sang a** . . . **new song** that only those **who had been redeemed from the earth** could **learn**. These people had died and were already with the Lord, which might explain why John did not include the content of their refrain for readers still in the battle of life (cp. *2 Cor 12:4*).\n\n
14:4	idm172912					 These warriors were ritually **pure** (unpolluted) and morally **without blame**. • **They have kept themselves as pure as virgins:** Referring to men as *virgins* is a metaphor for the faithfulness of God’s people. The image might refer to the church as the virgin bride of Christ (see *2 Cor 11:2*; *Eph 5:25-27*); it also suggests that the church constitutes soldiers in a holy war that are required to keep themselves chaste (see *Deut 23:9-10*; *1 Sam 21:5*). • These faithful people are **a special offering** (literally *firstfruits;* see *Exod 13:14-16*; *23:19*; *Lev 23:9-14*; *Num 3:40-51*; *18:15-20*; *Luke 2:22-24*) who **have been purchased** for God. • **They have told no lies:** John teaches that liars will never enter heaven (*Rev 21:8*, *27*; *22:15*; see also *John 8:44*). The followers of Jesus speak and live the truth (see also *John 8:32*; *14:6*).\n\n
14:6	idm172942					 Three angels are **flying through the sky** with messages from God.\n\n
14:6	idm172949					 The first **angel** proclaims **the eternal Good News***,* which includes the message that God **will sit as judge**—the end is near, so this message provides a last-chance summons to repentance.\n\n
14:8	idm172959					 **Babylon** is probably a cryptic designation for Rome (see *16:19*; *17:5-9*); it represents earthly power and corruption. The coming of God as judge (*14:7*) includes the end of earthly powers.\n\n
